Abstract,Ancillary_Data,Bibliographic_Type,ContentType,Contract_Grant_Number,Credit,Date_Resource_Created,Description,Descriptors_Topical,Descriptors_Geographic,File,File_Size,Inst_Author,Inst_Publisher,Inst_Sponsor,Language,Mime_Type,New_Thesaurus_Terms,Notes,Personal_Author,Primary_Subject,Publication_Date_Freeform,Related_Doc_Links,Report_Number,Series_Title,Title,Title_Translated,Unique_ID,URI,USAID_Geography,USAID_Project_Number
"Evaluation of joint programming and cooperation between the Peace Corps (PC) and A.I.D. in Africa.  At the time of the evaluation (12/89), therewere about 900 PC volunteers assigned to 63 A.I.D.- supported projects in 24 African countries. A major finding is that there is little true partnership between A.I.D. and the PC.  Instead, the principal focus of field cooperation is on resource sharing in the form of A.I.D. financial support for PC activities and PC participation in A.I.D.-supported projects.  Moreover, there is a great deal of ambivalence in both agencies about the desirability and feasibility of increasing A.I.D.-PC collaboration. This attitude can be attributed to the following:  (1) a lack of PC experience in project design, monitoring, and evaluation; (2) limited enthusiasm among PVO's for incorporating PC volunteers in their projects; (3) a perception among Mission staff that PC volunteers lack sufficient training for A.I.D. projects; (4) the shift towards nonproject assistance within A.I.D.; and (5) a lack of awareness within A.I.D. of the potential value of PC activities as precursors or successors to Mission projects. A.I.D. financing provides the bulk of PC project funding and has helped strengthen the capabilities of PC volunteers and their host country counterparts.  Small Project Assistance (SPA) funds are widely used and appreciated, but there are some PC volunteers and Mission staff who are not pleased with PC volunteers being seen by villagers as a source of funding.  Missions are generally not consulted on the use of Participating Agency Services Agreements (PASA's), and while PC must sign an agreement with A.I.D. to obtain SPA funds, the Missions generally have minimal involvement in the program administration.  Most PC Missions are not well informed about technical PASA's and A.I.D. Mission knowledge of PASA's is even less.  On the other hand, A.I.D. unduly limits the technical fields for which it will fund SPA projects and technical PASA's. There are many untapped opportunities for collaboration that would be in the interest of both agencies and would be supportive of host countries' development efforts.  The synergistic effect of improved and expanded collaboration would be greater than the sum of benefits to each agency.  This would be reflected in the overall impact of the U.S. government development effort in the host country and in a more rational use of taxpayers' dollars.","","Special Evaluation","Documents","PDC-5371-I-00-8122-00","","12/1/1989 12:00:00 AM","","Donor coordination|Development organizations|Development project design|Development finance","Africa south of Sahara","http://pdf.usaid.gov/pdf_docs/PDABB988.pdf","7,247 KB","003970 - Management Systems International, Inc. (MSI)","","000013 - USAID. Bur. for Africa. Ofc. of Regional Affairs","English","application/pdf","Peace Corps|Interim evaluation","","","","29 Dec 1989","","","","Evaluation of Peace Corps/AID cooperation in Africa","","PD-ABB-988","https://dec.usaid.gov/dec/content/Detail.aspx?ctID=ODVhZjk4NWQtM2YyMi00YjRmLTkxNjktZTcxMjM2NDBmY2Uy&rID=MjEzOTM5","Africa Regional","6980506"
"Between 1951 and 1989, A.I.D. provided over $100 million to the Royal Thai Government for some 30 separate health projects. Activities were primarily in malaria eradication and control, population and family planning, rural water and sanitation, medical education and health training, primary health care, and nutrition.  This evaluation concludes that, although there have been some failures at the project level, the impact of A.I.D. assistance has been outstanding at the policy and program levels. Highlights include:  a reduction in malaria from the primary cause of death in the 1950's to a minor cause; a significant drop in birth rates and a contraceptive prevalence rate equal to that of the industrialized nations; continued expansion of the Chiang Mai medical school; and rapid expansion of potable water and sanitary latrines.  The sustainability of these programs is largely due to the Ministry of Public Health's highly motivated and technically competent staff and strong management and planning capacities.  The Ministry has prefered an experimental, flexible approach with emphasis on community participation.  The projects also benefited from the economic stability and recent prosperity of the country, which ensured budgetary resources and increased demands for new health care interventions.","","Special Evaluation","Documents","","","10/1/1989 12:00:00 AM","","Health delivery|Development assistance|Project sustainability|Health policy","Thailand","http://pdf.usaid.gov/pdf_docs/PNABG517.pdf","1,576 KB","008613 - USAID. Mission to Thailand|004200 - USAID. Bur. for Asia and Near East","","","English","application/pdf","Impact evaluation","","Hongvivatana, Thavitong|Johnson, Charles N.|et al.","Health (General)","Oct 1989","","","","Impact and sustainability of USAID assisted health activities in Thailand, 1951-1989","","PN-ABG-517","https://dec.usaid.gov/dec/content/Detail.aspx?ctID=ODVhZjk4NWQtM2YyMi00YjRmLTkxNjktZTcxMjM2NDBmY2Uy&rID=MjE0MTQ4","Thailand","4930249"
"","Attached to PD-ABC-054|Work order no. 14","Final Evaluation Report","Documents","PDC-1096-I-00-8043-00","","12/1/1989 12:00:00 AM","","Investment promotion|Institution building|Regional development|National level|Management training","Eastern Caribbean","http://pdf.usaid.gov/pdf_docs/XDABC054A.pdf","5,873 KB","000833 - Robert R. Nathan Associates, Inc.","","001757 - USAID. Bur. for Latin America and the Caribbean. Regional Development Ofc.","English","application/pdf","Final evaluation","","","Exports","19 Dec 1989","","","","Final evaluation report : investment promotion export development project","","XD-ABC-054-A","https://dec.usaid.gov/dec/content/Detail.aspx?ctID=ODVhZjk4NWQtM2YyMi00YjRmLTkxNjktZTcxMjM2NDBmY2Uy&rID=MjE0MjE0","Caribbean Regional","538011907"
"","Attached to PD-ABC-055","Special Evaluation","Documents","538-0133-C-00-9114-00","","12/1/1989 12:00:00 AM","","Small scale enterprises|Business associations|Institution building|Medium scale enterprises|Business support services|Private enterprises","Eastern Caribbean","http://pdf.usaid.gov/pdf_docs/XDABC055A.pdf","9,606 KB","005742 - Louis Berger International, Inc. (LBII) Development Economics Group","","001757 - USAID. Bur. for Latin America and the Caribbean. Regional Development Ofc.","English","application/pdf","Interim evaluation","","","","Dec 1989","","","","Final report : evaluation of small enterprise assistance project","","XD-ABC-055-A","https://dec.usaid.gov/dec/content/Detail.aspx?ctID=ODVhZjk4NWQtM2YyMi00YjRmLTkxNjktZTcxMjM2NDBmY2Uy&rID=MjE0MjIx","Caribbean Regional","5380133"
"Interim evaluation of Support Module Yemen (SMY), the logistical and administrative support unit of A.I.D.'s Agricultural Development Project (ADSP), a large umbrella project in Yemen. The evaluation covers the period 1988-11/89. The theory of centralized logistic support and fiscal management was a sound and an appropriate response to the unsatisfactory managemment of the project under the ""lead university concept"" in its early years.  The Consortium for International Development (CID), the prime contractor for the overall project, was an appropriate entity to implement SMY.  The Mission is satisfied that the procedures, controls, and reporting systems established provide reasonable assurance of fiscal responsibility and avoidance of waste and abuse. However, SMY has not gained the full support and cooperation of all parties.  The project's current team leaders would still strongly prefer to phase out the SMY and undertake its responsibilities themselves.  CID supports the team leaders on this point, while Yemen government officials back the decision of the Mission.  See the abstract of PD-ABC-065 for the unexpected resolution of this question.","Attached to PD-ABC-065","Special Evaluation","Documents","279-0052-O-00-9070-00","","11/1/1989 12:00:00 AM","","Logistics|Financial management|Development project management","Yemen","http://pdf.usaid.gov/pdf_docs/XDABC065A.pdf","1,816 KB","006434 - Devres, Inc.","","008624 - USAID. Mission to Yemen","English","application/pdf","Ad hoc evaluation|Interim evaluation|Umbrella projects","","Dwelley, Hugh L.","","20 Nov 1989","","","","Interim evaluation of the support module - Yemen (SMY) component of the agricultural development support project (ADSP)","","XD-ABC-065-A","https://dec.usaid.gov/dec/content/Detail.aspx?ctID=ODVhZjk4NWQtM2YyMi00YjRmLTkxNjktZTcxMjM2NDBmY2Uy&rID=MjE0Mjgx","Yemen","2790052"
"","Companion evaluation summary: PD-ABA-751","Special Evaluation","Documents","","","6/1/1989 12:00:00 AM","","Economic development|Capital formation|Small scale enterprises","Liberia","http://pdf.usaid.gov/pdf_docs/PDBBV942.pdf","2,745 KB","006512 - Community Economics Corp.","","003324 - USAID. Bur. for Africa. Ofc. of Market Development and Investment|008570 - USAID. Mission to Liberia","English","application/pdf","","","O'Regan, Fred M.","","Jun 1989","","","","Evaluation of the small and medium enterprise development support project","","PD-BBV-942","https://dec.usaid.gov/dec/content/Detail.aspx?ctID=ODVhZjk4NWQtM2YyMi00YjRmLTkxNjktZTcxMjM2NDBmY2Uy&rID=MjE0MzMz","Liberia","6690201"
"In March of 1985, USAID/Guatemala signed an agreement with Camara Empresarial (CAEM) to grant $1.5 million to implement the Private Sector Development Coordination Project (520-0337). The project was designed to increase the participation of the private sector in nontraditional development programs, with the aim of increasing exports, and was structured such that CAEM had the administrative, financial, and reporting requirements under the grant.  CAEM administered the grant to two subgrantees -- Fundacion Tecnologica (FUNTEC) and Fundacion de Desarrollo (FUNDAP) -- and served as the lead organization in nontraditional export promotion development and coordination of the Caribbean Basin Initiative (CBI) export and investment promotion efforts. Following some start-up difficulties, which were understandable given the very different goals and activities of the three organizations involved in the project, the structural arrangement seems to have worked well and overall, and the project was successful in many areas. However, the achievements of the implementing agencies have differed depending on the strengths and weaknesses of each. As coordinator of the overall project, CAEM organized an inter-agency steering committee to supervise the project. Representatives from FUNDAP, FUNTEC, and the International Executive Service Corps participated, although CAEM held the majority of seats on the committee. In general, this mechanism worked well to coordinate very different private sector activities under the project and CAEM was able to work cooperatively with FUNTEC and FUNDAP in administering the project.  In fact, field interviews revealed high satisfaction with the administrative role played by CAEM, particularly with the intermediation function with USAID/G. In other areas, CAEM's activities in support of exports and investment promotion were limited by a lack of resources, but contributed to an increase in both jobs and foreign exchange, resulting in significantly greater leveraging of USAlD/Guatemala's resources. The first activity initiated under the FUNDAP component was a community-based integrated development project which sought to promote the principal economic activities of the altiplano region -- ovine production and traditional artisanry.  Of the subprojects, this was the most successful in terms of institutional development and impact on the daily lives of the target group.  Nonetheless, it generated virtually no foreign exchange and had almost no multiplier effect on the economy. Of the subprojects, only those implemented by FUNTEC could be considered to have been less than optimal, although this judgment is admittedly and necessarily subjective.  Nevertheless, FUNTEC is one of the few institutions in Guatemala offering a potential channel for technology transfer.  It also offers an important source of human capital as it gathers together a number of private sector entrepreneurs with a wide range of experience in business with the purpose of facilitating the dissemination of technology. In addition to the evaluation of this project, the team was directed to analyze the effectiveness of other microenterprise projects in Guatemala in order to provide USAID/G with recommendations regarding the design of future microenterprise activities. Although it is too early to evaluate several of these projects, the Guatemalan experience reveals that many of these projects have been successful in achieving the desired objectives of income and employment generation.  In fact, recent studies have shown that microenterprises have an unrealized profit (and thus employment) potential that could be exploited with adequate credit and technical assistance programs. The evaluation team was comprised of experts in institutional private sector development, micro- and small-enterprise development, artesania, and marketing projects.  The team used a straightforward methodology, consisting of interviews with USAID/G staff, interaction and on-site visits with implementing agencies, interviews with recipients of the services, and intensive document review.  Approximately three weeks of field work were conducted in Guatemala in August, 1988.  (Author abstract)","Task no. 21","Special Evaluation","Documents","LAC-0619-C-00-7038-00","","3/1/1989 12:00:00 AM","","Private sector|Export promotion|Investment promotion|Exports|Microenterprises|Private enterprises|Nontraditional exports","Guatemala","http://pdf.usaid.gov/pdf_docs/PDABC103.pdf","1,669 KB","000673 - International Science and Technology Institute, Inc. (ISTI)","","001373 - USAID. Bur. for Latin America and the Caribbean|008550 - USAID. Mission to Guatemala","English","application/pdf","","","Bond, Robert|Yumiseva, Hilda|Tiffany, Tamara","Private sector","Mar 1989","","","","USAID/Guatemala evaluation : private sector development coordination project no. 520-0337","","PD-ABC-103","https://dec.usaid.gov/dec/content/Detail.aspx?ctID=ODVhZjk4NWQtM2YyMi00YjRmLTkxNjktZTcxMjM2NDBmY2Uy&rID=MjE0NDM1","Guatemala","5980619|5200337"
"PACR of the water component of a project (9/81-6/89) to strengthen energy management and conservation in Jamaica. The project as a whole consisted of two phases -- the first directed at the public, the second at the private sector.  The latter phase consisted of an energy credit fund managed by local banks and aimed at improving energy efficiency in private industry.  The fund was unsuccessful, however, since the loans carried a substantially lower interest rate than regular commercial loans and thus banks were reluctant to extend them. As a result, less than 10% of credit funds were committed.  In 9/86, the project was modified to direct remaining funds toward eight energy-related water supply and sewerage subprojects. This modification of the project was found to be an appropriate change, which provided the benefit of over 23 million gallons of water per day of new capacity or enhanced delivery of existing capacity. The major project lessons concerned the fixed amount reimbursement (FAR) method of financing.  The innovations in the FAR method used by USAID/J in this project enabled expeditious and relatively trouble-free implementation of the subprojects. The project serves as an example of possibilities for future use of FAR. The following was accomplished under these subprojects:  (1) construction of a half-million gallon reservoir at Pleasant Hill in Eastern St. Thomas; (2) improvements to the Rio Cobre pipeline system to enable pumping from augmentation wells directly into the trunk main; (3) improvement of the Lucea-Negril system in Western Jamaica by installing about 11,000 feet of pipe to connect the Logwood treatment plant to the distribution main at Orange Bay; (4) preliminary engineering, cost, and feasibility studies for expansion of the Logwood treatment plant, the Negril distribution system, and a water loss management program for the Lucea-Negril area; (5) feasibility, design, and cost studies for the Negril and Ocho Rios sewerage systems; (5) preparation of a 10-year plan for the Ocho Rios/St. Ann's Bay water system; and (6) installation of bulk flow meters at 22 locations throughout Jamaica.","Loan no. 532-W-016A","Final Evaluation Report","Documents","","","6/1/1989 12:00:00 AM","","Water supply|Water supply structures|Energy conservation","Jamaica","http://pdf.usaid.gov/pdf_docs/PDABC153.pdf","341 KB","008563 - USAID. Mission to Jamaica","","","English","application/pdf","Final evaluation","","Kerr, S.","","Jun 1989","","","","Project assistance completion report for the energy sector assistance project water component","","PD-ABC-153","https://dec.usaid.gov/dec/content/Detail.aspx?ctID=ODVhZjk4NWQtM2YyMi00YjRmLTkxNjktZTcxMjM2NDBmY2Uy&rID=MjE0NTUx","Jamaica","5320065"
"","Attached to PD-ABC-154|Work order no. 12","Special Evaluation","Documents","PDC-1406-I-12-7006-00","","3/1/1989 12:00:00 AM","","Scholarships|Agricultural training","Ecuador","http://pdf.usaid.gov/pdf_docs/XDABC154A.pdf","1,135 KB","000436 - Development Associates, Inc.","","008538 - USAID. Mission to Ecuador","English","application/pdf","Late evaluation|Final evaluation","","Jones, Earl|Fink, Rodney|Guerrero S., Tomas","","27 Mar 1989","","","","Wilson Popenoe Private Foundation evaluation, Ecuador","","XD-ABC-154-A","https://dec.usaid.gov/dec/content/Detail.aspx?ctID=ODVhZjk4NWQtM2YyMi00YjRmLTkxNjktZTcxMjM2NDBmY2Uy&rID=MjE0NTU0","Ecuador","5180062"
"","Attached to PD-ABC-155","Special Evaluation","Documents","538-0140-G-00-6061-00","","11/1/1989 12:00:00 AM","","Crop diversification|Cocoa","Saint Lucia|Grenada|Windward Islands|Dominica|Saint Vincent and the Grenadines","http://pdf.usaid.gov/pdf_docs/XDABC155A.pdf","2,293 KB","","","001757 - USAID. Bur. for Latin America and the Caribbean. Regional Development Ofc.|008512 - USAID. Mission to Barbados","English","application/pdf","Interim evaluation|Scheduled evaluation","","Fiester, Donald R.","","Nov 1989","","","","Mid-term evaluation of the high impact regional cocoa rehabilitation and development subproject","","XD-ABC-155-A","https://dec.usaid.gov/dec/content/Detail.aspx?ctID=ODVhZjk4NWQtM2YyMi00YjRmLTkxNjktZTcxMjM2NDBmY2Uy&rID=MjE0NTU5","Caribbean Regional","538014002"
"PACR of a project (8/85-9/89) to strengthen the capacity of the Building Department of Jamaica's College of Arts, Science, and Technology (CAST) to train technicians and professionals for the construction industry. The project had a positive impact on the Building Department, providing TA, training, furniture, and equipment as well as decreasing the level of faculty turnover.  The two long-term lecturers who implemented the TA component provided valuable services, including the drafting of the curriculum for the newly established School of Architecture and the establishment of a soils and materials laboratory at the Building Department.  This lab is unlike any other in the English-speaking Caribbean and will provide valuable opportunities for research and practical experience.  On the negative side, a summer institute for construction industry professionals had only limited success, since most professionals found it impossible to leave their practices for a week to two weeks.  Additionally, plans to establish a professional services unit, which would seek opportunities for the Building Department to provide work for fees, were not fulfilled due to numerous problems, such as the lack of staff time, problems of liability,  and organizational constraints. Training activities were highly successful.  Two persons who received long-term U.S. training are now full-time lecturers at CAST.  In-service workshops for building inspectors were well supported and are continuing.  Four lecturers also attended short seminars and conferences in the United States and various Caribbean countries. Several lessons were learned.  (1) CAST has a clear vision of where it is heading and has the capacity to use foreign assistance to its best advantage in meeting its own goals.  (2) Not all activities proposed by donors and administration are perceived as being in CAST's best interests; project planning could benefit from wider involvement of CAST staff members.  (3) CAST's high-quality staff, equipment, and operational strategies provide tremendous potential to earn additional revenue from outside resources.  (4) External assistance can help an institution continue its pursuit of long-term development during a period of economic recession.  (5) Staff training programs can effectively support staff recruitment.  (6) Since the CAST staff is not totally Jamaican, A.I.D. funding conditions may reduce the effectiveness of proposed staff development programs.","","Final Evaluation Report","Documents","","","9/1/1989 12:00:00 AM","","Construction industry|Universities and colleges|Engineering education|Technical training|Faculty|Institution building","Jamaica","http://pdf.usaid.gov/pdf_docs/PDABC182.pdf","232 KB","008563 - USAID. Mission to Jamaica","","","English","application/pdf","Final evaluation","","","","30 Sep 1989","","","","Project assistance completion report : urban sector technical assistance","","PD-ABC-182","https://dec.usaid.gov/dec/content/Detail.aspx?ctID=ODVhZjk4NWQtM2YyMi00YjRmLTkxNjktZTcxMjM2NDBmY2Uy&rID=MjE0NjE2","Jamaica","532011701"
"","","Final Evaluation Report","Documents","","","9/1/1989 12:00:00 AM","","Housing administration|Appropriate technology","Dominican Republic","http://pdf.usaid.gov/pdf_docs/PDABC199.pdf","69 KB","008537 - USAID. Mission to Dominican Republic","","","English","application/pdf","","","","","13 Sep 1989","","","","Project completion report - OPG no. 517-0164 housing appropriate technology","","PD-ABC-199","https://dec.usaid.gov/dec/content/Detail.aspx?ctID=ODVhZjk4NWQtM2YyMi00YjRmLTkxNjktZTcxMjM2NDBmY2Uy&rID=MjE0Njg1","Dominican Republic","5170164"
