Abstract,Ancillary_Data,Bibliographic_Type,ContentType,Contract_Grant_Number,Credit,Date_Resource_Created,Description,Descriptors_Topical,Descriptors_Geographic,File,File_Size,Inst_Author,Inst_Publisher,Inst_Sponsor,Language,Mime_Type,New_Thesaurus_Terms,Notes,Personal_Author,Primary_Subject,Publication_Date_Freeform,Related_Doc_Links,Report_Number,Series_Title,Title,Title_Translated,Unique_ID,URI,USAID_Geography,USAID_Project_Number
"PACR of a project (1980-1988) to develop the capacity of a Peruvian company, ELECTROPERU (EP), to provide reasonably priced, hydro-generated electrical energy for rural towns in the sierra and high jungle. Project goals have been attained.  Although only 5 of 10 planned power plants were completed due to economic crises and terrorism in Peru, the completed plants are operating well, and EP plans to complete construction at the remaining 5 sites by 1991. The project substantially improved the quality of life of the rural beneficiaries - about 26,000 families in 40 communities.  In addition to lighting and household uses, the provision of electricity facilitated:  the use of school facilities in two and sometimes three shifts; the installation of small and cottage industries like carpentries and cheesemaking; and increased production by several old small mining cooperative enterprises. EP's public education efforts were a key factor in project success. Some 52 communities served by the 10 project sites received information and training on the use of electricity to increase economic activities and productivity.  EP rural promoters made effective use of TV audiovisual materials to educate beneficiaries about the uses of electricity and about procedures for financing distribution systems and household connections.  These efforts were complemented by promoters from the departmental development committees. The EP's office for small hydroelectric plants was substantially strengthened, growing from a small unit with limited activities into a large directorate responsible for implementing a countrywide program. The EP institutionalized feasibility study methodologies developed under the project, although it conducted fewer than half of the target number of studies.  The project also stimulated and supported the development of a national private industry capable of manufacturing electromechanical and electrical equipment and materials for small hydroelectric plants.  It received strong governmental support, primarily because the development of hydroelectricty reduces consumption of kerosene, a fuel heavily subsidized by the GOP. As a result of project experiences, the following bottlenecks were identified:  (1) excessive delays when reviewing contractors' claims for extra earthmoving work (a unit price construction contract is recommended); (2) limitations of the counterpart agency in providing, on a timely basis, sufficient and appropriate technical personnel, transportation, secretarial support, and communication facilities (grant funds were used to overcome these difficulties, e.g., by hiring local TA, renting vehicles, etc.); (3) lack of definition of counterpart responsibilies, especially given the decentralization process EP was undergoing; (4) constant changes in personnel and procedures for supervising subprojects; (5) unrealistic estimates of the time required for the bidding process; (6) unrealistic pricing of electricity, mandated by the GOP, made it impossible for EP to provide timely counterpart funding.","","Final Evaluation Report","Documents","","","11/1/1989 12:00:00 AM","","Hydroelectric power plants|Hydroelectric power|Feasibility studies","Peru","http://pdf.usaid.gov/pdf_docs/PDABA205.pdf","195 KB","008591 - USAID. Mission to Peru","","","English","application/pdf","","","Larrabure, A.","","2 Nov 1989","","","","Project assistance completion report [: small hydroelectric plants development]","","PD-ABA-205","https://dec.usaid.gov/dec/content/Detail.aspx?ctID=ODVhZjk4NWQtM2YyMi00YjRmLTkxNjktZTcxMjM2NDBmY2Uy&rID=MjA5NTc3","Peru","5270226"
"","Related document: PD-ABA-226","Special Evaluation","Documents","","","1/1/1989 12:00:00 AM","","Agricultural management|Institution building","Afghanistan","http://pdf.usaid.gov/pdf_docs/PDABB828.pdf","787 KB","003002 - Ronco Consulting Corp.","","008588 - USAID. Mission to Pakistan","English","application/pdf","","","","","Jan 1989","","","","Assessment of the agricultural sector support project, (306-0204)","","PD-ABB-828","https://dec.usaid.gov/dec/content/Detail.aspx?ctID=ODVhZjk4NWQtM2YyMi00YjRmLTkxNjktZTcxMjM2NDBmY2Uy&rID=MjA5NjAw","Afghanistan","3060204"
"Mid-term evaluation of a project to construct small-scale groundwater irrigation systems and intermediate-scale surface water systems in three eastern provinces of Indonesia -- South Sulawesi, Nusa Tenggara Barat, and Nusa Tenggara Timor.  The evaluation covers the period 8/85-8/89. The project is behind schedule by as much as two years, primarily as the result of an ineffective management structure and the lack of management planning and monitoring systems.  Unless these problems are resolved, it is unlikely that the project can be successfully implemented.  Nonetheless, some accomplishments have been made, especially in the surface water component.  Although none of these systems have been constructed, substantial progress has been made in system design.  Three projects are expected to start construction within the next 18 months, while final designs and contract documents for all 8 projects will be prepared by 9/91.  (Of the 10 proposed surface water projects, 2 were found to be technically infeasible.) The groundwater irrigation component has been less successful. Only two small demonstration systems have been constructed and, although they are of good quality and have a high level of farmer participation, coherent plans for further progress in this component are lacking.  Two potential areas for groundwater irrigation development have been identified, and the major need now is to initiate a combined exploration and development drilling program. Participant training has been well done, with 27 long-term participants now returning, while in-country training needs to be better planned and executed. A two-year extension is recommended.","ISPAN activity no. 652B|Companion project evaluation summary: PD-ABB-363|Project title: Irrigation support project for Asia and the Near|East (ISPAN)","Special Evaluation","Documents","ANE-0289-C-00-7044-00","","11/1/1989 12:00:00 AM","","Irrigation|Irrigation sites|Surface irrigation|Subsurface irrigation","Indonesia","http://pdf.usaid.gov/pdf_docs/PDABA227.pdf","1,368 KB","000333 - Camp Dresser and McKee, Inc. (CDM)","","008558 - USAID. Mission to Indonesia|004200 - USAID. Bur. for Asia and Near East","English|Indonesian","application/pdf","Interim evaluation","","Thomas, William R., 3rd|Asnawi, Sjofjan|et al.","","Nov 1989","","","ISPAN report, no. 23","Mid-term evaluation : small scale irrigation management project, Indonesia","","PD-ABA-227","https://dec.usaid.gov/dec/content/Detail.aspx?ctID=ODVhZjk4NWQtM2YyMi00YjRmLTkxNjktZTcxMjM2NDBmY2Uy&rID=MjA5NjAx","Indonesia","4970347|3980289"
"External interim (10/85-12/89) evaluation of the Family Planning Management Training (FPMT) project, which is implemented by Management Sciences for Health (MSH). FPMT clearly addresses a major need.  The project design, however, fell short of what was needed to meet the actual project objective, i.e., to strengthen leadership and management FP programs.  A primary focus on training alone, in the absence of a strategy for organizational development, is not likely to strengthen the management of FP organizations. Fortunately, MSH recognized this shortcoming and has focused instead on the organizational and management development needs of organizations conducting FP programs.  FPMT staff refer to this as ""institutional development.""  They emphasize, correctly, that formal training is but one part of improving the management of an organization.  FPMT has effectively expanded its role and, consequently, improved its capacity to enhance the performance of FP organizations. MSH is on schedule in meeting most contract deliverables.  An exception is long-term training, but that de-emphasis is appropriate. MSH's contract should be revised accordingly. FPMT has developed an effective conceptual framework that helps organize the myriad activities that a centrally funded project engages in while functioning worldwide.  The ""Stages of Program Development"" framework, which was developed by FPMT as a starting point in assessing the FP programs of countries and client organizations and for tailoring FPMT assistance to their stages of development (emergence/survival, growth, and maturity), is a useful, innovative approach.  It could benefit, however, from further refinement. Project Components:  (1) Needs Assessments and Management Development Plans have for the most part been well executed and have identified the priority management problems of the client organizations.  (2) Training - FPMT has done an excellent job in carrying out most of its short-term, LDC-based workshops and other specifically designed training activities. Other donor organizations are beginning to ask FPMT for assistance, which speaks very highly of the appropriateness of FPMT's client-tailored training.  Long-term U.S. training has been handled quite well, but MSH is correct in concluding that it is not a very effective or appropriate means for strengthening FP organizations, especially those struggling to get programs started.  (3) TA - while envisioned by AID as follow-up assistance after training, FPMT has commendably made TA (in institutional development) the central component of the project and generally done an outstanding job in this area.  (4) Materials and course development has been uneven.  Only a few of the many good starts at materials development have been completed in a way that ensures the continued usability of the materials to the client organizations or their transferability to other programs and projects. The consortium structure has not contributed greatly to the achievement of FPMT objectives.  The exception is LASPAU (the Latin American Scholarship Program of American Universities, which has a single task - placement of long-term training candidates - but even in this, LASPAU functions more as a subcontractor than a consortium partner. Finally, FPMT has developed good criteria for evaluating its training activities.  It has not, however, developed adequate criteria for evaluating its organizational development activities.  (Author abstract, modified)","Project title: Population technical assistance (POPTECH)","Special Evaluation","Documents","DPE-3024-Z-00-8078-00","","12/1/1989 12:00:00 AM","","Family planning services|Organizations|Institution building|Management training","","http://pdf.usaid.gov/pdf_docs/PDABA231.pdf","1,693 KB","006243 - Dual & Associates, Inc.|000673 - International Science and Technology Institute, Inc. (ISTI)","","000191 - USAID. Bur. for Science and Technology. Ofc. of Population","English","application/pdf","Interim evaluation","","Wickham, Robert|Logan, David|Pillsbury, Barbara L. K.","Management training","13 Dec 1989","","Report no. 88-013-096","","Family planning management training project : external interim evaluation","","PD-ABA-231","https://dec.usaid.gov/dec/content/Detail.aspx?ctID=ODVhZjk4NWQtM2YyMi00YjRmLTkxNjktZTcxMjM2NDBmY2Uy&rID=MjA5NjE2","Development Support","9363024"
"","Attached to PD-ABA-233","Special Evaluation","Documents","PDC-0085-I-05-6098-00","","3/1/1989 12:00:00 AM","","Management training|Management education|Management research|Mid level managers|Masters degrees","Jordan","http://pdf.usaid.gov/pdf_docs/XDABA233A.pdf","8,694 KB","000436 - Development Associates, Inc.","","008564 - USAID. Mission to Jordan","English","application/pdf","Late evaluation|Interim evaluation","","Berg, William B.|Southby, Richard F.|et al.","","Mar 1989","","","","Evaluation report of the management development project Jordan","","XD-ABA-233-A","https://dec.usaid.gov/dec/content/Detail.aspx?ctID=ODVhZjk4NWQtM2YyMi00YjRmLTkxNjktZTcxMjM2NDBmY2Uy&rID=MjA5NjIy","Jordan","2780261"
"Evaluation of a project to establish a Center for Privatization (CFP) to promote privatization and provide A.I.D. Missions with resources for helping host governments implement divestiture. External evaluation covers the period 9/85-8/89. The project's major achievements are in its promotional activities, which include seminars, efforts to stimulate multilateral dialogue, participation in international conferences, networking and marketing, studies, and reconnaissance missions to the field.  While limited direct impact on divestitures can be attributed to these promotional activities, they have changed the attitudes of many developing country officials and Missions. Through its subcontractors, the CFP has been able to provide fast access to a range of short- and long-term TA for Missions in 49 countries; this assistance was most effective when Missions and host governments maintained close supervision of and collaboration with the TA teams.  Successful long-term TA in Tunisia and Honduras has achieved 21 privatization transactions worth about $75 million.  However, the CFP has failed to fully utilize its subcontractors, relying instead primarily on its core staff, which is not technically experienced and has limited ability to support teams in the field.  This has created friction with the subcontractors and the Bureau for Private Enterprise. Moreover, reports submitted to Missions by the CFP have been of limited quality and often delayed. A major lesson learned is that privatization projects always take longer to develop than anticipated.  To be successful, four important conditions must exist:  (1) host government commitment; (2) a good working relationship between Missions and government bureaucracies; (3) identification of the timing and quality of resource needs; (4) and proper management of these resources. The project also illustrated that the mixture of buy-in assignments with a core-funded set of activities can create conflicting objectives (financial versus technical) for the contractor, which can dilute the overall project impact.  On the other hand, such arrangements can provide Missions with flexibility to explore and introduce controversial new subjects, such as privatization.  It is recommended that host countries participate in research activities when sensitive issues, such as valuation, are involved in order to promote acceptance of the often controversial results.","","Special Evaluation","Documents","DPE-0008-C-00-5058-00|PDC-1096-I-19-8043-00|PDC-1096-I-00-8043-00","","12/1/1989 12:00:00 AM","","Privatization|Divestiture|Technical assistance|Policy dialogue","","http://pdf.usaid.gov/pdf_docs/PDABA281.pdf","2,290 KB","006727 - Development Alternatives, Inc. (DAI)","","005893 - USAID. Bur. for Private Enterprise. Ofc. of Project Development","English","application/pdf","Interim evaluation","","Grant, William J.|Mescher, Micheline","Privatization","Dec 1989","","","","Evaluation of the divestiture and privatization project : breaking new ground with the Center for Privatization","","PD-ABA-281","https://dec.usaid.gov/dec/content/Detail.aspx?ctID=ODVhZjk4NWQtM2YyMi00YjRmLTkxNjktZTcxMjM2NDBmY2Uy&rID=MjA5NjQ5","Private Enterprise","9400008|9400001"
"","Attached to PD-ABA-250","Special Evaluation","Documents","","","11/1/1989 12:00:00 AM","","Farming systems research|Agricultural extension|Research methodology|Agricultural technology|Technology transfer|Institution building","Botswana","http://pdf.usaid.gov/pdf_docs/XDABA250A.pdf","1,598 KB","001015 - Botswana. Ministry of Agriculture","","000026 - USAID. Bur. for Africa. Regional Economic Development Services Ofc. (REDSO) East Africa|008516 - USAID. Mission to Botswana","English","application/pdf","Final evaluation|Scheduled evaluation","","","Agricultural technology","Nov 1989","","","","Agricultural technology improvement project (ATIP), 633-0221 : internal review","","XD-ABA-250-A","https://dec.usaid.gov/dec/content/Detail.aspx?ctID=ODVhZjk4NWQtM2YyMi00YjRmLTkxNjktZTcxMjM2NDBmY2Uy&rID=MjA5Njc3","Botswana","6330221"
"","","Special Evaluation","Documents","","","10/1/1989 12:00:00 AM","","Business formation|Industrial credit|Development organizations","South Africa","http://pdf.usaid.gov/pdf_docs/PDABA243.pdf","960 KB","008605 - USAID. Mission to South Africa","","","English","application/pdf","","","Farbman, Michael|O'Regan, Frederick M.","","25 Oct 1989","","","","Intermediate assessment : Get Ahead Foundation cooperative agreement no. 674-0303-6-SS-7080-00","","PD-ABA-243","https://dec.usaid.gov/dec/content/Detail.aspx?ctID=ODVhZjk4NWQtM2YyMi00YjRmLTkxNjktZTcxMjM2NDBmY2Uy&rID=MjA5Njgx","South Africa","6740303"
"PACR of a project (7/80-12/88) to improve and expand the Honduran health care system by providing TA in health technologies, logistics and maintenance, management and planning, and human resource development. The project had a dramatic impact on national health.  During the project period, the infant mortality rate decreased from 117 to 60/1000, while general mortality dropped from 14/1000 to 8/1000. Fertility rates dropped from 7.5 to about 5.6 and the national population growth rate was consequently reduced from 3.5% to under 3%.  In terms of specific diseases, the following improvements occurred:  the number of malaria cases decreased from more than 50,000 to 23,000; whooping cough dropped from 2,453 cases to 223; measles was reduced from 4,188 to 1,033 cases; and deaths from diarrheal disease dropped by 40%.  These improvements are attributed primarily to expanded immunization coverage, improved diarrhea treatment and control, and an increase in contraceptive prevalence.  These efforts were supported by numerous technical achievements in the areas of logistics, maintenance and transportation, management and planning, mass media health education, training of health personnel at all levels, and supervision of health delivery. In a few areas, the project failed to accomplish objectives. These included:  establishment of a chain of low-cost pharmacies, establishment of community-managed rotating drug funds, continuing education of health personnel, and development of manuals for medical/surgical supplies, hospital equipment, and office supplies. Several lessons were learned.  (1) Project effectiveness was aided by a design effort lasting 2 full years and undertaken in collaboration with the Ministry of Health (MOH), as well as by the MOH's policy commitment to primary health care and adequate budget support from the Government of Honduras (GOH). Health sector projects are complex and require significant allocation of personnel resources, as well as continuous and intensive monitoring by both the USAID and the TA team. These requirements are more than compensated for, however, by the flexibility of such projects in tackling problems across a broad front. (3) A.I.D. and GOH procurement procedures make delays in arrival of commodities almost inevitable.  (4) Project managers must devote considerable effort to balancing institutional and operational objectives, as well as to coordinating with other donors in order to avoid conflicting and overlapping activities.","Evaluation period: Jul 1980-Dec 1988","Final Evaluation Report","Documents","DPE-1018-C-00-5063-00","","1/1/1989 12:00:00 AM","","Immunizations|Health care planning|Contraceptive prevalence|Infant mortality|Morbidity","Honduras","http://pdf.usaid.gov/pdf_docs/PDABA253.pdf","275 KB","000223 - Academy for Educational Development, Inc. (AED)","","008555 - USAID. Mission to Honduras","English","application/pdf","Final evaluation","","","","[1989]","","","","Close out report -- health sector I, 522-0153 : project close out report","","PD-ABA-253","https://dec.usaid.gov/dec/content/Detail.aspx?ctID=ODVhZjk4NWQtM2YyMi00YjRmLTkxNjktZTcxMjM2NDBmY2Uy&rID=MjA5Njgy","Honduras","5220153"
"PACR of a project (1978-1986) to assist the Botswana Agricultural College (BAC) in doubling its intake of students in certificate programs and establishing diploma-level programs in the areas of agriculture and animal health. Although the project succeeded by 1982 in doubling the intake of BAC certificate programs, enrollment was reduced by the Government of Botswana in 1985 due to a lack of employment opportunities for graduates.  Nonetheless, the project made noteworthy achievements, primarily as a result of the strong commitment of the South Dakota State University (SDSU) TA team. There is a general consensus that the students coming out through the new BAC curricula are much better trained than those graduated under the old system.  In addition, by strengthening the BAC the project has allowed the GOB to open degree programs in the same facility, and the BAC will soon become part of the University of Botswana. U.S. long-term training was provided to 19 BAC staff members (15 BS, 5 MS, and 1 Doctor of Veterinary Medicine; 2 students received 2 degrees each).  All participants returned to the BAC except the DVM degree holder, who was assigned elsewhere. Short-term training was provided to five BAC staff (one in Kenya, the United Kingdom, and the Netherlands, and two in the United States).  In addition, USAID/B provided U.S. training to 10 MOA staff members.  Participant training was skewed towards animal science training with little emphasis on the socioeconomic sciences, genetics and biometry, or agricultural engineering - all of which are required in the BAC's diploma-level curricula. Most major inputs were provided in a timely manner and in appropriate quality and quantity.  Facility construction, although slightly delayed, was completed by 10/82 and the campus is attractive and functional. Some problems were encountered with commodity procurement because of suppliers' failure to follow specifications.  Several pieces of equipment are sitting idle or are not being properly utilized because operating manuals are not available.  The expensive air-conditioning unit in the animal health center is not operational. Several lessons were learned.  (1) The choice of a Title XII University to design and implement a project of this nature was appropriate since project services were the natural extension of staff members' day-to-day work at the home institution.  (2) SDSU's ability to assemble a TA team from its large faculty was beneficial, since each member's capabilities were known to the campus coordinator.  (3) Construction of physical facilities and commodity procurement are generally problematic and deserve more attention from the project design and implementation teams.  (4) Instead of sending all long- and short-term trainees to the United States, undergraduate students and short-term trainees could attend third-country programs, which may be less expensive, more relevant, and cause less culture shock.  (5) The project is an excellent example of donor coordination (other donors included the Overseas Development Agency, the Peace Corps, and the UN). (6) The project should have included a crops/soil laboratory, a college farm, and training of a librarian and someone to maintain BAC equipment.","Evaluation period: 1978-86","Final Evaluation Report","Documents","","","3/1/1989 12:00:00 AM","","Agricultural education|Agricultural colleges|Animal health","Botswana","http://pdf.usaid.gov/pdf_docs/PDABA274.pdf","159 KB","008516 - USAID. Mission to Botswana|000026 - USAID. Bur. for Africa. Regional Economic Development Services Ofc. (REDSO) East Africa","","","English","application/pdf","Final evaluation|Peace Corps","","","","Mar 1989","","","","Botswana agricultural college expansion project no. 633-0074","","PD-ABA-274","https://dec.usaid.gov/dec/content/Detail.aspx?ctID=ODVhZjk4NWQtM2YyMi00YjRmLTkxNjktZTcxMjM2NDBmY2Uy&rID=MjA5Njg0","Botswana","6330074"
"","Attached to PD-ABA-262","Final Evaluation Report","Documents","649-89-0134-060-00","","8/1/1989 12:00:00 AM","","River basins|Development planning|Irrigation|Classification|Baseline studies","Somalia","http://pdf.usaid.gov/pdf_docs/XDABA262A.pdf","2,015 KB","","","001209 - Somalia. Ministry of National Planning and Juba Valley Development|008604 - USAID. Mission to Somalia","English","application/pdf","Final evaluation|Scheduled evaluation","","Bitoun, Marcel|Barnes, Carolyn|McGowan, Edward","","1 Aug 1989","","","","Final evaluation of Jubba development analytical studies project, (USAID project 649-0134)","","XD-ABA-262-A","https://dec.usaid.gov/dec/content/Detail.aspx?ctID=ODVhZjk4NWQtM2YyMi00YjRmLTkxNjktZTcxMjM2NDBmY2Uy&rID=MjA5Njk1","Somalia","6490134"
"","Attached to PD-ABA-279","Special Evaluation","Documents","AFR-0438-C-00-8059-00","","6/1/1989 12:00:00 AM","","Business support services|Investment promotion|Private enterprises|Employment|Export promotion","Africa south of Sahara","http://pdf.usaid.gov/pdf_docs/XDABA279A.pdf","593 KB","000480 - Experience, Inc.","","000004 - USAID. Bur. for Africa","English","application/pdf","Interim evaluation|Scheduled evaluation","","Loth, Richard B.","","13 Jun 1989","","","","Africa Project Development Facility evaluation","","XD-ABA-279-A","https://dec.usaid.gov/dec/content/Detail.aspx?ctID=ODVhZjk4NWQtM2YyMi00YjRmLTkxNjktZTcxMjM2NDBmY2Uy&rID=MjA5NzAx","Africa Regional","6980516"
