Abstract,Ancillary_Data,Bibliographic_Type,ContentType,Contract_Grant_Number,Credit,Date_Resource_Created,Description,Descriptors_Topical,Descriptors_Geographic,File,File_Size,Inst_Author,Inst_Publisher,Inst_Sponsor,Language,Mime_Type,New_Thesaurus_Terms,Notes,Personal_Author,Primary_Subject,Publication_Date_Freeform,Related_Doc_Links,Report_Number,Series_Title,Title,Title_Translated,Unique_ID,URI,USAID_Geography,USAID_Project_Number
"Interim evaluation of a project to help the Agricultural Development and Marketing Corporation (Admarc), a Malawian parastatal, restore its liquidity through the divestiture of assets valued at MK 47 million. External evaluation covers the period 1986-3/89. Divestiture has proceeded relatively rapidly, and Admarc's liquidity, as well as its ability to carry out marketing functions, has visibly improved.  Since work began about 2 years ago, 9 estates and 3 companies have been sold and sales of a further 7 estates are in progress.  The aggregate value of assets divested totaled MK 34.6 million, of which Admarc received MK 14.7 million in net cash proceeds.  These achievements have been made despite severe constraints to divestiture in Malawi, namely the lack of a developed capital market and the very small number of potential buyers with sufficient capital.  Although a commendable effort has been made to identify new buyers and involve smaller purchasers, many sales represent a continuation of the concentration of ownership, with potential for abuse of monopoly power. For example, the Press Group, Malawi's largest enterprise, has been a major purchaser of Admarc assets.  In many cases at least a partial share of these assets could have been sold to other buyers.  Moreover, a reluctance to sell to resident Asians has precluded access to an important source of capital and management expertise.  Due to the lack of conditionality, USAID/M has been limited in its ability to impose or influence divestiture objective or standards. Government of Malawi (GOM) officials are generally satisfied with the TA provided by the project and the progress to date in divestiture. Although the GOM has insisted in some cases on keeping a minority interest in properties, there is growing enthusiasm among officials for private sector growth and the prospect of other privatization projects. It is recommended that the current project be extended for a year with continued TA, provision of financial incentives (e.g., balance of payments support), and possibly additional funding from other donors to support the establishment of a unit trust or local currency liquidity line of credit.  Thus far, USAID/M has provided the GOM with $11.55 million in balance of payments support, while a further $3.45 million is expected to be disbursed before 6/89. Several lessons were learned.  (1) Strong commitment at the top of government is crucial to success.  (2) A systematic approach to the divestiture process can contribute materially to effectiveness.  (3) Divestiture can be most effective and least controversial when undertaken in the context of solving a problem (e.g., lack of liquidity).  (4) Valuation is less likely to be a problem when specific business and economic goals are the focus of a privatization program. (5) Missions can materially assist the divestiture process through provision of TA and an incentive.","Companion evaluation summary: PD-ABC-694","Special Evaluation","Documents","DPE-0008-C-00-5058-00","","4/1/1989 12:00:00 AM","","Privatization|Divestiture|Parastatals|Balance of payments","Malawi","http://pdf.usaid.gov/pdf_docs/PDAAZ568.pdf","1,070 KB","004844 - Center for Privatization","","000165 - USAID. Bur. for Private Enterprise|008573 - USAID. Mission to Malawi","English","application/pdf","Interim evaluation","","Tomlinson, Alexander C.|Cowan, L. Gray|et al.","Agricultural development","Apr 1989","","","Project/Center for Privatization, no. 116","Evaluation of the divestiture program of the Agricultural Development and Marketing Corporation, `ADMARC,' Malawi, 1986-1989","","PD-AAZ-568","https://dec.usaid.gov/dec/content/Detail.aspx?ctID=ODVhZjk4NWQtM2YyMi00YjRmLTkxNjktZTcxMjM2NDBmY2Uy&rID=MjA3NjY5","Malawi","9400008|6120227"
"","Attached to PD-AAZ-603|WASH task no. 017","Special Evaluation","Documents","DPE-5942-C-00-4085-00","","7/1/1989 12:00:00 AM","","Water user associations|User fees|Potable water|Water pumps|Water supply|Water supply engineering|Water supply structure maintenance","Tunisia","http://pdf.usaid.gov/pdf_docs/XDAAZ603A.pdf","4,352 KB","000333 - Camp Dresser and McKee, Inc. (CDM)","","008616 - USAID. Mission to Tunisia|000186 - USAID. Bur. for Science and Technology. Ofc. of Health","English","application/pdf","Interim evaluation|Scheduled evaluation","","Jennings, Lee|Bourkraa, Ridha|et al.","","Jul 1989","","","WASH field report, no. 256","Midterm evaluation of the USAID/Tunisia rural potable water institutions project","","XD-AAZ-603-A","https://dec.usaid.gov/dec/content/Detail.aspx?ctID=ODVhZjk4NWQtM2YyMi00YjRmLTkxNjktZTcxMjM2NDBmY2Uy&rID=MjA3NzUz","Tunisia","6640337|9365942"
"","","Final Evaluation Report","Documents","","","2/1/1989 12:00:00 AM","","Agricultural management|Policy making|Baseline studies","Honduras","http://pdf.usaid.gov/pdf_docs/PDAAZ646.pdf","61 KB","008555 - USAID. Mission to Honduras","","","English","application/pdf","","","","Agricultural policy","21 Feb 1989","","","","Project assistance close out report : grant no. 522-ESF-0318, agricultural policy support to the Ministry of Natural Resources -- grantee : Ateneo de la Agroindustria (ADAI)","","PD-AAZ-646","https://dec.usaid.gov/dec/content/Detail.aspx?ctID=ODVhZjk4NWQtM2YyMi00YjRmLTkxNjktZTcxMjM2NDBmY2Uy&rID=MjA3ODA0","Honduras","5220318"
"A.I.D.'s Consumption Effects of Agricultural Policies (CEAP) project was designed to study the links between agricultural policies, food consumption, and nutrition. From 1977 to 1988, the project conducted research and policy studies, technical assistance, and training activities in about 30 countries. A major emphasis of these activities was to determine the impact of food policies on the poor. This assessment of the project identifies lessons drawn from CEAP country studies, which focused on producer and consumer price policies; food subsidies; input, technology, and marketing policies; and macroeconomic and trade policies. It also identifies lessons relating to research design, food policy analysis, technical assistance, training, and project management and administration. A major lesson is that accurate data on consumption parameters can dispel traditional wisdom and promote better policy design. For example, it was discovered that policies to induce coarse grain consumption by increasing rice prices are misguided, since consumers respond to the price hikes by reducing their overall grain consumption. The report concludes with recommendations for future A.I.D. activities related to food policy, with special attention to developing policies and interventions to assist groups vulnerable to the adverse impacts of structural adjustment programs. Abstracts of the 17 CEAP country studies are included.","'RSSA-BST-1171-R-AG-3125-01'","Special Evaluation","Documents","BST-1171-R-AG-3125-01|BST-1171-R-AG-3125-00","","8/1/1989 12:00:00 AM","","Food policy|Agricultural policy|Policy reform|Food consumption|Food consumption patterns|Human nutrition","","http://pdf.usaid.gov/pdf_docs/PNABD064.pdf","2,214 KB","001038 - Resources for the Future, Inc. (RFF)","","003787 - U.S. Dept. of Agriculture. Ofc. of International Cooperation and Development. Technical Assistance Div.|000189 - USAID. Bur. for Science and Technology. Ofc. of Nutrition","English","application/pdf","","","Kramer, Carol S.|Rubey, Lawrence M.","Agricultural policy","Aug 1989","","","","A.I.D. food policy programming : lessons learned -- an assessment of the `consumption effects of agricultural policies' project, 1977-1988","","PN-ABD-064","https://dec.usaid.gov/dec/content/Detail.aspx?ctID=ODVhZjk4NWQtM2YyMi00YjRmLTkxNjktZTcxMjM2NDBmY2Uy&rID=MjA3ODI0","","9311274"
"Final evaluation of a project to develop a model low-cost health delivery system in three rural areas of Ecuador.  External evaluation covers the period 7/87-3/89, when the primary goal was construction of rural water supply and sanitation systems (RWSS's). The project has succeeded in institutionalizing the concept of community ownership and management of RWSS's.  The relatively high level of community maintenance of constructed systems (50%-60%) is a good indicator of project success.  Also, the project's modular operating approach has been an efficient means of organizing construction, and has demonstrated that a team of one engineer, three promotores, and one administrator can construct six or seven systems a year.  However, achievement of construction and promotion goals were hampered by logistical problems and lack of transportation, and construction targets of 18 systems per year for each operational module proved unrealistic. Another problem is that latrines with concrete pour-flush devices are not being used because they are hard to keep clean and aesthetically unappealing.  Appropriate technology experiments yielded few results but should be continued with more organization and supervision.  Also, water tariffs have been set too low in most communities. Training provided by the Ecuadorean Institute of Sanitary Works (IEOS) to 1,200 project-related personnel was effective in manual skills, but less so in promotional skills and hygiene.  User education in sanitation also needs improvement, particularly in latrine promotion, construction, and water usage.  Too many communities do not understand the health benefits of latrine use. This is partially a result of the underrepresentation of women as IEOS promoters and on community water boards.  Health messages from male promoters are highly unlikely to win the acceptance of women.  A planned follow-on project will add elements relating to child survival.","Spanish ed.: PD-AAZ-845|Companion evaluation summary: PD-ABB-857","Special Evaluation","Documents","DPE-5942-C-00-4085-00","","6/1/1989 12:00:00 AM","","Water sanitation|Water supply|Outdoor toilet facilities|Community participation|Water supply structure maintenance","Ecuador","http://pdf.usaid.gov/pdf_docs/PDAAZ655.pdf","1,400 KB","000333 - Camp Dresser and McKee, Inc. (CDM)","","000186 - USAID. Bur. for Science and Technology. Ofc. of Health|008538 - USAID. Mission to Ecuador","English","application/pdf","Final evaluation","","Edwards, Daniel B.|Gonzalez, Nancie L.|Larrea, Oscar R.","","Jun 1989","","","WASH field report, no. 264","Integrated rural health delivery system Ecuador : final evaluation","","PD-AAZ-655","https://dec.usaid.gov/dec/content/Detail.aspx?ctID=ODVhZjk4NWQtM2YyMi00YjRmLTkxNjktZTcxMjM2NDBmY2Uy&rID=MjA3ODM4","Ecuador","5180015|9365942"
"","Companion evaluation summary: PD-AAZ-688","Special Evaluation","Documents","","","1/1/1989 12:00:00 AM","","Financial institutions|Financial management|Management education|Economic self sufficiency|Public sector|Private sector|Training centers","Ecuador","http://pdf.usaid.gov/pdf_docs/PDAAZ682.pdf","2,158 KB","005130 - Institute of Social Studies and Public Opinion","","008538 - USAID. Mission to Ecuador","Spanish","application/pdf","","","Reyes, Santiago Quevedo|Martinez, Miguel Angel Nino|Morgado, Carlos Quevedo","","Jan 1989","","","","Evaluacion de las actividades del Instituto de Practicas Bancarias y Financieras en el periodo agosto de 1987 a Noviembre de 1988 : informe final","Evaluation of the activities of the Instituto de Practicas Bancarias y Financieras during the period of August 1987 to November 1988 : final report","PD-AAZ-682","https://dec.usaid.gov/dec/content/Detail.aspx?ctID=ODVhZjk4NWQtM2YyMi00YjRmLTkxNjktZTcxMjM2NDBmY2Uy&rID=MjA3ODY5","Ecuador","5180048"
"Evaluates a pilot study of community participation in malaria control in West Timor. In general, the pilot project was proceeding according to plans. The provincial health authorities and the USAID direct hire personnel had done an outstanding job. It is expected that a great deal will be learned about approaches to involving villagers and the rural health delivery system in joint efforts to control malaria. The midterm status of major segments of the project is as follows: Training: Modules have been developed for Puskesmas (health center) physicians (training methods), village volunteers (recognition, treatment, and reporting of clinical malaria), and village inhabitants (malaria biology and control).  Programs have been successfully implemented at each of these levels. Village Malaria Surveillance and Treatment: Volunteers have been trained and are functioning well in the villages selected for this activity.  Support systems for this activity from the Puskesmas are working well with only minor problems in supplying drugs. Correlation of clinical symptoms and malaria parasitemias: Blood specimens are being collected from the three clinically defined groups of patients coming to selected health centers. Blood slides are being collected, stained and accurately examined. Some mid-course changes have been suggested for this part of the program, including: l) Adding two subPuskesmas to the blood specimen collecting program in order to have health center activities closer to study villages; 2) Increasing the number of subjects in the afebrile clinical group; 3) Recording parasites in positive blood smears in a more standard format; and 4) Recruiting an additional microscopist. Bed net study: Bed nets have been distributed and insecticide treatment schedules followed. Initial surveys indicate that the majority of villagers involved in this activity use the nets. Mosquito catches have been initiated in both experimental and control villages. Clearly village support for bed net use as a means of interrupting transmission can be developed and utilized. Evaluation of this effort will be difficult. Additional studies on vector identification and biology as well as evaluation technology will be required.  (Author abstract)","","Special Evaluation","Documents","DPE-5948-C-00-5044-00","","6/1/1989 12:00:00 AM","","Health research|Operations research|Community participation|Disease prevention and control|Malaria","Indonesia","http://pdf.usaid.gov/pdf_docs/PDAAZ695.pdf","369 KB","005969 - Medical Service Corp. International","","000186 - USAID. Bur. for Science and Technology. Ofc. of Health","English","application/pdf","Interim evaluation","","McWilson, Warren|Rosenberg, Ronald","Malaria","Jun 1989","","VBC report no. AR-103-3","","Mid-term evaluation of a pilot study of community participation for malaria control in West Timor, Indonesia","","PD-AAZ-695","https://dec.usaid.gov/dec/content/Detail.aspx?ctID=ODVhZjk4NWQtM2YyMi00YjRmLTkxNjktZTcxMjM2NDBmY2Uy&rID=MjA3ODc2","Indonesia","4970326|9365948"
"Mid-term evaluation of a project to establish two entities within Nepal's Department of Irrigation - a Systems Management Division (SMD) and an Irrigation Management Center (IMC) - to help develop and sustain efficient irrigation management practices.  External evaluation covers the period 1985-5/89. Despite serious technical and staffing constraints, progress in implementing both SMD and IMC has been remarkable.  A great deal of credit belongs to certain dedicated and important staff members who are concerned with promoting participatory irrigation management. Unfortunately, the overall quality of TA support has not been commensurate with this high level of commitment. The SMD is conducting activities in two sites:  the Sirsia-Dudhaura system in the Terai and the Hande Tar system in the hills.  The first intervention will establish joint Department of Irrigation/farmer management, while the second will be completely handed over to farmers. Efforts to establish water user associations have made much progress, and the associations have developed skills in mobilizing resources and resolving conflicts.  Until now, operations and maintenance activities have concentrated on essential structural improvements due to the significant physical deterioration of the irrigation systems at both sites.  Monitoring, evaluation, and feedfack efforts were initiated only recently, and are insufficient for the project's information requirements. Initial projections for developing the IMC were unreasonably high, and the center has not yet been institutionalized.  IMC is currently located in temporary quarters at Pokhara, and construction of a permanent facility is about to begin.  Staffing problems have been constant, and the core staff needs to be strengthened considerably in order to perform as expected. Nonetheless, overall results have been encouraging.  Between 3/88 and 3/89, IMC organized 21 in-country training activities for 300 participants and provided 20 short-term overseas training activities for 64 irrigation professionals.  IMC research activities have also been ambitious, albeit constrained by insufficient staff size.  The pressure to complete the 14 committed studies has resulted in an emphasis on quantity over quality. The Government of Nepal's Sector Program and other irrigation sector developments have qualitatively changed the environment in which the project operates, as well as the demands made upon the project.  It is recommended that the project be redesigned and extended to at least 10 years to take advantage of these new opportunities.","ISPAN activity no. 646B|Project title: Irrigation support project for Asia and the Near|East (ISPAN)","Special Evaluation","Documents","ANE-0289-C-00-7044-00","","7/1/1989 12:00:00 AM","","Irrigation|Agricultural water management|Water supply structure maintenance|Government departments|Institution building|Irrigation system construction","Nepal","http://pdf.usaid.gov/pdf_docs/PDAAZ713.pdf","1,679 KB","000333 - Camp Dresser and McKee, Inc. (CDM)","","008583 - USAID. Mission to Nepal","English","application/pdf","Interim evaluation","","Kadi, Mohaned Ait|Easter, K. William|et al.","","Jul 1989","","","ISPAN report, no. 16","Irrigation management project : midterm evaluation report","","PD-AAZ-713","https://dec.usaid.gov/dec/content/Detail.aspx?ctID=ODVhZjk4NWQtM2YyMi00YjRmLTkxNjktZTcxMjM2NDBmY2Uy&rID=MjA3OTAy","Nepal","3670153|3980289"
"Interim evaluation of a project to support the delivery of family planning (FP) services by private sector entities, both PVO's and for-profit enterprises.  External evaluation covers the period 9/85-2/89. The project is on schedule, with 62 of a targeted 80 subprojects (SP's) initiated.  Of these, 42 are service delivery SP's in which personnel seem dedicated and services appear of high quality; some SP's are quite innovative.  In many countries, project staff have established good working relationships and name recognition as well as a positive attitude toward the project concept.  Workshops have helped spread the concept and some businesses have expanded the provision of services using their own funds. In one country, a coordinating unit has been established that may serve to institutionalize the project concept at the national level. Despite these achievements, overall project impact is not likely to be significant.  First, project efforts are too diffuse.  The project has no overarching strategy for targeting key economic sectors and industries for employment-based activities. Instead, the project has tended to work only with the large companies in the organized sector that are easiest to penetrate, such as the mining industry and plantations.  Second, major increases in prevalence will probably either not be achieved or not be attributable to the project.  Only 250,000-450,000 acceptors are expected, and many of these are continuing clients of participating firms that were already providing FP services. Third, despite good work with PVO's, the financial problems of most PVO's have drained project resources away from efforts to develop new delivery approaches in the for-profit sector. It is recommended that the project consolidate activities in fewer countries, decentralize authority, and place higher priority on the systematic collection and dissemination of information on successful approaches to FP service delivery.  No new PVO activities should be aimed solely at PVO strengthening or self-sustainability.  PVO's should be used only to provide support services to participating for-profit firms in such areas as market training and public education.","Companion evaluation summary: PD-ABB-595|Project title: Population technical assistance (POPTECH)","Special Evaluation","Documents","DPE-3024-Z-00-8078-00","","8/1/1989 12:00:00 AM","","Family planning services|Private enterprises|Private sector|Private voluntary organizations","","http://pdf.usaid.gov/pdf_docs/PDAAZ733.pdf","6,735 KB","006243 - Dual & Associates, Inc.|000673 - International Science and Technology Institute, Inc. (ISTI)","","000191 - USAID. Bur. for Science and Technology. Ofc. of Population","English","application/pdf","Interim evaluation","","Pillsbury, Barbara L. K.|Akin, John S.|et al.","","18 Aug 1989","","Report no. 88-008-081","","Midterm evaluation of the enterprise program","","PD-AAZ-733","https://dec.usaid.gov/dec/content/Detail.aspx?ctID=ODVhZjk4NWQtM2YyMi00YjRmLTkxNjktZTcxMjM2NDBmY2Uy&rID=MjA3OTA5","Development Support","9363024|9363034"
"","Companion evaluation summary: PD-ABA-257","Special Evaluation","Documents","","","6/1/1989 12:00:00 AM","","Agricultural surveys|Policy analysis","Rwanda","http://pdf.usaid.gov/pdf_docs/PDAAZ717.pdf","3,405 KB","000788 - University of Michigan. Center for Research on Economic Development","","008598 - USAID. Mission to Rwanda","English","application/pdf","Interim evaluation","","Steedman, Charles|Elias, Christine|Nyabyenda, Pierre","Agricultural policy","Jun 1989","","","","Rwanda, agricultural surveys and policy analysis project (696-0126) : mid-term evaluation","","PD-AAZ-717","https://dec.usaid.gov/dec/content/Detail.aspx?ctID=ODVhZjk4NWQtM2YyMi00YjRmLTkxNjktZTcxMjM2NDBmY2Uy&rID=MjA3OTE0","Rwanda","6960126"
"Mid-term evaluation of a project to help public and private sector family planning programs conduct effective information, education, and communication (IEC) activities.  The project is implemented by Johns Hopkins University's Population Communication Services (JHU/PCS). External evaluation covers the period 9/86-6/89. JHU/PCS has already met and, in most cases, exceeded quantitative goals in terms of the number of country projects underway (43 compared to the 25-30 targeted), TA trips, needs assessments, development of national communication strategies, and provision of materials.  The project's innovative approaches have given renewed energy to the IEC function in family planning programs and convinced previously doubtful A.I.D. administrators, Mission personnel, and developing country policymakers and program officials of the value of large investment in IEC activities. Among the innovations that JHU/PCS has pioneered are: (1) the entertainment/education strategy for mass media communication; (2) the media/materials center at JHU/PCS, one of the largest and best in the world; (3) the concept of communication as a process which includes needs assessment, formative evaluation, message production, and impact evaluation; (4) a methodology for evaluating the impact of IEC projects on the family planning programs of which they are a part; and (5) an emphasis on interpersonal communication activities such as counseling, client-clinic staff communication, and telephone hot-lines. These achievements notwithstanding, the project needs to make improvements in several areas.  The three top individuals in project are overextended and the functional division of labor is unclear.  JHU/PCS has negotiated buy-ins over its funding ceiling, which may cause a crisis that will need to be resolved by S&T/POP.  While senior staff are highly qualified, many intermediate staff do not have advanced academic training in communication.  The JHU/PCS consultant roster is inadequate to provide the type of services expected.  Many of the print materials in the Africa region are not as innovative as those produced elsewhere, and little attention has been paid to working with journalists in the newspaper and magazine industries.  The cost of sending JHU/PCS advisors overseas - mostly for single-country visits - has been tremendous, and the use resident advisors should be considered.  The technical resources of subcontractors have not been fully exploited.","Project title: Population technical assistance (POPTECH)","Special Evaluation","Documents","DPE-3024-Z-00-8078-00","","8/1/1989 12:00:00 AM","","IEC|Family planning promotion programs|Family planning education","","http://pdf.usaid.gov/pdf_docs/PDAAZ718.pdf","2,219 KB","006243 - Dual & Associates, Inc.|000673 - International Science and Technology Institute, Inc. (ISTI)","","000191 - USAID. Bur. for Science and Technology. Ofc. of Population","English","application/pdf","Interim evaluation","","McWilliam, John|Rogers, Everett M.","","21 Aug 1989","","Report no. 88-011-093","","Evaluation of the population communication services project (1986-1989)","","PD-AAZ-718","https://dec.usaid.gov/dec/content/Detail.aspx?ctID=ODVhZjk4NWQtM2YyMi00YjRmLTkxNjktZTcxMjM2NDBmY2Uy&rID=MjA3OTE1","Development Support","9363024|9363004"
