Abstract,Ancillary_Data,Bibliographic_Type,ContentType,Contract_Grant_Number,Credit,Date_Resource_Created,Description,Descriptors_Topical,Descriptors_Geographic,File,File_Size,Inst_Author,Inst_Publisher,Inst_Sponsor,Language,Mime_Type,New_Thesaurus_Terms,Notes,Personal_Author,Primary_Subject,Publication_Date_Freeform,Related_Doc_Links,Report_Number,Series_Title,Title,Title_Translated,Unique_ID,URI,USAID_Geography,USAID_Project_Number
"","Project title: Cameroon expanded impact child survival project (EIP)|Project title: Child survival and health grants program (CSHGP)","Special Evaluation","Documents","GHS-A-00-05-00015-00","","10/1/2008 12:00:00 AM","","Child survival activities|Maternal child health care|Behavior change|Nutrition improvement|Private voluntary organizations|Human capacity development|Malaria|Diarrhea|Immunizations|Community participation|IEC|Care of the newborn|Pneumonia","Cameroon","http://pdf.usaid.gov/pdf_docs/PDACM196.pdf","1,124 KB","011220 - PLAN International USA (Childreach)","","011222 - USAID. Bur. for Global Health. Ofc. of Health, Infectious Diseases, and Nutrition","English","application/pdf","Interim evaluation","","Kittle, Bonnie L.|Tsuma, Laban, ed.","Child survival","31 Oct 2008","","","","Cameroon expanded impact child survival project (EIP) : mid-term evaluation -- center, east and northwest provinces","","PD-ACM-196","https://dec.usaid.gov/dec/content/Detail.aspx?ctID=ODVhZjk4NWQtM2YyMi00YjRmLTkxNjktZTcxMjM2NDBmY2Uy&rID=MzA0MDU5","Cameroon","9363114"
"","Related documents: Annex 5 - PN-ADN-458 and Annex 6 - PN-ADN-459","Special Evaluation","Documents","GHS-A-00-06-00019-00","","10/1/2008 12:00:00 AM","","Child survival activities|Maternal child health care|Behavior change|Nutrition improvement|Private voluntary organizations|Human capacity development|Malaria|Diarrhea|Immunizations|Community participation|IEC|Care of the newborn|Integrated management of childhood illnesses (IMCI)|Pneumonia","Liberia","http://pdf.usaid.gov/pdf_docs/PDACM219.pdf","976 KB","012966 - Medical Teams International (MTI)","","011222 - USAID. Bur. for Global Health. Ofc. of Health, Infectious Diseases, and Nutrition","English","application/pdf","Interim evaluation","","Jennings, Joan M.|Massaquoi, Bill|et al.","Child survival","Oct 2008","","","","Grand Cape Mount child survival project : improved child health in a transitional state through IMCI : midterm evaluation","","PD-ACM-219","https://dec.usaid.gov/dec/content/Detail.aspx?ctID=ODVhZjk4NWQtM2YyMi00YjRmLTkxNjktZTcxMjM2NDBmY2Uy&rID=MzA0MTEy","Liberia",""
"","Project title: Child survival and health grants (CSHGP)|Delmas Commune: St. Martin and Cite Okay-Jeremie -- Petion-Ville|Commune: Jalousie and Bois de Moquette -- Port au Prince Commune:|Descayettes","Special Evaluation","Documents","GHS-A-00-05-00018-00","","10/1/2008 12:00:00 AM","","Child survival activities|Maternal child health care|Behavior change|Nutrition improvement|Private voluntary organizations|Human capacity development|HIV/AIDS|Malaria|Diarrhea|Immunizations|Community participation|Advocacy|Respiratory diseases|Disadvantaged groups|Care of the newborn|Integrated management of childhood illnesses (IMCI)","Haiti","http://pdf.usaid.gov/pdf_docs/PDACM240.pdf","212 KB","010283 - Concern Worldwide","","011222 - USAID. Bur. for Global Health. Ofc. of Health, Infectious Diseases, and Nutrition","English","application/pdf","Interim evaluation","","Rubardt, Marcie","Child survival","31 Oct 2008","","","","Midterm evaluation report : the urban health project for five disadvantaged neighborhoods of metropolitan area of Port-au-Prince, Haiti","","PD-ACM-240","https://dec.usaid.gov/dec/content/Detail.aspx?ctID=ODVhZjk4NWQtM2YyMi00YjRmLTkxNjktZTcxMjM2NDBmY2Uy&rID=MzA0MTkw","Haiti","9363114"
"","Contract number listed in document as: GEG-I-000-no. 200014-00|Task order no. 2|Project title: AMAP business development services|Project title: Cambodia micro, small and medium enterprise (MSME)","Final Evaluation Report","Documents","GEG-I-00-02-00014-00","","10/1/2008 12:00:00 AM","","","Cambodia","http://pdf.usaid.gov/pdf_docs/PDACM256.pdf","749 KB","012973 -|006727 - Development Alternatives, Inc. (DAI)","","010967 - USAID. Bur. for Economic Growth, Agriculture and Trade. Ofc. of Microenterprise Development|008523 - USAID. Mission to Cambodia","English","application/pdf","","","","Small scale enterprises","Oct 2008","","","","Cambodia micro, small and medium-sized enterprise project (MSME) : final monitoring and evaluation report","","PD-ACM-256","https://dec.usaid.gov/dec/content/Detail.aspx?ctID=ODVhZjk4NWQtM2YyMi00YjRmLTkxNjktZTcxMjM2NDBmY2Uy&rID=MzA0MjM3","Cambodia",""
"","Project title: Strengthening the NGO sector in Nepal (SNSN)|SANDEEP (Sanstaghat Diego Pariwartan - sustainable organizational|change)","Final Evaluation Report","Documents","AFP-A-00-03-00011-00","","9/1/2008 12:00:00 AM","","Indigenous private voluntary organizations|Institution building|Sector evaluation|Project sustainability|Strategic objectives|Performance indicators|Advocacy|Local capacity building","Nepal","http://pdf.usaid.gov/pdf_docs/PDACM275.pdf","817 KB","001407 - Save the Children (U.S.)","","007746 - USAID. Bur. for Humanitarian Response. Ofc. of Private and Voluntary Cooperation (PVC)","English","application/pdf","Final evaluation|Nongovernmental organizations (NGO)","","Thapa, Mohan M.|Badu, Kedar P.|Pandey, Shanker R.","Private voluntary organizations","1 Sep 2008","","","","Final evaluation of strengthening the NGO sector in Nepal (SNSN) project","","PD-ACM-275","https://dec.usaid.gov/dec/content/Detail.aspx?ctID=ODVhZjk4NWQtM2YyMi00YjRmLTkxNjktZTcxMjM2NDBmY2Uy&rID=MzA0Mjgw","Nepal",""
"","'Final report'|Evaluated project title: Decentralisation gouvernance locale|progres (DGL felo)","Special Evaluation","Documents","","","11/1/2008 12:00:00 AM","","Governance|Impact assessment|Decentralization|Human capacity development|Local level|Public administration|Political participation|Financial management|Institution building|Conflict resolution|Civil society","Senegal","http://pdf.usaid.gov/pdf_docs/PDACM341.pdf","688 KB","009479 - SENAGROSOL CONSULT","","008600 - USAID. Mission to Senegal","English","application/pdf","Interim evaluation|Transparency","","","Governance","Nov 2008","","","","DGL felo program impact assessment","","PD-ACM-341","https://dec.usaid.gov/dec/content/Detail.aspx?ctID=ODVhZjk4NWQtM2YyMi00YjRmLTkxNjktZTcxMjM2NDBmY2Uy&rID=MzA0NDQx","Senegal",""
"","Project title: Global research activity (GRA)|Evaluated project title: Integrated nutrition and health program|(INHP) II|Related document: PD-ACM-356","Special Evaluation","Documents","GHS-A-00-03-00019-00","","1/1/2008 12:00:00 AM","","Nutrition|Partnerships|Maternal child health care|Child survival activities|Infant mortality|Private voluntary organizations|Baseline studies|Community participation|Child nutrition|Maternal nutrition|Statistical analysis|Infant feeding programs|Micronutrients|Care of the newborn|Local capacity building","India","http://pdf.usaid.gov/pdf_docs/PDACM361.pdf","958 KB","011115 - Johns Hopkins University. Bloomberg School of Public Health","","011222 - USAID. Bur. for Global Health. Ofc. of Health, Infectious Diseases, and Nutrition","English","application/pdf","Interim evaluation","","Dreyfuss, Michele|Iannotti, Lora|et al.","Nutrition","28 Jan 2008","","","","Evaluation research of the nutrition interventions in the integrated nutrition and health program (INHP) II areas of CARE India : final report","","PD-ACM-361","https://dec.usaid.gov/dec/content/Detail.aspx?ctID=ODVhZjk4NWQtM2YyMi00YjRmLTkxNjktZTcxMjM2NDBmY2Uy&rID=MzA0NTAx","India","936311601"
"","Evaluated project title: Sudan health transformation project (SHTP)","Special Evaluation","Documents","","","3/1/2008 12:00:00 AM","","Primary health care|Health delivery|Sector restructuring|Health policy|Resource allocation|Human capacity development|Indigenous private voluntary organizations|Behavior change|IEC|Reproductive health|Maternal child health care|Family planning|HIV/AIDS|Tuberculosis|Malaria|Local capacity building|Quality of care","Sudan","http://pdf.usaid.gov/pdf_docs/PDACM390.pdf","1,454 KB","012990 -","","008607 - USAID. Mission to Sudan","English","application/pdf","Interim evaluation","","Neuse, Margaret|Davis, Connie|et al.","Primary health care","Mar 2008","","","","Sudan health transformation project (SHTP) assessment report","","PD-ACM-390","https://dec.usaid.gov/dec/content/Detail.aspx?ctID=ODVhZjk4NWQtM2YyMi00YjRmLTkxNjktZTcxMjM2NDBmY2Uy&rID=MzA0NTgw","Sudan",""
"","Task order no. REE-I-07-05-00053-00|Order no. 09|Contract no. listed in document as: REE-I-00-05-00053","Special Evaluation","Documents","REE-I-00-05-00053-00","","11/1/2008 12:00:00 AM","","Higher education|Strategic objectives|Scholarships|Gender analysis|Partnerships|Human capacity development|Universities and colleges|Education for development|Educational grants|Scientific cooperation|Technological development|Budgets|Equity|Endowments|Government departments|Public-private partnerships","Pakistan","http://pdf.usaid.gov/pdf_docs/PDACM417.pdf","986 KB","000223 - Academy for Educational Development, Inc. (AED)","","008588 - USAID. Mission to Pakistan","English","application/pdf","Public-private partnerships","","","Higher education","21 Nov 2008","","","","Evaluation of USAID higher education portfolio : volume I -- assessment report","","PD-ACM-417","https://dec.usaid.gov/dec/content/Detail.aspx?ctID=ODVhZjk4NWQtM2YyMi00YjRmLTkxNjktZTcxMjM2NDBmY2Uy&rID=MzA0NjU2","Pakistan",""
"","Annex 13: PN-ADN-791","Final Evaluation Report","Documents","GHS-A-00-03-00015-00","","12/1/2008 12:00:00 AM","","Child survival activities|Maternal child health care|Behavior change|IEC|Human capacity development|Health policy|Advocacy|Access to services|Community participation|Project sustainability|Villages|Partnerships|Equity|Care of the newborn|Scaling up (development projects)","India","http://pdf.usaid.gov/pdf_docs/PDACM419.pdf","4,247 KB","006077 - Aga Khan Foundation U.S.A.","","011222 - USAID. Bur. for Global Health. Ofc. of Health, Infectious Diseases, and Nutrition","English","application/pdf","Final evaluation","","","Child survival","19 Dec 2008","","","","Child survival program - India final evaluation : community-led initiatives for child survival (CLICS), Wardha District, Maharashtra State, India","","PD-ACM-419","https://dec.usaid.gov/dec/content/Detail.aspx?ctID=ODVhZjk4NWQtM2YyMi00YjRmLTkxNjktZTcxMjM2NDBmY2Uy&rID=MzA0NjU4","India",""
"","Project title: Child survival and health grants program (CSHGP)|Project location: Seven Districts in the Democratic Republic of|Timor-Leste: Aileu, Ermera, Manatuto, Liquica, Manufahi, Ainaro,|and Dili","Final Evaluation Report","Documents","GHS-A-00-04-00022-00","","12/1/2008 12:00:00 AM","","","Timor-Leste","http://pdf.usaid.gov/pdf_docs/PDACM429.pdf","670 KB","011251 - Health Alliance International","","011222 - USAID. Bur. for Global Health. Ofc. of Health, Infectious Diseases, and Nutrition","English","application/pdf","","","Mize, Lucy","Maternal child health care","Dec 2008","","","","Improving maternal and newborn health in Timor Leste : final evaluation report","","PD-ACM-429","https://dec.usaid.gov/dec/content/Detail.aspx?ctID=ODVhZjk4NWQtM2YyMi00YjRmLTkxNjktZTcxMjM2NDBmY2Uy&rID=MzA0Njkz","East Timor","9363114"
"","Project title: Child survival and health grants program (CSHGP)","Final Evaluation Report","Documents","GHS-A-00-03-00002-00","","12/1/2008 12:00:00 AM","","","Senegal","http://pdf.usaid.gov/pdf_docs/PDACM430.pdf","238 KB","000235 - Africare, Inc.","","011222 - USAID. Bur. for Global Health. Ofc. of Health, Infectious Diseases, and Nutrition","English","application/pdf","","","Joseph, Marguerite","Child survival","Dec 2008","","","","Tambacounda health start program (THSP) : final evaluation report -- cooperative agreement no. GHS-A-00-03-00002-00, October 2003-September 2008","","PD-ACM-430","https://dec.usaid.gov/dec/content/Detail.aspx?ctID=ODVhZjk4NWQtM2YyMi00YjRmLTkxNjktZTcxMjM2NDBmY2Uy&rID=MzA0NzEy","Senegal","9363114"
"","Contract listed on document as: EEM-I-02-07-00003-02|Task order no. 02|Project title: Trade and investment program for a competitive export economy (TIPCEE)","Special Evaluation","Documents","EEM-I-02-07-00003-02|EEM-I-00-07-00003-00","","10/1/2008 12:00:00 AM","","International trade|Export promotion|Investment promotion|Strategic planning|Agricultural product marketing|Agribusiness|Economic sectors|Business support services|Management development|Institution building|Policy reform|Poverty reduction|Value chains","Ghana","http://pdf.usaid.gov/pdf_docs/PDACM807.pdf","663 KB","009568 - Sibley International","","011274 - USAID. Bur. for Economic Growth, Agriculture and Trade. Ofc. of Economic Growth","English","application/pdf","Interim evaluation","","Easterling, Tom|Fox, James W.|Sands, Fenton B.","Exports","Oct 2008","","","","Assessment of the trade and investment program for competitive export (TIPCEE)","","PD-ACM-807","https://dec.usaid.gov/dec/content/Detail.aspx?ctID=ODVhZjk4NWQtM2YyMi00YjRmLTkxNjktZTcxMjM2NDBmY2Uy&rID=MzA0NzY3","Ghana",""
"","Integrating gender for development results: women in development|Project title: Gender matters (GM) IQC","Special Evaluation","Documents","GEW-I-00-02-00020-00","","9/1/2008 12:00:00 AM","","Women in development|Gender analysis|Technical assistance|Strategic planning|Equity|Legal reform|Sex roles|Impact assessment|Sector evaluation|Human capacity development|Development project evaluation|Economic sectors","Latin America|Armenia|Colombia","http://pdf.usaid.gov/pdf_docs/PDACM808.pdf","1,002 KB","000709 - Juarez and Associates, Inc.","","010959 - USAID. Bur. for Economic Growth, Agriculture and Trade. Ofc. of Women in Development","English","application/pdf","Interim evaluation|Gender equality","","","Women in development","Sep 2008","","","","Interim assessment of the impact/results of the short-term technical assistance and training task order : final report","","PD-ACM-808","https://dec.usaid.gov/dec/content/Detail.aspx?ctID=ODVhZjk4NWQtM2YyMi00YjRmLTkxNjktZTcxMjM2NDBmY2Uy&rID=MzA0Nzcy","Women in Development",""
"","Related document: PD-ACM-489|Also known as: Annex B","Final Evaluation Report","Documents","294-A-00-06-00207-00","","9/1/2008 12:00:00 AM","","Food security|Management goals|Strategic objectives|Agribusiness|Rural populations|Milk products|Horticulture|Vegetable crops|Agricultural product marketing|Olives|Baseline studies|Agricultural extension|Farm management|Performance indicators","West Bank","http://pdf.usaid.gov/pdf_docs/PDACM490.pdf","890 KB","010380 - ACDI/VOCA","","009496 - USAID. Mission to West Bank and Gaza","English","application/pdf","Final evaluation|Livelihood","","","Food security","Sep 2008","","","","West Bank food security program : final evaluation report","","PD-ACM-490","https://dec.usaid.gov/dec/content/Detail.aspx?ctID=ODVhZjk4NWQtM2YyMi00YjRmLTkxNjktZTcxMjM2NDBmY2Uy&rID=MzA0Nzc1","West Bank",""
"","Included in: PD-ACM-563","Final Evaluation Report","Documents","167-G-00-07-00101-00","","10/1/2008 12:00:00 AM","","","Kosovo","http://pdf.usaid.gov/pdf_docs/PDACM564.pdf","417 KB","012149 - The Center for Civic Education (CCE)","","010393 - USAID. Mission to Kosovo","English","application/pdf","","","","Democratization","15 Oct 2008","","","","Final evaluation report : 'reconciliation through civic education' 167-G-00-07-00101-00","","PD-ACM-564","https://dec.usaid.gov/dec/content/Detail.aspx?ctID=ODVhZjk4NWQtM2YyMi00YjRmLTkxNjktZTcxMjM2NDBmY2Uy&rID=MzA0OTUz","Kosovo (Serbia)",""
"This report summarizes the results of a one-year evaluation of the impact on job creation of United States Government (USG) economic growth programs from 1991 to 2006 in countries that received assistance through Support for East European Democracy (SEED) and the Freedom Support Act (FSA).  This investigation was sponsored by USAID and conducted by the Melikian Center for Russian, Eurasian, and East European Studies at Arizona State University (ASU), in cooperation with Higher Education for Development (HED). The report has two halves, one theoretical and one applied.  The theoretical half includes a sketch of USG economic growth efforts in the region (Section I), a discussion of the definition and measurement of job creation (Section II), and an overview of the literature on economic assistance and employment growth in transitioning economies (Section III). The applied half of the report describes attempts to quantify the impact of USG assistance using macroeconomic data, project reports, and field surveys.  Section IV presents a method for producing baseline estimates of the impact of USG assistance using macroeconomic data and USG expenditure data.  Section V discusses the difficulty of attempting to derive quantitative estimates of job creation from project reports, outlines an alternative methodology based on field studies, and summarizes the results of implementing that methodology in three test countries: Bulgaria, Macedonia, and Kyrgyzstan. Following the body of the report are appendices containing expanded, stand-alone discussions of the development of labor markets in transition economies (Appendix A), job creation and its measurement (Appendix B), and the role of microfinance in the development of transition-economy labor markets (Appendix F).  Appendices C, D, and E provide background material and details on techniques and analyses discussed in the report.  (Author abstract)","'This investigation was .... conducted .... in cooperation with|Higer Education for Development (HED)'","Special Evaluation","Documents","","","1/1/2008 12:00:00 AM","","Development programs|Economic impact|Employment|Economies in transition|Labor market","Central and Eastern Europe|Central Asia|Russia|Eurasia","http://pdf.usaid.gov/pdf_docs/PDACM645.pdf","1,027 KB","013021 -","","000035 - U.S. Agency for International Development (USAID)","English","application/pdf","","","Brada, Josef|Bah, El-hadj|et al.","Employment","2008","","","","Assessing the impact of U.S. Government assistance on job creation","","PD-ACM-645","https://dec.usaid.gov/dec/content/Detail.aspx?ctID=ODVhZjk4NWQtM2YyMi00YjRmLTkxNjktZTcxMjM2NDBmY2Uy&rID=MzA1MTAz","",""
"","Footer title: Accelerated learning program - PLUS mid term review :|final report|Project title: Accelerated learning program for positive living and|united service (ALPP)|Project also known as: ALP - PLUS","Special Evaluation","Documents","","","11/1/2008 12:00:00 AM","","Basic education|Educational delivery|Access to education|Educational surveys|School dropouts|Human capacity development|Community participation|Indigenous private voluntary organizations|Partnerships|Impact assessment|Student performance|Age|Information manAgement|Contractors|Scaling up (development projects)","Liberia","http://pdf.usaid.gov/pdf_docs/PDACM655.pdf","957 KB","009054 - DevTech Systems, Inc.","","000035 - U.S. Agency for International Development (USAID)","English","application/pdf","Interim evaluation|Life skills","","Coyne, Geoff|Prince, Bonnie L.|Nielson, Eldora Burns","Basic education","7 Nov 2008","","","","Accelerated learning program for positive living and united service : mid term evaluation review","","PD-ACM-655","https://dec.usaid.gov/dec/content/Detail.aspx?ctID=ODVhZjk4NWQtM2YyMi00YjRmLTkxNjktZTcxMjM2NDBmY2Uy&rID=MzA1MTQy","Liberia",""
"","Project title: Global health technical assistance (GH tech)","Special Evaluation","Documents","GHS-I-00-05-00005-00","","12/1/2008 12:00:00 AM","","Reproductive health|Business skills|Private health care|Medical education|Investment|Rural areas|Nurse midwives","","http://pdf.usaid.gov/pdf_docs/PDACM846.pdf","110 KB","011976 - QED Group, LLC|011830 - CAMRIS International|011880 - Social and Scientific Systems, Inc. (SSS)","","010822 - USAID. Bur. for Global Health","English","application/pdf","Interim evaluation","","","Health finance","Dec 2008","","08-001-83","","Mid-term assessment summary : banking on health project","","PD-ACM-846","https://dec.usaid.gov/dec/content/Detail.aspx?ctID=ODVhZjk4NWQtM2YyMi00YjRmLTkxNjktZTcxMjM2NDBmY2Uy&rID=MzA1MjA3","Ctr for Population, Health & Nutrition","9363098Aa"
"","Project title: Global health technical assistance (GH tech)|Evaluated project title: Fostering optimization of resources and|technical excellence for national health (FORTE Saude)","Special Evaluation","Documents","GHS-I-00-05-00005-00","","12/1/2008 12:00:00 AM","","Health care administration|Health policy|Access to services|Strategic planning|Private voluntary organizations|Management information systems|Management reform|Policy reform|Personnel development|Community participation|Human capacity development|Public-private partnerships|Quality of care","Mozambique","http://pdf.usaid.gov/pdf_docs/PDACM682.pdf","1,041 KB","011976 - QED Group, LLC|011830 - CAMRIS International|011880 - Social and Scientific Systems, Inc. (SSS)","","010822 - USAID. Bur. for Global Health","English","application/pdf","Interim evaluation","","kropsch, Lia|Robinson, Jennifer","Health (General)","Dec 2008","","08-001-109","","FORTE Saude mid-term evaluation","","PD-ACM-682","https://dec.usaid.gov/dec/content/Detail.aspx?ctID=ODVhZjk4NWQtM2YyMi00YjRmLTkxNjktZTcxMjM2NDBmY2Uy&rID=MzA1MjA5","Mozambique","9363098Aa"
"","","Special Evaluation","Documents","EDH-E-00-08-00003-00|AID-EDH-E-00-08-00003","","11/1/2008 12:00:00 AM","","Scholarships|Faculty|Educational development|Masters degrees|Higher education","West Bank|Gaza Strip","http://pdf.usaid.gov/pdf_docs/PDACM722.pdf","283 KB","012322 - Aguirre International","","011326 - USAID. Bur. for Economic Growth, Agriculture and Trade. Ofc. of Education","English","application/pdf","","","Wein, Gerald|Auten, Sarah","Higher education","30 Nov 2008","","","","Evaluation of the Clinton and Master's Degree and Presidential Scholarship programs and the Palestinian Faculty Development Program","","PD-ACM-722","https://dec.usaid.gov/dec/content/Detail.aspx?ctID=ODVhZjk4NWQtM2YyMi00YjRmLTkxNjktZTcxMjM2NDBmY2Uy&rID=MzA1Mjg4","West Bank/Gaza",""
"The goal of this mid-term evaluation is to identify strengths and weaknesses to inform the future direction of services provided by the Partnership Project (see Appendix A: Scope of Work).  USAID/Zimbabwe asked the evaluation team to assess emerging impact, review the continuing relevance of project objectives, and if necessary suggest amendments to the program.  It will be used by USAID, DFID, and the project to determine the course of the project through 2010 in terms of: (1) whether or not the project is on target to achieve its goals as stated in the contract; (2) strengths and weaknesses within the project portfolio; (3) areas and activities that warrant continued investment, and untried initiatives and approaches that would likely improve access to and use and quality of HIV/AIDS products and services; (4) recommendations for mitigating weaknesses; and (5) recommendations for improving administration, coordination, and implementation of the project.  (Author abstract, modified)","Project title: Global health technical assistance (GH tech)","Special Evaluation","Documents","GHS-I-00-05-00005-00","","10/1/2008 12:00:00 AM","","HIV/AIDS|Behavior change|Disease prevention and control|Information dissemination|Interpersonal communication|Condoms|Voluntary Counseling and Testing (VCT) for HIV/AIDS|Female condoms","Zimbabwe","http://pdf.usaid.gov/pdf_docs/PDACM725.pdf","406 KB","011976 - QED Group, LLC|011830 - CAMRIS International|010496 - United Kingdom. Dept. for International Development (DFID)","","011880 - Social and Scientific Systems, Inc. (SSS)|010822 - USAID. Bur. for Global Health","English","application/pdf","","","Jansen, William|James, Victoria","HIV / AIDS","Oct 2008","","08-001-103","","Zimbabwe HIV/AIDS partnership project & behavior change programme : a joint USAID/DFID assessment","","PD-ACM-725","https://dec.usaid.gov/dec/content/Detail.aspx?ctID=ODVhZjk4NWQtM2YyMi00YjRmLTkxNjktZTcxMjM2NDBmY2Uy&rID=MzA1Mjkw","Zimbabwe","9363098Aa"
"","Evaluated project title: Local voices|Evaluated non-USAID project title: Turnaround time","Final Evaluation Report","Documents","","","9/1/2008 12:00:00 AM","","HIV/AIDS","Kenya|Nigeria|Ethiopia","http://pdf.usaid.gov/pdf_docs/PDACM746.pdf","439 KB","008239 - Internews Network","","013626 - U.S. President's Emergency Plan for AIDS Relief (PEPFAR)|000035 - U.S. Agency for International Development (USAID)","English","application/pdf","","","Cohen, Jon|Zivetz, Laurie|Malan, Mia","HIV / AIDS","Sep 2008","","","","Training journalists to report on HIV/AIDS : final evaluation of a global program","","PD-ACM-746","https://dec.usaid.gov/dec/content/Detail.aspx?ctID=ODVhZjk4NWQtM2YyMi00YjRmLTkxNjktZTcxMjM2NDBmY2Uy&rID=MzA1MzQ0","Ctr for Population, Health & Nutrition",""
"","'Task order #04, Development Credit Authority evaluations'|Project title: Support for economic growth and institutional reform/general business trade and investment II (SEGIR/GBTI II)|Evaluation summary: DCA loan guarantee Ghana impact brief|(PD-ACM-751)","Special Evaluation","Documents","EEM-I-00-07-00001-00","","3/1/2008 12:00:00 AM","","","Ghana","http://pdf.usaid.gov/pdf_docs/PDACM752.pdf","592 KB","012567 - SEGURA/IP3 Partners, LLC","","011274 - USAID. Bur. for Economic Growth, Agriculture and Trade. Ofc. of Economic Growth","English","application/pdf","","","","Development finance","25 Mar 2008","","","","Ghana EcoBank DCA guarantee evaluation","","PD-ACM-752","https://dec.usaid.gov/dec/content/Detail.aspx?ctID=ODVhZjk4NWQtM2YyMi00YjRmLTkxNjktZTcxMjM2NDBmY2Uy&rID=MzA1MzUz","Ghana",""
