Abstract,Ancillary_Data,Bibliographic_Type,ContentType,Contract_Grant_Number,Credit,Date_Resource_Created,Description,Descriptors_Topical,Descriptors_Geographic,File,File_Size,Inst_Author,Inst_Publisher,Inst_Sponsor,Language,Mime_Type,New_Thesaurus_Terms,Notes,Personal_Author,Primary_Subject,Publication_Date_Freeform,Related_Doc_Links,Report_Number,Series_Title,Title,Title_Translated,Unique_ID,URI,USAID_Geography,USAID_Project_Number
"","SO 2.1.3.4|Project number originally used for the Cairo West power station|project, FYs 1963-1978|Project title: Integrated managing for results II|Evaluated project title: Administration of justice II (AOJS II)","Special Evaluation","Documents","RAN-M-00-04-00049-00","","6/1/2008 12:00:00 AM","","Administration of law|Rule of law|Judicial reform|Courts|Development program monitoring|Development program evaluation","Egypt","http://pdf.usaid.gov/pdf_docs/PDACN015.pdf","658 KB","003970 - Management Systems International, Inc. (MSI)","","000035 - U.S. Agency for International Development (USAID)","English","application/pdf","","","Beyna, Larry S.","Rule of law","Jun 2008","","","","Rapid assessment of USAID/Egypt's administration of justice II project","","PD-ACN-015","https://dec.usaid.gov/dec/content/Detail.aspx?ctID=ODVhZjk4NWQtM2YyMi00YjRmLTkxNjktZTcxMjM2NDBmY2Uy&rID=MzA1Mzg2","Egypt","2630288"
"","Parliamentary development program (PDP)","Special Evaluation","Documents","","","1/1/2008 12:00:00 AM","","","Ukraine","http://pdf.usaid.gov/pdf_docs/PDACM769.pdf","284 KB","011039 - USAID. Regional Mission to Ukraine, Belarus, Moldova","","","English","application/pdf","","","Rudenshiold, Eric|Schulz, Keith","Legislative strengthening","[2008]","","","","Evaluation of the Indiana Univeristy parliamentary development program [and] assessment of the development and functioning of the Verkhovna Rada [and] recommendations for future assistance","","PD-ACM-769","https://dec.usaid.gov/dec/content/Detail.aspx?ctID=ODVhZjk4NWQtM2YyMi00YjRmLTkxNjktZTcxMjM2NDBmY2Uy&rID=MzA1Mzk3","Ukraine",""
"","Task order 036|Contract no. listed on document as: PCE-I-00-98-00016|Initiative title: Pakistan initiative for strategic development and|competitiveness III (PISDAC III)|Project title: Support for economic growth and institutional|reform/general business trade and investment (SEGIR/GBTI)","Special Evaluation","Documents","PCE-I-00-98-00016-00","","5/1/2008 12:00:00 AM","","Economic competition|Business enterprises|Strategic planning|Economic impact|Economic sectors|Economic policy|Policy reform|Human capacity development|Dairy farms|Horticulture|Furniture|Jewelry|Surgical equipment|Employment|Cost benefit analysis|Value chains","Pakistan","http://pdf.usaid.gov/pdf_docs/PDACM771.pdf","1,654 KB","008330 - J.E. Austin Associates, Inc.","","010928 - USAID. Bur. for Economic Growth, Agriculture and Trade. Ofc. of Emerging Markets","English","application/pdf","Impact evaluation|Working groups|Extractive industries|Marble|Granite","","Arocha, Marcos","Business enterprises","31 May 2008","","","","Economic impact assessment of the Pakistan initiative for strategic development and competitiveness (PISDAC) and final report","","PD-ACM-771","https://dec.usaid.gov/dec/content/Detail.aspx?ctID=ODVhZjk4NWQtM2YyMi00YjRmLTkxNjktZTcxMjM2NDBmY2Uy&rID=MzA1NDA3","Pakistan",""
"","'October 11, 2008-November 24, 2008'|Funding mechanisms as written on document: USAID contract no.|GS-10F-0425M -- USAID order no. 306-M-00-07-00502-00 -- USAID task|order no. 2007-012|Project title: Services under program and project offices for","Special Evaluation","Documents","306-M-00-07-00502-00","","1/1/2008 12:00:00 AM","","Human capacity development|Democracy|Public sector|Private sector|Indigenous private voluntary organizations|Higher education|Vocational training|Strategic planning|Partnerships|Institution building|Technical assistance|Financial management|Sustainable development|Local capacity building|Public-private partnerships","Afghanistan","http://pdf.usaid.gov/pdf_docs/PDACM814.pdf","723 KB","000356 - Checchi and Co. Consulting, Inc.|010677 - Louis Berger Group, Inc.","","008504 - USAID. Mission to Afghanistan","English","application/pdf","Interim evaluation","","Leonardo, Ernest|Wooten, John, Jr.|Lombardo, Joseph","Human capacity development","[2008?]","","","","Analysis of USAID's capacity development program (CDP)","","PD-ACM-814","https://dec.usaid.gov/dec/content/Detail.aspx?ctID=ODVhZjk4NWQtM2YyMi00YjRmLTkxNjktZTcxMjM2NDBmY2Uy&rID=MzA1NTEz","Afghanistan",""
"","'May 29-July 16, 2008'|Funding mechanisms as written on document: USAID contract no.|GS-10F-0425M -- USAID order no. 306-M-00-07-00502-00 -- USAID task|order no. 2007-012|Project title: Services under program and project offices for","Special Evaluation","Documents","306-M-00-07-00502-00","","1/1/2008 12:00:00 AM","","Political parties|Institution building|Human capacity development|Political participation|Governance|Elections","Afghanistan","http://pdf.usaid.gov/pdf_docs/PDACM817.pdf","306 KB","000356 - Checchi and Co. Consulting, Inc.","","008504 - USAID. Mission to Afghanistan","English","application/pdf","Interim evaluation","","Austin, Bradley|Leonardo, Ernest","Political development","[2008]","","","","Assessment of political party programming by USAID in the Islamic Republic of Afghanistan","","PD-ACM-817","https://dec.usaid.gov/dec/content/Detail.aspx?ctID=ODVhZjk4NWQtM2YyMi00YjRmLTkxNjktZTcxMjM2NDBmY2Uy&rID=MzA1NTE5","Afghanistan",""
"","Also known as: USAID/Philippines Mindanao program impact evaluation|Task order no. 3|Project title: Services under program and project offices for results tracking (SUPPORT)","Special Evaluation","Documents","DFD-I-00-05-00251-00","","11/1/2008 12:00:00 AM","","Post conflict societies|Conflict resolution|Conflict prevention|Local level|Displaced persons|Human rights|Economic growth|Family health care|Educational development|Environmental management|Energy planning|Peace","Philippines","http://pdf.usaid.gov/pdf_docs/PDACM822.pdf","765 KB","003970 - Management Systems International, Inc. (MSI)","","011008 - USAID. Bur. for Democracy, Confict and Humanitarian Assistance. Ofc. of Conflict Management and Mitigation","English","application/pdf","","","Lund, Michael|Ulman, Jennifer","Conflict resolution","Nov 2008","","","","USAID/Philippines Mindanao programs evaluation : impact on conflict and peace since 2000","","PD-ACM-822","https://dec.usaid.gov/dec/content/Detail.aspx?ctID=ODVhZjk4NWQtM2YyMi00YjRmLTkxNjktZTcxMjM2NDBmY2Uy&rID=MzA1NTQx","Philippines",""
"","Evaluated project title: Electoral and political processes|strengthening program (EPPSP)|Project title: Democracy and governance analytical service|indefinite quantity contract (IQC)","Final Evaluation Report","Documents","DFD-I-00-04-00229-00","","11/1/2008 12:00:00 AM","","Elections|Political systems in transition|Political parties|Post conflict societies|Electoral systems|Political participation|Rule of law","Liberia","http://pdf.usaid.gov/pdf_docs/PDACM833.pdf","752 KB","012295 - Democracy International, Inc.","","010864 - USAID. Bur. for Democracy, Conflict and Humanitarian Assistance. Ofc. of Democracy and Governance","English","application/pdf","Final evaluation","","Nelson, Sue|Lyons, Terrence|et al.","Elections","Nov 2008","","","","Liberia elections and political processes program evaluation : final report","","PD-ACM-833","https://dec.usaid.gov/dec/content/Detail.aspx?ctID=ODVhZjk4NWQtM2YyMi00YjRmLTkxNjktZTcxMjM2NDBmY2Uy&rID=MzA1NTUy","Liberia",""
"","'USAID/Sudan SUPPORT Project'|Evaluated project title: Southern Sudan interactive radio instruction (SSIRI)|Project title: Services under program and project offices for results tracking (SUPPORT)|Related earlier evaluation: PD-ACT-948","Special Evaluation","Documents","DFD-I-00-05-00251-00","","12/1/2008 12:00:00 AM","","Interactive radio instruction|Educational development|Educational radio|Access to education|Access to services|Educational media","Sudan","http://pdf.usaid.gov/pdf_docs/PDACM859.pdf","1,622 KB","003970 - Management Systems International, Inc. (MSI)","","011008 - USAID. Bur. for Democracy, Confict and Humanitarian Assistance. Ofc. of Conflict Management and Mitigation","English","application/pdf","Southern Sudan|Interim evaluation","","Leigh, Stuart","Access to education","Nov-Dec 2008","","","","Management review of implementation of Southern Sudan interactive radio instruction (SSIRI) program : mid-term evaluation, recommendation & IG education audit findings","","PD-ACM-859","https://dec.usaid.gov/dec/content/Detail.aspx?ctID=ODVhZjk4NWQtM2YyMi00YjRmLTkxNjktZTcxMjM2NDBmY2Uy&rID=MzA1NzM3","Sudan",""
"","Order no. GHS-I-04-03-00005-00|Project title: Global health technical assistance (GH tech)|Evaluated project title: BRIDGE behavior change initiative HIV/AIDS|(Malawi BRIDGE project)","Final Evaluation Report","Documents","GHS-I-00-05-00005-00","","9/1/2008 12:00:00 AM","","HIV/AIDS|Behavior change|Health education|Disease prevention and control|Human sexual behavior|Development project implementation|Development project management|Development project evaluation|Health behavior","Malawi","http://pdf.usaid.gov/pdf_docs/PDACM872.pdf","659 KB","","","011976 - QED Group, LLC|010822 - USAID. Bur. for Global Health","English","application/pdf","Health behavior","","Capps, Jean|Wilcox, Sandra","HIV / AIDS","Sep 2008","","08-001-120","","BRIDGE project : final evaluation","","PD-ACM-872","https://dec.usaid.gov/dec/content/Detail.aspx?ctID=ODVhZjk4NWQtM2YyMi00YjRmLTkxNjktZTcxMjM2NDBmY2Uy&rID=MzA1ODE1","Malawi","936307807|9363098Aa"
"","Cover title|Contents: Mid-term evaluation of the USAID/Pakistan PAIMAN project|-- Mid-term evaluation of the USAID/Pakistan improved child health|project in FATA [Federally Administered Tribal Areas]|Evaluated project titles: Pakistan initiative for mothers and|newborns (PAIMAN) -- Improved child health project (ICHP)|Project title: Global health technical assistance (GH tech)|Annexes: PD-ACM-874","Special Evaluation","Documents","GHS-I-00-05-00005-00","","9/1/2008 12:00:00 AM","","Maternal child health care|Maternal health care|Child health care|Development program evaluation|Health facilities|Health education|Tribal groups|Human behavior|Care of the newborn","Pakistan","http://pdf.usaid.gov/pdf_docs/PDACM873.pdf","577 KB","011976 - QED Group, LLC","","010822 - USAID. Bur. for Global Health","English","application/pdf","Interim evaluation","","Senlet, Pinar|Ross, Susan Rae|Peters, Jennifer","Maternal child health care","Sep 2008","","08-001-087","","Mid-term evaluation of the USAID/Pakistan maternal, newborn and child health program","","PD-ACM-873","https://dec.usaid.gov/dec/content/Detail.aspx?ctID=ODVhZjk4NWQtM2YyMi00YjRmLTkxNjktZTcxMjM2NDBmY2Uy&rID=MzA1ODE3","Pakistan","9363098Aa"
"","Contents: PAIMAN report annexes -- FATA report annexes|Evaluated project titles: Pakistan initiative for mothers and|newborns (PAIMAN) -- Improved child health project (ICHP)|Project title: Global health technical assistance (GH tech)|Main document: PD-ACM-873","Special Evaluation","Documents","GHS-I-00-05-00005-00","","9/1/2008 12:00:00 AM","","Maternal child health care|Maternal health care|Development program evaluation|Child health care|Health facilities|Health education|Tribal groups|Human behavior|Care of the newborn","Pakistan","http://pdf.usaid.gov/pdf_docs/PDACM874.pdf","1,787 KB","011976 - QED Group, LLC","","010822 - USAID. Bur. for Global Health","English","application/pdf","Interim evaluation","","Senlet, Pinar|Ross, Susan Rae|Peters, Jennifer","Maternal child health care","Sep 2008","","08-001-087","","Annexes : mid-term evaluation of the USAID/Pakistan maternal, newborn and child health program","","PD-ACM-874","https://dec.usaid.gov/dec/content/Detail.aspx?ctID=ODVhZjk4NWQtM2YyMi00YjRmLTkxNjktZTcxMjM2NDBmY2Uy&rID=MzA1ODE4","Pakistan","9363098Aa"
"","Evaluated project title: Private sector partnerships one (PSP-one)|Project title: Global health technical assistance (GH tech)","Special Evaluation","Documents","GHS-I-00-05-00005-00","","6/1/2008 12:00:00 AM","","Primary health care|Reproductive health|Family planning|Private sector|Contraceptive agents and devices|Health delivery|Behavior change|HIV/AIDS","","http://pdf.usaid.gov/pdf_docs/PDACM938.pdf","918 KB","011976 - QED Group, LLC","","010822 - USAID. Bur. for Global Health","English","application/pdf","Interim evaluation","","Ravenholt, Betty|Jansen, William","Primary health care","Jun 2008","","08-001-082","","Mid-term assessment of the PSP-One project","","PD-ACM-938","https://dec.usaid.gov/dec/content/Detail.aspx?ctID=ODVhZjk4NWQtM2YyMi00YjRmLTkxNjktZTcxMjM2NDBmY2Uy&rID=MzA1OTYw","","9363098Aa|9363085Aa"
"","Evaluated project title: Enhanced HIV/AIDS prevention and improved|family health program (EHAP-IFH) Malawi|Project title: Global health technical assistance (GH tech)","Special Evaluation","Documents","GHS-I-00-05-00005-00","","12/1/2008 12:00:00 AM","","HIV/AIDS|Disease prevention and control|Family health care|Behavior change|Social marketing|Health facilities|Community based delivery","Malawi","http://pdf.usaid.gov/pdf_docs/PDACQ443.pdf","1,110 KB","011976 - QED Group, LLC","","010822 - USAID. Bur. for Global Health","English","application/pdf","","","Maynard-Tucker, Gisele|Gruber, Janet|Pollard, Richard","HIV / AIDS","Dec 2008","","08-001-122","","The enhanced HIV/AIDS prevention and improved family health program (EHAP-IFH), Malawi","","PD-ACQ-443","https://dec.usaid.gov/dec/content/Detail.aspx?ctID=ODVhZjk4NWQtM2YyMi00YjRmLTkxNjktZTcxMjM2NDBmY2Uy&rID=MzA1OTYx","Malawi","9363098Aa"
"","Project title: Global health technical assistance (GH tech)|Evaluated project title: Health services program in Indonesia","Special Evaluation","Documents","GHS-I-00-05-00005-00|GHS-I-01-05-00005-00","","12/1/2008 12:00:00 AM","","Health service utilization|Maternal health care|Prenatal care|Mortality|Civil society|Child survival activities|Nurse midwives|Behavior change|Private sector","Indonesia","http://pdf.usaid.gov/pdf_docs/PDACM989.pdf","16,325 KB","011976 - QED Group, LLC|011830 - CAMRIS International|011880 - Social and Scientific Systems, Inc. (SSS)","","010822 - USAID. Bur. for Global Health","English","application/pdf","","","Caro, Deborah A.|Bimo|et al.","Maternal child health care","Dec 2008","","08-001-118","","Evaluation of the health services program (HSP) in Indonesia : taking stock and looking forward","","PD-ACM-989","https://dec.usaid.gov/dec/content/Detail.aspx?ctID=ODVhZjk4NWQtM2YyMi00YjRmLTkxNjktZTcxMjM2NDBmY2Uy&rID=MzA2MDQ4","Indonesia","9363098Aa"
"","Project title: Global health technical assistance (GH tech)","Final Evaluation Report","Documents","GHS-I-00-05-00005-00|GHS-I-01-05-00005-00","","9/1/2008 12:00:00 AM","","","Ethiopia","http://pdf.usaid.gov/pdf_docs/PDACM990.pdf","2,120 KB","011976 - QED Group, LLC|011830 - CAMRIS International|011880 - Social and Scientific Systems, Inc. (SSS)","","010822 - USAID. Bur. for Global Health|008543 - USAID. Mission to Ethiopia","English","application/pdf","","","Hunt, Jenny|McSmith Deborah|et al.","Health delivery","Sep 2008","","08-001-101","","Final evaluation : USAID/Ethiopia high-risk corridors initiative","","PD-ACM-990","https://dec.usaid.gov/dec/content/Detail.aspx?ctID=ODVhZjk4NWQtM2YyMi00YjRmLTkxNjktZTcxMjM2NDBmY2Uy&rID=MzA2MDU0","Ethiopia","9363098Aa"
"","'Prepared .... under MOBIS contract #GS-10F-0048L, purchase order #|611-O-00-08-00003'|Evaluated project titles: Community health and nutrition, gender|and education support program 2  (CHANGES2) -- Educational quality|improve program  (EQUIP2) -- Quality education services through|technology (QUESTT)","Special Evaluation","Documents","611-O-00-08-00003-00","","5/1/2008 12:00:00 AM","","Primary schools|Basic education|Educational policy|Community development|Partnerships|Educational grants|Quality control|Local level|Development program evaluation","Zambia","http://pdf.usaid.gov/pdf_docs/PDACN014.pdf","1,345 KB","009054 - DevTech Systems, Inc.","","008627 - USAID. Mission to Zambia","English","application/pdf","Nongovernmental organizations (NGO)","","Chakufyali, Peggy|Chinombwe, Jane|Oki, Judith","Education (General)","May 2008","","","","USAID/Zambia assistance to strengthen Ministry of Education support to community schools","","PD-ACN-014","https://dec.usaid.gov/dec/content/Detail.aspx?ctID=ODVhZjk4NWQtM2YyMi00YjRmLTkxNjktZTcxMjM2NDBmY2Uy&rID=MzA2MTIx","Zambia",""
"","","Special Evaluation","Documents","","","9/1/2008 12:00:00 AM","","Economic growth|Donor coordination|Economic policy|Agricultural development|Investment environment|International organizations|Development program evaluation","Zambia","http://pdf.usaid.gov/pdf_docs/PDACN017.pdf","390 KB","008627 - USAID. Mission to Zambia","","","English","application/pdf","","","Brown, Meg|Stryker, Ron|Mvula, Charles","Economic growth and development","Sep 2008","","","","Assessment of USAID/Zambia's economic growth portfolio : final report","","PD-ACN-017","https://dec.usaid.gov/dec/content/Detail.aspx?ctID=ODVhZjk4NWQtM2YyMi00YjRmLTkxNjktZTcxMjM2NDBmY2Uy&rID=MzA2MTcw","Zambia",""
"","Additional SO: 936-002|Project title: Global health fellows program (GHFP)","Special Evaluation","Documents","GPO-A-00-06-00005-00","","10/1/2008 12:00:00 AM","","Health professional education|Recruitment|Public awareness|Professional development|Public health care|Health outreach services","Indonesia|East Africa","http://pdf.usaid.gov/pdf_docs/PDACN079.pdf","533 KB","011320 - Public Health Institute (PHI)","","010822 - USAID. Bur. for Global Health","English","application/pdf","Interim evaluation","","","Health professional education","17 Oct 2008","","","","Global health fellows program (GHFP) : results review, July 1, 2007 to June 30, 2008","","PD-ACN-079","https://dec.usaid.gov/dec/content/Detail.aspx?ctID=ODVhZjk4NWQtM2YyMi00YjRmLTkxNjktZTcxMjM2NDBmY2Uy&rID=MzA2MzU2","Ctr for Population, Health & Nutrition",""
"","Additional SO: 936-002|Project title: Global health fellows program (GHFP)","Special Evaluation","Documents","GPO-A-00-06-00005-00","","7/1/2008 12:00:00 AM","","Health professional education|Recruitment|Public awareness|Professional development|Public health care|Health outreach services","","http://pdf.usaid.gov/pdf_docs/PDACN080.pdf","388 KB","011320 - Public Health Institute (PHI)","","010822 - USAID. Bur. for Global Health","English","application/pdf","Interim evaluation","","","Health professional education","22 Jul 2008","","","","Global health fellows program (GHFP) : management review, July 3, 2006-June 30, 2008","","PD-ACN-080","https://dec.usaid.gov/dec/content/Detail.aspx?ctID=ODVhZjk4NWQtM2YyMi00YjRmLTkxNjktZTcxMjM2NDBmY2Uy&rID=MzA2MzU3","Ctr for Population, Health & Nutrition",""
"This report is an external evaluation of the Poverty Reduction Alleviation (PRA) Activity that was established under USAID/Peru Strategic Objective Number II, Increased Incomes of the Poor, as an outgrowth of the 1994 USAID/Peru Food Security Strategy.  The Strategic Objective determined that food insecurity is principally a question of poverty, that poverty is concentrated in corridors where people have limited access to markets, and that low-labor productivity reflects inadequate investment in human and material capital as well as poorly developed public policies and institutions. Consequently, USAID/Peru adopted an approach to link poverty-stricken rural areas (economic corridors) to markets in cities in Peru and abroad.  PRA began in September 1998 with an agreement between USAID and the Confederacin Nacional de Instituciones Empresariales (CONFIEP), an institution representing private sector companies.  CONFIEP was to apply a private business focus to optimize resource use in the economic corridors to reduce poverty through employment generation.  The design expected that private businesses would implement creative market mechanisms to purchase inputs from the economic corridors.  They would be supported by project established Economic Service Centers that were located in the economic corridors.  It was expected that the business associates of CONFIEP would become the buyers. Implementation of PRA by CONFIEP did not meet expectations.  In April 2002 USAID asked Chemonics to become the full implementing institution. Chemonics was already providing technical advice, international consultants and monitoring and evaluation services to this project. This evaluation provides quantitative and qualitative analysis of the direct and indirect impact, cost effectiveness, and strengths and weaknesses of PRA-supported activities and operations.  Five key areas were evaluated: (1) Direct and indirect impacts; (2) the role of Economic Service Centers (ESC); (3) the relationship between PRA and Alternative Development (AD, implemented by a project known as PDA); (4) the level of assistance to agriculture versus manufacturing and services sectors; and (5) operational issues.  (Author abstract)","Submitted to: USAID/Peru|'Raise Plus IQC .... task order no. 360'|Period of performance: February-May 2008|Evaluated project title: Poverty reduction and alleviation (PRA)|Project title: Rural and agricultural incomes with a sustainable|environment plus (RAISE plus)","Final Evaluation Report","Documents","AEG-I-00-04-00010-00","","5/1/2008 12:00:00 AM","","Economic growth|Economic development|Food security|Institution building|Business enterprises|Partnerships|Administrative regions|Economic infrastructure|Poverty reduction|Public-private partnerships","Peru","http://pdf.usaid.gov/pdf_docs/PDACN110.pdf","1,151 KB","007239 - Weidemann Associates, Inc.","","011325 - USAID. Bur. for Economic Growth, Agriculture and trade. Ofc of Agriculture","English","application/pdf","Poverty reduction|Public-private partnerships","","","Poverty reduction","May 2008","","","","Final evaluation of USAID/Peru poverty reduction and alleviation (PRA) activity : final report","","PD-ACN-110","https://dec.usaid.gov/dec/content/Detail.aspx?ctID=ODVhZjk4NWQtM2YyMi00YjRmLTkxNjktZTcxMjM2NDBmY2Uy&rID=MzA2NDE3","Peru",""
"","'This publication was produced for .... Leahy War Victims Fund,|DCHA/DG, under contact #DFD-M-00-04-238-00 with Manila Consulting|Group, Inc.'|Response to report by Polus Center for Social & Economic|Development, Inc., has been appended","Special Evaluation","Documents","","","8/1/2008 12:00:00 AM","","Medical equipment|Physical handicaps|Rehabilitative medicine|War victims","Nicaragua|Honduras","http://pdf.usaid.gov/pdf_docs/PDACO339.pdf","254 KB","000035 - U.S. Agency for International Development (USAID)","","","English","application/pdf","Wheelchairs|Medical technology","","Noon, Jamie|Savino, Cathy","Medical equipment","Aug 2008","","","","Polus Central American wheelchair project : Nicaragua and Honduras","","PD-ACO-339","https://dec.usaid.gov/dec/content/Detail.aspx?ctID=ODVhZjk4NWQtM2YyMi00YjRmLTkxNjktZTcxMjM2NDBmY2Uy&rID=MzA2ODg2","",""
"","Evaluated project title: Uganda Initiative for TDMS and PIASCY|(UNITY)|Project title: Uganda monitoring and evaluation management services (UMEMS)","Special Evaluation","Documents","617-C-00-08-00012-00","","12/1/2008 12:00:00 AM","","Primary education|USAID|Teacher training|Literacy|Literacy instruction|Community participation|Educational policy|HIV/AIDS","Uganda","http://pdf.usaid.gov/pdf_docs/PDACO346.pdf","330 KB","008360 - Mitchell Group, Inc.","","008618 - USAID. Mission to Uganda","English","application/pdf","Interim evaluation","","","Education (General)","Dec 2008","","","","The mid-term evaluation of USAID/Uganda's UNITY program report : final report","","PD-ACO-346","https://dec.usaid.gov/dec/content/Detail.aspx?ctID=ODVhZjk4NWQtM2YyMi00YjRmLTkxNjktZTcxMjM2NDBmY2Uy&rID=MzA2OTUy","Uganda",""
"","Project title: Global health technical assistance (GH tech)","Special Evaluation","Documents","GHS-I-00-05-00005-00","","12/1/2008 12:00:00 AM","","HIV/AIDS|Orphans|Partnerships|Disease prevention and control|Access to services|Orphans and vulnerable children (OVC)","Zambia|East Africa|Southern Africa","http://pdf.usaid.gov/pdf_docs/PDACO348.pdf","877 KB","011976 - QED Group, LLC","","010822 - USAID. Bur. for Global Health","English","application/pdf","Interim evaluation","","Yates, DeeDee|O'Connell, Christopher|et al.","HIV / AIDS","Dec 2008","","09-001-129","","President's emergency plan for AIDS relief track 1.0 orphans and other vulnerable children (OVC) program evaluation","","PD-ACO-348","https://dec.usaid.gov/dec/content/Detail.aspx?ctID=ODVhZjk4NWQtM2YyMi00YjRmLTkxNjktZTcxMjM2NDBmY2Uy&rID=MzA2OTU2","","9363098Aa"
"","'Interactive radio usage and its impact on Grades 1 and 2 teachers|and students'","Special Evaluation","Documents","","","11/1/2008 12:00:00 AM","","Interactive radio instruction|Educational delivery|Educational development|Primary education|Teacher training|Participatory learning","Madagascar","http://pdf.usaid.gov/pdf_docs/PDACO202.pdf","740 KB","","","","English","application/pdf","Interim evaluation","","Evans, Norma Evans|Pier, Daniel","Educational delivery","Nov 2008","","","","Midterm study of the Appui Technique aux Educateurs et Communautes (ATEC) Program, Madagascar","","PD-ACO-202","https://dec.usaid.gov/dec/content/Detail.aspx?ctID=ODVhZjk4NWQtM2YyMi00YjRmLTkxNjktZTcxMjM2NDBmY2Uy&rID=MzA3MDA2","Madagascar",""
