Abstract,Ancillary_Data,Bibliographic_Type,ContentType,Contract_Grant_Number,Credit,Date_Resource_Created,Description,Descriptors_Topical,Descriptors_Geographic,File,File_Size,Inst_Author,Inst_Publisher,Inst_Sponsor,Language,Mime_Type,New_Thesaurus_Terms,Notes,Personal_Author,Primary_Subject,Publication_Date_Freeform,Related_Doc_Links,Report_Number,Series_Title,Title,Title_Translated,Unique_ID,URI,USAID_Geography,USAID_Project_Number
"","","Final Evaluation Report","Documents","","","1/1/2008 12:00:00 AM","","Economic growth|USAID|Strategic objectives|Performance measurement|Performance indicators|Partnerships|Foreign investment","Bulgaria","http://pdf.usaid.gov/pdf_docs/PDACO368.pdf","100 KB","008519 - USAID. Mission to Bulgaria","","","English","application/pdf","","","","Economic growth and development","[2008?]","","","","183-0130, economic growth and increased prosperity : strategic & special objective closeout report","","PD-ACO-368","https://dec.usaid.gov/dec/content/Detail.aspx?ctID=ODVhZjk4NWQtM2YyMi00YjRmLTkxNjktZTcxMjM2NDBmY2Uy&rID=MzA3MTA5","Bulgaria",""
"","","Final Evaluation Report","Documents","","","1/1/2008 12:00:00 AM","","Rule of law|USAID|Judicial reform|Strategic objectives|Performance indicators|Project sustainability|Partnerships","Bulgaria","http://pdf.usaid.gov/pdf_docs/PDACO369.pdf","53 KB","008519 - USAID. Mission to Bulgaria","","","English","application/pdf","","","","Rule of law","[2008?]","","","","183-0220, enhanced rule of law : strategic & special objective closeout report","","PD-ACO-369","https://dec.usaid.gov/dec/content/Detail.aspx?ctID=ODVhZjk4NWQtM2YyMi00YjRmLTkxNjktZTcxMjM2NDBmY2Uy&rID=MzA3MTEx","Bulgaria",""
"","","Final Evaluation Report","Documents","","","1/1/2008 12:00:00 AM","","Public administration|USAID|Strategic objectives|Performance indicators|Project sustainability|Accountability|Municipal level|Governance|Partnerships","Bulgaria","http://pdf.usaid.gov/pdf_docs/PDACO370.pdf","92 KB","008519 - USAID. Mission to Bulgaria","","","English","application/pdf","Transparency","","","Public administration","[2008?]","","","","183-0230, local governments are making responsive choices and acting on them effectively and accountably : strategic & special objective closeout report","","PD-ACO-370","https://dec.usaid.gov/dec/content/Detail.aspx?ctID=ODVhZjk4NWQtM2YyMi00YjRmLTkxNjktZTcxMjM2NDBmY2Uy&rID=MzA3MTEy","Bulgaria",""
"","","Final Evaluation Report","Documents","","","1/1/2008 12:00:00 AM","","Development program planning|USAID|Human capacity development|Strategic objectives|Partnerships|Performance indicators|Development strategies|Institution building|Water management|Humanitarian assistance","Bulgaria","http://pdf.usaid.gov/pdf_docs/PDACO371.pdf","78 KB","008519 - USAID. Mission to Bulgaria","","","English","application/pdf","","","","Development program planning and management","[2008?]","","","","183-0420, cross-cutting programs : strategic & special objective closeout report","","PD-ACO-371","https://dec.usaid.gov/dec/content/Detail.aspx?ctID=ODVhZjk4NWQtM2YyMi00YjRmLTkxNjktZTcxMjM2NDBmY2Uy&rID=MzA3MTEz","Bulgaria",""
"The purpose of the USAID CAFTA-DR Environmental Cooperation Program is to build the capacity of the six CAFTA-DR countries (Costa Rica, Dominican Republic, El Salvador, Guatemala, Honduras and Nicaragua) to comply with the environmental provisions of the ECA and to promote cooperation in environmental matters.  USAID is carrying out activities in four areas: institutional strengthening for implementation and enforcement of environmental laws, biodiversity conservation, market-based conservation, and private sector environmental performance. This report assesses the design and implementation of ongoing and planned activities managed by USAID to build the capacity of institutions in signatory countries of the CAFTA-DR to comply with environmental provisions of the agreement and strengthen environmental protection as it relates to trade.  The purpose of the assessment is to provide constructive guidance on implementing existing activities and provide information to inform the programming of FY 08 and FY 09 resources.  The assessment presents what CAFTA-DR countries need to build their institutional capacity in order to comply with environmental provisions; identifies opportunities to complement the work of other donors; and recommends ways to improve the program.  (Author abstract)","Task order no. 15|Project title: Rural and agricultural incomes with a sustainable|environment plus (RAISE plus)","Special Evaluation","Documents","AEG-I-00-04-00010-00","","9/1/2008 12:00:00 AM","","Environmental protection|Environmental policy|Environmental legislation|Law enforcement|Institutional aspects|Monitoring|Performance indicators|Trade agreements|Compliance","Central America|Dominican Republic","http://pdf.usaid.gov/pdf_docs/PDACO373.pdf","605 KB","004304 - Nathan Associates, Inc.|007239 - Weidemann Associates, Inc.","","011325 - USAID. Bur. for Economic Growth, Agriculture and trade. Ofc of Agriculture","English","application/pdf","Central America-Dominican Republic Free Trade Agreement (CAFTA-DR)|Interim evaluation","","","Environmental policy","Sep 2008","","","","Midterm assessment of the program to support environmental compliance under CAFTA-DR","","PD-ACO-373","https://dec.usaid.gov/dec/content/Detail.aspx?ctID=ODVhZjk4NWQtM2YyMi00YjRmLTkxNjktZTcxMjM2NDBmY2Uy&rID=MzA3MTE4","Latin American Regional",""
"","Program title: Livelihood expansion and asset development (LEAD)|Consortium for Rehabilitation and Development (CORAD)","Special Evaluation","Documents","FFP-A-00-04-00020-00","","11/1/2008 12:00:00 AM","","Disaster rehabilitation|Livelihood|Food security|Community mobilization","Sierra Leone","http://pdf.usaid.gov/pdf_docs/PDACO262.pdf","902 KB","","","","English","application/pdf","Interim evaluation","","Audette, Meg","Economic regions","17 Nov 2008","","","","Consortium for rehabilitation and development : LEAD mid-term review report","","PD-ACO-262","https://dec.usaid.gov/dec/content/Detail.aspx?ctID=ODVhZjk4NWQtM2YyMi00YjRmLTkxNjktZTcxMjM2NDBmY2Uy&rID=MzA3NzEy","Sierra Leone",""
"","Task order no. GHS-I-02-03-00040-00|Project title: Technical assistance and support contract (TASC2|global health)","Special Evaluation","Documents","GHS-I-00-03-00040-00","","11/1/2008 12:00:00 AM","","","Guyana","http://pdf.usaid.gov/pdf_docs/PNADP510.pdf","360 KB","","","","English","application/pdf","","","Furth, Rebecca","Medical equipment","Nov 2008","","","","Insulin needle use and disposal pilot evaluation report : Guyana safer injection project","","PN-ADP-510","https://dec.usaid.gov/dec/content/Detail.aspx?ctID=ODVhZjk4NWQtM2YyMi00YjRmLTkxNjktZTcxMjM2NDBmY2Uy&rID=MzA3Nzky","Guyana",""
"","Redacted|Evaluated project title: Community stabilization program (CSP)|Project title: Monitoring and evaluation performance program, phase|II (MEPP II)","Special Evaluation","Documents","267-C-00-05-00508-00","","3/1/2008 12:00:00 AM","","Business enterprises|USAID|Business support services|Sector analysis|Community participation|Performance measurement","Iraq","http://pdf.usaid.gov/pdf_docs/PDACN465.pdf","348 KB","001891 - International Business and Technical Consultants, Inc. (IBTCI)","","011765 - USAID. Mission to Iraq","English","application/pdf","Interim evaluation","","","Business enterprises","11 Mar 2008","","","","USAID community stabilization program (CSP) counterinsurgency (COIN) : report on business development projects in Baghdad","","PD-ACN-465","https://dec.usaid.gov/dec/content/Detail.aspx?ctID=ODVhZjk4NWQtM2YyMi00YjRmLTkxNjktZTcxMjM2NDBmY2Uy&rID=MzA3ODA2","Iraq",""
"","Redacted|Evaluated project title: Community stabilization program (CSP)|Project title: Monitoring and evaluation performance program, phase|II (MEPP II)","Special Evaluation","Documents","267-C-00-05-00508-00","","3/1/2008 12:00:00 AM","","Employment|Youth|Vocational training|Performance measurement|Business support services","Iraq","http://pdf.usaid.gov/pdf_docs/PDACN467.pdf","386 KB","001891 - International Business and Technical Consultants, Inc. (IBTCI)","","011765 - USAID. Mission to Iraq","English","application/pdf","Interim evaluation","","","Employment","22 Mar 2008","","","","USAID community stabilization (CSP) counterinsurgency (COIN) : report on employment generation and youth projects in Baghdad","","PD-ACN-467","https://dec.usaid.gov/dec/content/Detail.aspx?ctID=ODVhZjk4NWQtM2YyMi00YjRmLTkxNjktZTcxMjM2NDBmY2Uy&rID=MzA3ODA5","Iraq",""
"","Evaluated project title: Community stabilization program (CSP)|Project title: Monitoring and evaluation performance program, phase|II (MEPP II)","Special Evaluation","Documents","267-C-00-05-00508-00","","4/1/2008 12:00:00 AM","","Development planning|Youth|Business enterprises|Performance indicators|Community participation|Conflict resolution|Vocational training|Business support services|Monitoring","Iraq","http://pdf.usaid.gov/pdf_docs/PDACN469.pdf","137 KB","001891 - International Business and Technical Consultants, Inc. (IBTCI)","","011765 - USAID. Mission to Iraq","English","application/pdf","Interim evaluation","","Herr, Harvey|Mason, Rich","Development activity planning and management","5 Apr 2008","","","","USAID community stabilization program (CSP) counterinsurgency (COIN) : rapid programmatic assessment","","PD-ACN-469","https://dec.usaid.gov/dec/content/Detail.aspx?ctID=ODVhZjk4NWQtM2YyMi00YjRmLTkxNjktZTcxMjM2NDBmY2Uy&rID=MzA3ODEz","Iraq",""
"","Redacted|Evaluated project title: Community stabilization program (CSP)|Project title: Monitoring and evaluation performance program, phase|II (MEPP II)","Special Evaluation","Documents","267-C-00-05-00508-00","","3/1/2008 12:00:00 AM","","Employment|Youth|Vocational training|Community participation|Monitoring|Business support services","Iraq","http://pdf.usaid.gov/pdf_docs/PDACN474.pdf","258 KB","001891 - International Business and Technical Consultants, Inc. (IBTCI)","","011765 - USAID. Mission to Iraq","English","application/pdf","Interim evaluation","","","Employment","22 Mar 2008","","","","USAID community stabilization program (CSP) counterinsurgency (COIN) : report on employment generation and youth projects in Kirkuk","","PD-ACN-474","https://dec.usaid.gov/dec/content/Detail.aspx?ctID=ODVhZjk4NWQtM2YyMi00YjRmLTkxNjktZTcxMjM2NDBmY2Uy&rID=MzA3ODIx","Iraq",""
"","Redacted|Evaluated project title: Community stabilization program (CSP)|Project title: Monitoring and evaluation performance program, phase|II (MEPP II)","Special Evaluation","Documents","267-C-00-05-00508-00","","3/1/2008 12:00:00 AM","","Employment|Youth|Vocational training|Community participation|Monitoring|Business support services","Iraq","http://pdf.usaid.gov/pdf_docs/PDACN476.pdf","243 KB","001891 - International Business and Technical Consultants, Inc. (IBTCI)","","011765 - USAID. Mission to Iraq","English","application/pdf","Interim evaluation","","Mason, Rich","Employment","22 Mar 2008","","","","USAID community stabilization program (CSP) counterinsurgency (COIN) : report on employment generation and youth projects in Ninewa","","PD-ACN-476","https://dec.usaid.gov/dec/content/Detail.aspx?ctID=ODVhZjk4NWQtM2YyMi00YjRmLTkxNjktZTcxMjM2NDBmY2Uy&rID=MzA3ODI1","Iraq",""
"","Redacted|Evaluated project title: Community stabilization program (CSP)|Project title: Monitoring and evaluation performance program, phase|II (MEPP II)","Special Evaluation","Documents","267-C-00-05-00508-00","","5/1/2008 12:00:00 AM","","Community participation|Monitoring|Business support services|Development project planning","Iraq","http://pdf.usaid.gov/pdf_docs/PDACN477.pdf","358 KB","001891 - International Business and Technical Consultants, Inc. (IBTCI)","","011765 - USAID. Mission to Iraq","English","application/pdf","Interim evaluation","","","Communities","8 May 2008","","","","USAID community stabilization program (CSP) counterinsurgency (COIN) : report on community infrastructure and essential services projects in Falluja and Ramadi","","PD-ACN-477","https://dec.usaid.gov/dec/content/Detail.aspx?ctID=ODVhZjk4NWQtM2YyMi00YjRmLTkxNjktZTcxMjM2NDBmY2Uy&rID=MzA3ODI2","Iraq",""
"","Consortium for rehabilitation and development (CORAD)","Special Evaluation","Documents","636-A-00-04-00231-00","","9/1/2008 12:00:00 AM","","Economic development|Agricultural product marketing|Business enterprises|Women|Youth|Access to services|Literacy instruction|Agricultural inputs|Financial institutions|Information systems|Human capacity development|Microfinance","Sierra Leone","http://pdf.usaid.gov/pdf_docs/PDACN548.pdf","307 KB","010632 - World Vision|007518 - CARE International","","008602 - USAID. Mission to Sierra Leone","English","application/pdf","Interim evaluation|Livelihood","","Spencer, Dunstan|Deen, Sanusi|et al.","Economic growth and development","12 Sep 2008","","","","Promoting linkages for livelihood security and economic development (LINKS) : final evaluation","","PD-ACN-548","https://dec.usaid.gov/dec/content/Detail.aspx?ctID=ODVhZjk4NWQtM2YyMi00YjRmLTkxNjktZTcxMjM2NDBmY2Uy&rID=MzA5MzYz","Sierra Leone",""
"","Task order no. 1|Health policy initiative|Project title: Analysis & advocacy (A2)","Special Evaluation","Documents","GPO-I-01-05-000040-00|GPO-I-00-05-00040-00","","4/1/2008 12:00:00 AM","","HIV/AIDS|Factor analysis|Advocacy|Disease prevention and control|Sexually transmitted diseases","Bangldesh|China|Thailand|Vietnam","http://pdf.usaid.gov/pdf_docs/PDACN670.pdf","181 KB","011975 - Futures Group|009154 - Family Health International (FHI)","","011262 - USAID. Bur. for Global Health. Ofc. of Population and Reproductive Health","English","application/pdf","Interim evaluation","","Ward, Chris|Ross, John|et al.","HIV / AIDS","Apr 2008","","","","An evaluation : implementing the A-squared project in Bangladesh, China, Thailand, and Vietnam","","PD-ACN-670","https://dec.usaid.gov/dec/content/Detail.aspx?ctID=ODVhZjk4NWQtM2YyMi00YjRmLTkxNjktZTcxMjM2NDBmY2Uy&rID=MzA5NTc5","Asia Regional","9363109Da"
"","'Submitted .... to USAID's Office of US Foreign Disaster|Assistance, Southern Africa Regional Office (USAID/OFDA/SARO) in|fulfillment of contract 674-O-00-07127-00'|Correct USAID purchase order no. unknown","Special Evaluation","Documents","","","3/1/2008 12:00:00 AM","","Irrigated farming|Agricultural water management|Disaster relief|Community based delivery|Natural resource management|Drip irrigation","Zambia|Zimbabwe","http://pdf.usaid.gov/pdf_docs/PDACN691.pdf","674 KB","012235 - Food, Agriculture and Natural Resources Policy Network (FANRPAN)","","008605 - USAID. Mission to South Africa","English","application/pdf","Interim evaluation","","Merrey, Douglas J.|Sullivan, Amy|et al.","Irrigated farming and water management","Mar 2008","","","FANRPAN report, 2008/001","Evaluation of USAID/OFDA small scale irrigation programs in Zimbabwe and Zambia 2003-2006 : lessons for future programs","","PD-ACN-691","https://dec.usaid.gov/dec/content/Detail.aspx?ctID=ODVhZjk4NWQtM2YyMi00YjRmLTkxNjktZTcxMjM2NDBmY2Uy&rID=MzA5NjM1","",""
"","Task order no. 802|Project title: Project NOVA (Innovations in support of reproductive|health)|Header title: Project evaluation in Shirak, Tavush, Gegharkunik and|Kotayk Marzes","Special Evaluation","Documents","GHS-I-802-03-00031-00|GHS-I-00-03-00031-00","","9/1/2008 12:00:00 AM","","Primary health care|Reproductive health|Maternal child health care|Women|Community health workers|Access to services|Maternal mortality","Armenia","http://pdf.usaid.gov/pdf_docs/PDACN786.pdf","1,006 KB","012164 - Emerging Markets Group, Ltd. (EMG)","","011222 - USAID. Bur. for Global Health. Ofc. of Health, Infectious Diseases, and Nutrition","English","application/pdf","Interim evaluation","","Mkrtchyan, Zaruhi","Primary health care","Sep 2008","","","","Evaluation of key project NOVA activities in northern Armenia : internal evaluation report","","PD-ACN-786","https://dec.usaid.gov/dec/content/Detail.aspx?ctID=ODVhZjk4NWQtM2YyMi00YjRmLTkxNjktZTcxMjM2NDBmY2Uy&rID=MzA5ODA1","Armenia",""
"","Translated titles provided by Google|Proyecto munipos y comunidades saluables en zonas del programa de|desarrollo alternativo","Special Evaluation","Documents","","","10/1/2008 12:00:00 AM","","Health finance|Cost benefit analysis|Family health care|Community participation|Community development","Peru","http://pdf.usaid.gov/pdf_docs/PDACN787.pdf","247 KB","003970 - Management Systems International, Inc. (MSI)","","008591 - USAID. Mission to Peru","Spanish","application/pdf","Alternative development","","Sanabria, Cesar|Gutierrez, Wilfredo","Health finance","Oct 2008","","","","Evaluacion costs beneficio de la estrategia municipios, comunidades, instituciones educativas y familias saludables en zonea del PDA","Cost-benefit evaluation of the strategy municipalities, communities, educational institutions and healthy families in areas of PDA","PD-ACN-787","https://dec.usaid.gov/dec/content/Detail.aspx?ctID=ODVhZjk4NWQtM2YyMi00YjRmLTkxNjktZTcxMjM2NDBmY2Uy&rID=MzA5ODE5","Peru",""
"","Global evaluation and monitoring (GEM II) IQC|Project title: Jamaica education evaluation","Special Evaluation","Documents","EDH-E-00-08-00003-00|AID-EDH-E-00-08-00003","","10/1/2008 12:00:00 AM","","Educational delivery|Educational reform|Partnerships|Primary education|Strategic planning|Teacher training|Public-private partnerships","Jamaica","http://pdf.usaid.gov/pdf_docs/PDACN844.pdf","537 KB","013070 - JBS International, Inc. Aguirre Div.","","008563 - USAID. Mission to Jamaica|011326 - USAID. Bur. for Economic Growth, Agriculture and Trade. Ofc. of Education","English","application/pdf","Interim evaluation","","Dye, Richard|Helwig, John|et al.","Basic education","Oct 2008","","","","Evaluation of the expanding education horizons project : recommendations for a new education activity to be included in USAID/Jamaica's strategy for 2010-2014","","PD-ACN-844","https://dec.usaid.gov/dec/content/Detail.aspx?ctID=ODVhZjk4NWQtM2YyMi00YjRmLTkxNjktZTcxMjM2NDBmY2Uy&rID=MzEwMDQ1","Jamaica",""
"","Project title: Basic support for institutionalizing child survival|(BASICS)","Special Evaluation","Documents","GHA-I-00-04-00002-00","","10/1/2008 12:00:00 AM","","Community based delivery|Child nutrition|Nutritional status|Household surveys|Child survival activities|Community participation","Honduras","http://pdf.usaid.gov/pdf_docs/PDACN923.pdf","615 KB","008155 - Partnership for Child Health Care, Inc.","","010822 - USAID. Bur. for Global Health","English","application/pdf","Interim evaluation","","Schaetzel, Tom|Griffiths, Marcia|et al.","Community health care delivery","Oct 2008","","","","Evaluation of the AIN-C [Atencion integral a la ninez = Integrated care of the child in the community] program in Honduras","","PD-ACN-923","https://dec.usaid.gov/dec/content/Detail.aspx?ctID=ODVhZjk4NWQtM2YyMi00YjRmLTkxNjktZTcxMjM2NDBmY2Uy&rID=MzEwMzUz","Honduras",""
"The USAID Anosy Alliance played a coordination role for USAID financed programs in order to ensure their synergy and alignment and contribution to the implementation of the Anosy Regional Madagascar Action Plan.  The Alliance worked closely with the Anosy Region and three of its Technical Government Services (Regional Direction for Rural Development, Regional Direction for Health, Family Planning and Social Protection, and the Regional Direction for Environment, Water and Forests and Tourism) in order to reach the objectives for Commitments 4, 5, and 7 of the MAP.  The USAID Alliance used annual planning, regular meetings and results monitoring by Commitment to facilitate the coordination, implementation, and dissemination of results among USAID programs and the Government.  After serving as an example of regional coordination for several years the USAID Alliance will now need to adapt its role as the Anosy Region takes on the regional coordination of development actions.  The USAID Anosy Alliance should adapt its role to one of coordination support to the Region as well as internal coordination of USAID implementing partners programs.  In order to truly achieve USAID's NHWP strategy in the Region and improve the efficiency of regional coordination, USAID should carry out preliminary spatial and programmatic planning at the regional level with all the USAID partners, other key regional actors and the Government to ensure the coordination of objectives, methodologies and intervention zones before the finalization of the contracts for the USAID programs.  (Author abstract)","","Special Evaluation","Documents","","","1/1/2008 12:00:00 AM","","Environmental management|USAID|Community health care|Rural development|Family planning|HIV/AIDS|Partnerships","Madagascar","http://pdf.usaid.gov/pdf_docs/PDACN947.pdf","28 KB","","","008572 - USAID. Mission to Madagascar","English","application/pdf","Interim evaluation","","Talbot, jennifer","Environmental management","[2008]","","","","USAID alliance Anosy","","PD-ACN-947","https://dec.usaid.gov/dec/content/Detail.aspx?ctID=ODVhZjk4NWQtM2YyMi00YjRmLTkxNjktZTcxMjM2NDBmY2Uy&rID=MzEwMzk2","Madagascar",""
"","'Interactive radio instruction (IRI)'|Project title: Southern Sudan interactive radio instruction (SSIRI)","Special Evaluation","Documents","","","5/1/2008 12:00:00 AM","","Primary education|Educational radio|Literacy instruction|Student performance|Literacy instruction|Language training|English language|Native languages|Impact assessment|Interactive radio instruction","Sudan","http://pdf.usaid.gov/pdf_docs/PDACP429.pdf","359 KB","000461 - Education Development Center, Inc. (EDC)","","008607 - USAID. Mission to Sudan","English","application/pdf","Interim evaluation|Numeracy instruction|Southern Sudan","","","Information management, systems and equipment","May 2008","","","","Southern Sudan interactive radio instruction (SSIRI) : grade 1 evaluation","","PD-ACP-429","https://dec.usaid.gov/dec/content/Detail.aspx?ctID=ODVhZjk4NWQtM2YyMi00YjRmLTkxNjktZTcxMjM2NDBmY2Uy&rID=MzExMzEw","Sudan",""
"","Cover title: External program evaluation : water, sanitation ond|hygiene (WASH) program in Ethiopia","Special Evaluation","Documents","663-A-00-04-00419-00","","12/1/2008 12:00:00 AM","","Water supply|Sanitation|Hygiene","Ethiopia","http://pdf.usaid.gov/pdf_docs/PDACP437.pdf","1,208 KB","008360 - Mitchell Group, Inc.","","008543 - USAID. Mission to Ethiopia","English","application/pdf","","","Aregai, Bruck|Dinku, Siseraw","Water supply and sanitation","Dec 2008","","","","External program evaluation of cooperative agreement no. 663-A-00-04-00419-00 : Millennium Water Alliane (MWA) water, sanitation and hygiene (WASH) program in Ethiopia","","PD-ACP-437","https://dec.usaid.gov/dec/content/Detail.aspx?ctID=ODVhZjk4NWQtM2YyMi00YjRmLTkxNjktZTcxMjM2NDBmY2Uy&rID=MzExMzY4","Ethiopia",""
"","","Final Evaluation Report","Documents","","","5/1/2008 12:00:00 AM","","Rule of law|Crime prevention|Violence|Alternative dispute resolution|Social justice|Law enforcement|Courts|Judicial reform|Legal systems|Criminal investigations","South Africa","http://pdf.usaid.gov/pdf_docs/PDACP685.pdf","12,860 KB","007383 - DPK Consulting","","008605 - USAID. Mission to South Africa","English","application/pdf","","","Page, Robert W.|Thompson, Jill|et al.","Rule of law","30 May 2008","","","","South Africa rapid assessment of the criminal justice strengthening program (CJSP)","","PD-ACP-685","https://dec.usaid.gov/dec/content/Detail.aspx?ctID=ODVhZjk4NWQtM2YyMi00YjRmLTkxNjktZTcxMjM2NDBmY2Uy&rID=MzEyMjM1","South Africa",""
"","MOBIS (management, organizational and business improvement service)|contract no. GS 10F-0112J|Order no.: 690-M-00-06-00023-00|Project title: Primary school support program : a school fees pilot|(PSSP-SFP)","Final Evaluation Report","Documents","690-M-00-06-00023-00|GS-10F-0112J","","12/1/2008 12:00:00 AM","","Basic education","Malawi","http://pdf.usaid.gov/pdf_docs/PDACP839.pdf","2,783 KB","000251 - American Institutes for Research (AIR)|012171 - Creative Center for Community Mobilization (CRECCOM)|007247 - Malawi Institute of Education|012964 -","","012599 - USAID. Mission to Southern Africa","English","application/pdf","","","Mvula, Peter|Munthali, Alister","Basic education","Dec 2008","","","","Mobilisation corps of Malawi end of project evaluation report","","PD-ACP-839","https://dec.usaid.gov/dec/content/Detail.aspx?ctID=ODVhZjk4NWQtM2YyMi00YjRmLTkxNjktZTcxMjM2NDBmY2Uy&rID=MzEyNjY5","Malawi",""
"","Translated title provided by Google","Special Evaluation","Documents","511-A-00-05-00250-00","","5/1/2008 12:00:00 AM","","Landscape conservation|Environmental protection|Landscapes","Bolivia","http://pdf.usaid.gov/pdf_docs/PDACR130.pdf","1,064 KB","012266 - Conservation International - Bolivia","","008515 - USAID. Mission to Bolivia","Spanish","application/pdf","","","Urdininea, Jose Baldivia|Mariaca, Jorge|Gisbert, Maria Elena","Environmental protection and conservation","May 2008","","","","Evaluacion de medio termino : proyecto de conservacion de paisajes (PCP) el el corredor Amboro-Madidi","Mid-term review : draft conservation of landscapes (PCP) in the Amboro-Madidi","PD-ACR-130","https://dec.usaid.gov/dec/content/Detail.aspx?ctID=ODVhZjk4NWQtM2YyMi00YjRmLTkxNjktZTcxMjM2NDBmY2Uy&rID=MzE1Mzg2","Bolivia",""
