Abstract,Ancillary_Data,Bibliographic_Type,ContentType,Contract_Grant_Number,Credit,Date_Resource_Created,Description,Descriptors_Topical,Descriptors_Geographic,File,File_Size,Inst_Author,Inst_Publisher,Inst_Sponsor,Language,Mime_Type,New_Thesaurus_Terms,Notes,Personal_Author,Primary_Subject,Publication_Date_Freeform,Related_Doc_Links,Report_Number,Series_Title,Title,Title_Translated,Unique_ID,URI,USAID_Geography,USAID_Project_Number
"THE LATIN AMERICAN AGRIBUSINESS DEVELOPMENT CORPORATION (LAAD) AND LAAD DE CENTROAMERICA (LAAD-CA), ITS PRINCIPAL OPERATING SUBSIDIARY, ARE FUNCTIONING AND ARE ACHIEVING A NUMBER, IF NOT ALL, OF THE PURPOSES FOR WHICH THEY WERE DESIGNED. TO DATE, LADD LOANS AND INVESTMENTS HAVE BEEN DIRECTED PRIMARILY TO PROJECTS ALREADY CONCEIVED, LAUNCHED, AND DEVELOPED BY INVESTORS IN THE REGION. IT SELECTED THOSE PROJECTS WHICH BEST MET ITS CRITERIA,RATHER THAN ACTING AS THE PROMOTING FORCE FOR PROJECTS IN AREAS PRE-SELECTED BY LAAD. AS A RESULT, THERE IS A CONSIDERABLE UNEVENNESS AMONG THE PROJECTS IN TERMS OF THEIR IMPACT ON AGRIBUSINESS DEVELOPMENT AND THE DEVELOPMENT OF BROAD INVESTOR INTEREST. IT IS EARLY TO MEASURE THE IMPACT OF LAAD OPERATIONS IN THE REGION UPON SUCH THINGS AS EMPLOYMENT, EXPORT EARNINGS, AGRICULTURAL PRACTICES, AND SMALL FARMERS,BUT THE EVALUATORS DO DRAW SOME TENTATIVE CONCLUSIONS ON THESE MATTERS. LAAD'S EFFORT TO DEVELOP A CENTRAL AMERICAN CAPITAL MARKET HAVE BEEN SERIOUS AND SINCERE, BUT NOT YET OF MEASURABLE IMPORTANCE. TO SOME EXTENT, LAND OPERATIONS HAVE RESULTED IN A NUMBER OF COMMERCIAL BANK LOANS TO ASSISTED ENTERPRISES, AND THIS,PERHAPS,IS ITS MOST IMPORTANT STEP IN THE CAPITAL MARKET OF CENTRAL AMERICA. THE EVALUATORS MADE 20 RECOMMENDATIONS IN THE AREAS OF LOAN POLICY, OPERATIONAL POLICY, CAPITAL MARKET DEVELOPMENT, FINANCIAL POLICY, AND ADDITIONAL FINANCING.","","Special Evaluation","Documents","AID/CM/OTR-C-73-199","","7/1/1974 12:00:00 AM","","AGRIBUSINESS|INVESTMENT|Financial resources|Agricultural product marketing|EMPLOYMENT|Balance of trade","Latin America","http://pdf.usaid.gov/pdf_docs/PNAAB235.pdf","2,535 KB","000356 - Checchi and Co. Consulting, Inc.","","","English","application/pdf","","","CORBETT, JACK C.|IVEY, RONALD J.","Economics (General)","31 Jul 1974","","","","EVALUATION OF LATIN AMERICAN AGRIBUSINESS DEVELOPMENT CORPORATION","","PN-AAB-235","https://dec.usaid.gov/dec/content/Detail.aspx?ctID=ODVhZjk4NWQtM2YyMi00YjRmLTkxNjktZTcxMjM2NDBmY2Uy&rID=MTc0MDcy","Reg Office Cent America & Panama (ROCAP)","5960068"
"THE VIHIGA SPECIAL RURAL DEVELOPMENT PROJECT (SRDP) IS AN EXPERIMENT IN COORDINATED RURAL DEVELOPMENT CONSISTING OF 26 ORIGINAL AND ON-GOING DEVELOPMENT PROJECTS AND PROGRAMS. THE EVALUATORS WERE SPECIFICALLY REQUESTED TO ADDRESS: (1)PROGRESS TOWARD ATTAINMENT OF SUB-PROJECT GOALS AND OVERALL PROJECT PURPOSE; (2)IDENTIFICATION OF KEY PROGRAM CONSTRAINTS AND PROBLEMS, WITH RECOMMENDATIONS WITH RESPECT TO THEIR RESOLUTION; (3)THE DEGREE TO WHICH THE PROGRAM IS BEING CARRIED OUT WITHIN THE ORIGINAL PROJECT CONCEPTS; (4)THE IMPACT AND APPROPRIATENESS OF THE US TECHNICAL ASSISTANCE EFFORT, AND RECOMMENDATIONS TOWARD NEEDED CHANGES IN THIS AREA; AND (5)THE LEVEL AND NATURE OF CONTINUED US SUPPORT TO THIS PROJECT. THE EVALUATORS ANALYZED 19 SUB-PROJECTS: EXTENSION; GRADE CATTLE; ARTIFICIAL INSEMINATION; CATTLE DIPS; MAIZE CREDIT; FAO FERTILIZER DEMONSTRATION; FAO STOCKIST CREDIT; TEA CREDIT; VEGETABLES; COMMUNITY DEVELOPMENT; RURAL INDUSTRIES; VILLAGE POLYTECHNICS; LAND ADJUDICATION; ENVIRONMENTAL AND RURAL WATER SUPPLIES; POULTRY PRODUCTION; PIG PRODUCTION; COOPERATIVES; SOCIAL SERVICE TRAINING; ADULT LITERACY AND WOMEN'S GROUPS; AND LABOR-INTENSIVE ROADS. THEY ALSO DISCUSSED THE HISTORY OF THE PROJECT AND THE SRDP MANAGEMENT SYSTEM, AND THEY SUGGESTED EXPERIMENTAL PROJECTS WHICH MIGHT BE CARRIED OUT DURING THE REMAINING LIFE OF THE SRDP.","","Special Evaluation","Documents","","","11/1/1974 12:00:00 AM","","Rural development|Artificial insemination|Vegetables|Community development|Business enterprises|Vocational training|Public land records|WATER SUPPLY|Poultry|Animal husbandry|SWINE|Road construction|LITERACY|Agricultural extension|DAIRY CATTLE|Maize|Agricultural credit|Fertilizers|TEA|Agricultural cooperatives|Integrated rural development","Kenya","","","","","","English","","","","HARMON, EDWARD D., JR.|ZALLA, THOMAS M.","","27 Nov 1974","","","","USAID SPONSORED EVALUATION OF THE VIHIGA SPECIAL RURAL DEVELOPMENT PROJECT; KENYA","","PD-AAM-992","https://dec.usaid.gov/dec/content/Detail.aspx?ctID=ODVhZjk4NWQtM2YyMi00YjRmLTkxNjktZTcxMjM2NDBmY2Uy&rID=MTc0MDgx","Kenya","6150147"
"PROJECT EVALUATION HAS BEEN DIFFICULT BECAUSE OF THE RELATIVELY EARLY STAGE OF THE RURAL DEVELOPMENT PROGRAM AT PRESENT, AND BECAUSE OF APPARENT INCONSISTENCIES FROM THE BEGINNING ABOUT AID/W'S, THE GOVERNMENT OF SWAZILAND'S (GOS), AND OSARAC'S UNDERSTANDING OF THE PROJECT. FOLLOW-UP ON CURRENT PROJECT STAUS VIS-A-VIS THE LOGICAL FRAMEWORK PROVED TO BE MOST DIFFICULT; HOWEVER, MUCH PROGRESS IS BEING MADE AND SOME RELATIOSHIPS CAN BE PINPOINTED. THE USAID PROJECT IS DEFINITELY ACHIEVING ITS GOAL OF SUPPORTING THE GOS'S RURAL DEVELOPMENT PROGRAM. BASED ON THE EVIDENCE AVAILABLE, THE EVALUATORS BELIEVE THAT PRODUCTIVITY WILL BE INCREASED SUBSTANTIALLY IN THE FUTURE, BUT THERE IS LITTLE TO SEE NOW. THE EVALUATORS MADE SEVERAL RECOMMENDATIONS INCLUDING: (1)FROM THIS POINT FORWARD, USAID PROJECTS AND ACTIVITIES SHOULD GIVE VERY HIGH PRIORITY TO INSTITUTION BUILDING; (2)USAID SHOULD ENCOURAGE THE GOS TO REVIEW CAREFULLY (A)THE MECHANISM BY WHICH THE AGRI/RURAL SECTOR STRATEGY IS DEVELOPED, AND (B)THE VARIOUS MINISTRIES' CAPABILITY TO PLAN, ANALYZE AND PREPARE ECONOMICALLY SOUND PROJECTS; (3)ACCELERATING THE RURAL DEVELOPMENT PROGRAM SHOULD CONSTITUTE THE HARD CORE OF USAID ACTIVITIES IN SWAZILAND; AND (4)THE CURRENT PROJECT SHOULD BE REVISED AS SOON AS POSSIBLE WITH PREFERENCE GIVEN TO REPLACING IT WITH TWO PROJECTS.","","Special Evaluation","Documents","AID-AFR-C-1078","","8/1/1974 12:00:00 AM","","Rural development|Land development|IRRIGATION|Agricultural cooperatives|Participants|On the job training|LITERACY|Agricultural credit|Agricultural product marketing","Swaziland","","","","","","English","","","","FISCHER, JOHN L.|SIIRA, EINO|WALKER, JACK","","1 Aug 1974","","","","RURAL DEVELOPMENT IN SWAZILAND; AN EVALUATION REPORT","","PD-AAB-665-A1","https://dec.usaid.gov/dec/content/Detail.aspx?ctID=ODVhZjk4NWQtM2YyMi00YjRmLTkxNjktZTcxMjM2NDBmY2Uy&rID=MTc0MTA0","Southern Africa Regional","6900024"
"THERE IS NO DOUBT THAT, THROUGH THE EFFORTS OF FLETCHTER'S STAFF, THE LAW AND POPULATION PROGRAM HAS SERVED AS A PROPER CATALYST IN EFFECTING THE AWARENESS FOR LEGAL REFORMS IN FAMILY PLANNING AND POPULATION CHANGE; MOREOVER, 24 COUNTRY PROJECTS HAVE BEEN STARTED AND 10 MORE HAVE BEEN PROPOSED. WHILE CONTINUANCE OF THE INTERNATIONAL ADVISORY COMMITTEE ON POPULATION LAW IS NECESSARY TO EXERT INFLUENCE IN INSTIGATING REFORMS IN POPULATION LAWS IN SOVEREIGN NATIONS, THIS ORGANIZATION'S FUNCTION AND COMPOSITION HAS NOT LENT ITSELF TO VIABILITY NOR INDEPENDENCE BUT REFLECTS MORE AN EXTENSION OF THE FLETCHER PROGRAM. WHILE THE EFFORTS TO STIMULATE AWARENESS AND ACTION ON POPULATION LAWS HAVE BEEN EXTREMELY FRUITFUL, IT HAS OCCURRED AT THE SACRIFICE OF THE RESEARCH OUTPUT EXPECTED BY THE CORE PROGRAM. A LEGAL REPORTING NETWORK HAS BEEN ESTABLISHED, BUT, TO THIS DATE, HAS BEEN CONFINED TO THOSE CONTRIBUTING COUNTRIES WHERE THERE ARE LAW AND POPULATION PROJECTS. A LEGAL REFERENCE SERVICE AND LIBRARY HAS BEEN INITIATED. THE EVALUATORS MADE SEVERAL RECOMMENDATIONS INCLUDING THAT AID EITHER: (1)SUPPORT THE PROJECT UNDER A TIME-LIMITED CONSTRAINT TO EFFECT THE INSTITUTIONALIZATION OF THE PROGRAM AND TO DEVELOP AN AGREED-UPON SET OF PRIORITY COUNTRIES, OR (2)PROVIDE SUFFICIENT FUNDS TO PERMIT THE COMPLETION OF SOME ACTIVITIES ALREADY INITIATED.","","Special Evaluation","Documents","","","12/1/1974 12:00:00 AM","","Family planning|Population policy|Laws and legislation|Reports","","http://pdf.usaid.gov/pdf_docs/PDAAA510A1.pdf","683 KB","000148 - USAID. Bur. for Population and Humanitarian Assistance. Ofc. of Population","","","English","application/pdf","","","PATRICK, GERALD P.|BACKLUND, E. R.|et al.","","1 Dec 1974","","","","EVALUATION REPORT : LAW AND POPULATION PROGRAM, TUFTS UNIVERSITY","","PD-AAA-510-A1","https://dec.usaid.gov/dec/content/Detail.aspx?ctID=ODVhZjk4NWQtM2YyMi00YjRmLTkxNjktZTcxMjM2NDBmY2Uy&rID=MTc0MTEz","Population and Humanitarian Assistance","9320880"
"THIS EVALUATION REPORT WAS UNDERTAKEN (1)TO ASSESS THE ADVANTAGES, DISADVANTAGES, AND POSSIBLE REPLICABILITY OF THE ""MODIFIED' FORCE ACCOUNT APPROACH USED IN THIS PROJECT; AND (2)TO CONSIDER HOW AID'S EVALUATION PROCEDURES FOR NON-CAPITAL PROJECTS SHOULD BE APPLIED TO CAPITAL PROJECTS. THE EVALUATION PROCEDURE LED THE EVALUATORS TO MAKE 8 RECOMMENDATIONS INCLUDING: (1)ROAD PROJECTS RELATED TO REGIONAL DEVELOPMENT OR RURAL DEVELOPMENT PROGRAMS SHOULD USE A COST-EFFECTIVENESS APPROACH TO ASSURE APPROPRIATE DESIGN STANDARDS AND PREVENT THE DEVELOPMENT OF EXCESSIVELY COSTLY FACILITIES; (2)ALL BENEFIT-COST ANALYSES SHOULD ROUTINELY INCLUDE A SENSITIVITY ANALYSIS APPLIED TO THE MAJOR VARIABLES; (3)AID SHOULD CONTINUE ITS POLICY OF ENCOURAGING CONTRACTOR CONSTRUCTION OF HIGH-STANDARD ROADS, BUT SHOULD BE PREPARED TO CONSIDER MANAGED FORCE ACCOUNT ON A CASE-BY-CASE BASIS; (4)AID SHOULD CONTINUE TO SEEK OUT MEANS OF ENCOURAGING THE USE OF LOCAL MATERIALS AND LABOR-INTENSIVE TECHNIQUES; AND (5)AID SHOULD ESTABLISH A COMPREHENSIVE AND INTEGRATED MONITORING, REPORTING AND EVALUATION SYSTEM FOR CAPITAL PROJECTS INCORPORATING THE LOGICAL FRAMEWORK, ANNUAL EVALUATION BASED ON THE PAR SYSTEM, AND FINAL PROJECT EVALUATION, PERMITTING SUBSTANTIAL VARIATION WITHIN THE FRAMEWORK OF A SET OF STANDARD MINIMUM REQUIREMENTS.","","Special Evaluation","Documents","","","6/1/1974 12:00:00 AM","","Road construction|Roads|Transportation system design|Road maintenance","Malawi","http://pdf.usaid.gov/pdf_docs/PDAAA205A1.pdf","5,216 KB","","","","English","application/pdf","","","MANLY, GORDON|WESTLEY, JOHN R.","","1 Jun 1974","","","","MALAWI LAKE SHORE ROAD PROJECT EVALUATION REPORT (AID USE ONLY)","","PD-AAA-205-A1","https://dec.usaid.gov/dec/content/Detail.aspx?ctID=ODVhZjk4NWQtM2YyMi00YjRmLTkxNjktZTcxMjM2NDBmY2Uy&rID=MTc0MTcz","Malawi","6120153"
"MICHIGAN STATE U. SIMULATION MODELING OF AGRICULTURAL AND ECONOMIC SECTORS LAMBASTED BY EVALUATOR. KOREAN LIVESTOCK MODEL & KOREAN COMPONENT OF RECURSIVE LINEAR PROGRAM DEEMED ""TRIVIAL""; FUNDAMENTAL POINTS OF NIGERIAN, VENEZUELAN, & COLUMBIAN ECONOMIC MODELS SIMPLY CLASH WITH THE FACTS. 4 SUGGESTIONS FOR IMPROVEMENTS OFFERED BY EVALUATOR.","","Special Evaluation","Documents","","","3/1/1974 12:00:00 AM","","LIVESTOCK|Simulations|Economic analysis|Agricultural development|Systems approach|Technical assistance","","http://pdf.usaid.gov/pdf_docs/PDAAA477A1.pdf","1,033 KB","","","","English","application/pdf","","","CANDLER, WILFRED","Livestock","31 Mar 1974","","","","EVALUATION REPORT - MSU LIVESTOCK MODELS","","PD-AAA-477-A1","https://dec.usaid.gov/dec/content/Detail.aspx?ctID=ODVhZjk4NWQtM2YyMi00YjRmLTkxNjktZTcxMjM2NDBmY2Uy&rID=MTc0MTk4","Technical Assistance","9310536"
"QUANTITATIVE ANALYSES OF FOUR PROGRAM PHASES (RAM PRODUCTION, IMPROVED SHEEP PRODUCTION, WOOL SHEARING, AND ALFALFA FORAGE) INDICATED THAT THE PROGRAM NET BENEFITS HAVE BEEN SUBSTANTIAL. QUALITATIVE ASSESSMENT OF THE OTHER PROGRAM PHASES SUGGESTED THAT THEY ADDED BENEFITS BOTH TO THE RURAL POPULATION AND TO GOVERNMENT INSTITUTIONS. THESE INSTITUTIONS GAINED BY HAVING THE AGRICULTURAL DATA BASE EXTENDED FOR PLANNING AND BY IMPROVEMENTS IN HUMAN CAPITAL. THE RURAL POPULATION RECEIVED NOT ONLY INCREASES IN NET INCOME BUT A STORE OF FUNDAMENTAL KNOWLEDGE ABOUT AGRICULTURAL PROCESSES. THE GENETIC BASE IS IN PLACE, AND CONTRACT RESEARCH SUGGESTS THAT TEN-TO-TWENTY-FOLD INCREASES IN RANGE FORAGE PRODUCTION CAN BE REAL IZED BY MODIFYING MANAGEMENT PRACTICES. FUTURE TECHNICAL ASSISTANCE ON THE ALTIPLANO MUST, HOWEVER, NOT ONLY CONTINUE TO DISCOVER AND EXPLOIT TECHNICAL RELATIONSHIPS, AND MAINTAIN THE GENETIC BASE, BUT ALSO DEAL WITH INSTITUTIONAL CONSTRAINTS. ONLY WITH INSTITUTIONAL CHANGES IN MANAGEMENT CAN THE EXTENSIVE RANGE RESOURCES OF THE ALTIPLANO BE BROUGHT TO THEIR PRODUCTIVE POTENTIALS. TECHNICAL ASSISTANCE IN RANGE MANAGEMENT AND SHEEP PRODUCTION AS WELL AS HELP IN DEVELOPING FORMAL ACADEMIC PROGRAMS SHOULD BE GIVEN. IN ADDITION, THE GOVERNMENT OF BOLIVIA SHOULD GIVE HIGH PRIORITY TO INCREASED SUPPORT OF AGRICULTURE PROGRAMMING.","","Special Evaluation","Documents","","","9/1/1974 12:00:00 AM","","Agricultural extension|Animal husbandry|Forage legumes|Agricultural training|Educational materials|Agricultural product marketing|Agricultural research|Forage crops|SHEEP|WOOL|Range management","Bolivia","http://pdf.usaid.gov/pdf_docs/PDAAA104A1.pdf","1,435 KB","008515 - USAID. Mission to Bolivia","","","English","application/pdf","","","WENNERGREN, E. B.","","1 Sep 1974","","","","EVALUATION OF THE UTAH STATE UNIVERSITY/USAID SHEEP PRODUCTION AND MARKETING PRODRAM IN BOLIVIA","","PD-AAA-104-A1","https://dec.usaid.gov/dec/content/Detail.aspx?ctID=ODVhZjk4NWQtM2YyMi00YjRmLTkxNjktZTcxMjM2NDBmY2Uy&rID=MTc0MzAy","Bolivia","511036402"
"6/73-12/74. LACK OF FLUENCY IN ENGLISH CITED AS A CONTINUING PROBLEM, ALTHOUGH SUBSEQUENT PARTICIPANTS WILL RECEIVE LANGUAGE TRAINING BEFORE LEAVING AFGHANISTAN AND WILL TAKE ONLY ONE COURSE DURING THEIR FIRST SEMESTER IN THE US. OVERALL PARTICIPANT PERFORMANCE GOOD; BALANCE OF CLASSROOM WORK, SPECIAL SEMINARS, AND PRACTICAL WORK IS EFFECTIVE. ALTHOUGH THE TRAINING PROGRAM IS NOT DEGREE-ORIENTED, LACK OF CERTAINTY OF THE STATUS ACCORDED THOSE WHO FINISH THE PROGRAM HAS PUT PRESSURE ON MANY PARTICIPANTS TO ATTAIN A MASTER OF COMPARATIVE LAW. REGOGNITION BY THE GOA OF PROGRAM COMPLETION AS BEING EQUIVALENT TO A DEGREE HAS BEEN SUGGESTED.","","Special Evaluation","Documents","","","12/1/1974 12:00:00 AM","","Participants","Afghanistan","http://pdf.usaid.gov/pdf_docs/PDAAC459G1.pdf","204 KB","002255 - George Washington University. National Law Center","","","English","application/pdf","","","LIEBESNY, HERBERT J.","Participant training","1 Dec 1974","","","","AFGHAN LEGAL TRAINING PROGRAM - - OVERALL SUBSTANTIVE EVALUATION OF THE PROGRAM FOR THE FIRST GROUP OF AFGHAN PARTICIPANTS 6/73 TO 12/74","","PD-AAC-459-G1","https://dec.usaid.gov/dec/content/Detail.aspx?ctID=ODVhZjk4NWQtM2YyMi00YjRmLTkxNjktZTcxMjM2NDBmY2Uy&rID=MTc0NjEz","Afghanistan","3060123"
"RESULTS OF EVALUATION CONDUCTED FROM 6/18/73 TO 4/15/74 TO DETERMINE EFFECTIVENESS OF THE PRIMARY TEACHER RE-TRAINING PROGRAM. REPORT IN SPANISH.","","Special Evaluation","Documents","AID-518-354","","4/1/1974 12:00:00 AM","","Primary education|Teacher training","Ecuador","http://pdf.usaid.gov/pdf_docs/PDAAA746A1.pdf","36,929 KB","001610 - Centro de Motivacion y Asesoria","","","English","application/pdf","","","WILLACIS, ANIBAL","","1 Apr 1974","","","","INFORME FINAL EVALUACION DEL PROGRAM DE REENTRENAMIENTO DE MAESTROS PRIMARIOS","","PD-AAA-746-A1","https://dec.usaid.gov/dec/content/Detail.aspx?ctID=ODVhZjk4NWQtM2YyMi00YjRmLTkxNjktZTcxMjM2NDBmY2Uy&rID=MTc0Njc2","Ecuador","518007501"
"REPORT ON THE EVALUATION OF AFGRAD AND INTERAF PROGRAMS BY ELDON L. JOHNSON AND CLIFFORD S. LIDDLE, DECEMBER 1974. THE EVALUATORS PROVIDED A BACKGROUND ABOUT THE AFRICAN GRADUATE FELLOWSHIP PROGRAM (AFGRAD) AND THE INTER-AFRICAN UNIVERSITIES SCHOLARSHIP PROGRAM (INTERAF) AND ABOUT EFFORTS TO MEET AFRICA'S NEED FOR HIGHLY TRAINED INDIGENOUS PROFESSIONAL MANPOWER. THEY EXAMINED AFRICA'S CHANGING NEEDS FROM THREE PERSPECTIVES: (1) THE FOREIGN ASSISTANCE ACT OF 1973; (2) THE AFRICAN COUNTRIES THEMSELVES; AND (3) FOREIGN ASSISTANCE SPECIALISTS. FROM THESE PERSPECTIVES IT IS CLEAR THAT SUFFICIENT NEED EXISTS FOR CONTINUATION OF AID-FUNDED GRADUATE SCHOLARSHIPS FOR AFRICA THROUGH 1980. THAT NEED IS MOST ACUTE QUALITATIVELY AND IN THE DEVELOPMENTAL FIELDS. THE KIND OF MANPOWER NEED IS CHANGING AND WILL CONTINUE TO CHANGE. FOR ALL COUNTRIES, THE APPROPRIATE STRATEGY FOR DETERMINING COUNTRY-SPECIFIC NEEDS, BOTH IN PRACTICAL TERMS AND IN THE SPIRIT OF THE FOREIGN ASSISTANCE ACT OF 1973, IS RELIANCE ON LOCAL DETERMINATION THROUGH EXISTING OR ESTABLISHED LOCAL MECHANISMS WHICH COMBINE EDUCATIONAL AND PLANNING/DEVELOPMENT REPRESENTATION. IT IS THROUGH SUCH LOCAL DETERMINATION, RATHER THAN SOME PRIOR LISTING, THAT COUNTRY-SPECIFIC NEEDS MUST BE DERIVED. THE EVALUATORS DISCUSSED FOUR POSSIBLE OPTIONS FOR AFGRAD AND INTERAF PROGRAMS: (1) KEEP BOTH PROGRAMS ON THEIR PRESENT GLIDE PATHS OF TERMINATION; (2) KEEP BOTH PROGRAMS AS SEPARATE OPERATIONS AT THE PRESENT INTAKE LEVELS WITH A COMPLETION DATE OF JUNE 1984; (3) WIND DOWN SOME FRACTION OF AFGRAD BY ADDING AN EQUIVALENT GRADUATE COMPONENT TO INTERAF, WITH RETENTION OF THE AFGRAD REMAINDER MORE SPECIFICALLY FOR MONITORED USE IN PREPARATION OF SPECIALIZED TALENT FOR CRITICAL, DEVELOPMENT-RELATED POSITIONS IN AFRICA; AND (4) SHIFT PROGRAMS TO AFRICA AND AFRICAN INSTITUTIONS BY PHASING OUT AFGRAD AND BUILDING UP INTERAF WITH A GRADUATE COMPONENT.","Evaluation period: 1 Jan 1963-1 Dec 1974","Special Evaluation","Documents","AID/afr-608","","12/1/1974 12:00:00 AM","","Graduate education|SCHOLARSHIPS|Teacher training|Adult education|Beneficiary count","Africa","http://pdf.usaid.gov/pdf_docs/PDAAA581A1.pdf","5,689 KB","001397 - American Council on Education. Overseas Liaison Committee","","","English","application/pdf","Multi country evaluation|Indepth evaluation","","LIDDLE, CLIFFORD S.|JOHNSON, ELDON L.","","1 Dec 1974","","","","REPORT ON THE EVALUATION OF AFGRAD AND INTERAF PROGRAMS.","","PD-AAA-581-A1","https://dec.usaid.gov/dec/content/Detail.aspx?ctID=ODVhZjk4NWQtM2YyMi00YjRmLTkxNjktZTcxMjM2NDBmY2Uy&rID=MTc0ODU2","Africa Regional","6980210|6980062"
"AS OF 4/19/74. PROJECT HAD FALSE STARTS IN BRAZIL & ETHIOPIA & A SERIOUS DELAY IN AFGHANISTAN, BUT PROJECT DESIGN REMAINS UNAFFECTED. THE USE OF ERTS IMAGERY IN DEMOGRAPHY APPEARS FEASIBLE AT THIS TIME,BUT ADDITIONAL USES IN THIS PROJECT SUCH AS CROP ESTIMATING,CARTOGRAPHY,GEOLOGY,HYDROLOGY,RANGE MANAGEMENT,FORESTRY,ETC,SHOULD BE ENCOURAGED. BRAZIL DROPPED PROJECT BECAUSE TITLE X FUNDS WERE POLITICALLY UNACCEPTABLE;ETHIOPIA DROPPED PROJ BECAUSE THE IEG WANTED ISRAELI TECHNICAL ASSISTANCE RATHER THAN US. CHANGES IN THE AFGHAN GOVERNMENT RESULTED IN A HOSTILE EVNIRONMENT FOR FOREIGNERS & PROJ DEVELOPMENT. THUS,PARTICIPANT TRAINEES HAD NO JOBS TO RETURN TO IN AFGHANISTAN. ALSO,IT WAS RECOMMENDED THAT FUTURE PARTICIPANTS HAVE ENGLISH LANGUAGE PROFICIENCY. QERTS-B LAUNCH NOW SET FOR EARLY 1975; ERTS-1 CAPACITY REDUCED BY PROGRESSIVE TAPE RECORDER FAILURE.","Evaluation period: 30 APR 1973-19 APR 1974","Special Evaluation","Documents","","","4/1/1974 12:00:00 AM","","Maps|Satellites|Remote sensing|Technical assistance|Participants|Population censuses|Demographic data collection|Political aspects","Brazil|Ethiopia|Afghanistan","http://pdf.usaid.gov/pdf_docs/PDAAD238A1.pdf","682 KB","000196 - USAID. Bur. for Technical Assistance","","","English","application/pdf","Earth Resources Technology Satellite","","KITCHELL, RAYMOND E.","","19 Apr 1974","","","","EVALUATION OF REMOTE SENSING CENSUS PROJECT","","PD-AAD-238-A1","https://dec.usaid.gov/dec/content/Detail.aspx?ctID=ODVhZjk4NWQtM2YyMi00YjRmLTkxNjktZTcxMjM2NDBmY2Uy&rID=MTc0ODg5","","9310997"
"AS OF 6/30/76. 3 DECENTRALIZED UNITS OF MINISTRY OF EDUCATION ESTABLISHED WITH AUTHORITY TO MAKE DECISIONS AT A LOCAL LEVEL CONCERNING ORGANIZATION, IMPLEMENTATION, SUPERVISION, AND COORDINATION OF PRIMARY AND SECONDARY SCHOOLS. PLANNING UNIT OF MINISTRY STRENGTHENED. PILOT CURRICULA FOR GRADES 1, 3, AND 7 BEING TESTED IN 54 RURAL SCHOOLS. PILOT TEXTBOOK PRODUCTION PROGRAM, BEGUN IN 1975, HAS PRODUCED 2 FIRST GRADE AND 2 SECOND GRADE TEXTS IN READING AND MATHEMATICS, WITH ACCOMPANYING TEACHER GUIDES AND PROGRAMMED TEXTS. NEW SYSTEM FOR DELIVERY OF GUIDANCE SERVICES TO PRIMARY AND SECONDARY STUDENTS DEVELOPED. SUBSTANTIAL PROGRESS IN TRAINING SUPERVISORS, SCHOOL DIRECTORS, AND TEACHERS THROUGH IN-SERVICE SEMINARS ACHIEVED. 9 SECONDARY SCHOOLS CONSTRUCTED (380 CLASSROOMS) AND 2 UNIVERSITY REGIONAL CENTERS CONSTRUCTED. 756 PRIMARY CLASSROOMS CONSTRUCTED, ALTHOUGH INCREASED ENROLLMENTS HAVE LEFT MINISTRY OF EDUCATION WITH A DEFICIT OF 1500 CLASSROOMS.","Bibcode changed from 32 to 22, 2008-05-19","Special Evaluation","Documents","","","9/1/1974 12:00:00 AM","","Arithmetic|Reading instruction|Rural areas|Textbooks|Curriculum design|Education|Pilot projects|Secondary education|Primary education|Decentralization|Educational administration|Departmental reorganization|Government departments","Panama","http://pdf.usaid.gov/pdf_docs/PDAAB257B1.pdf","419 KB","008589 - USAID. Mission to Panama","","","English","application/pdf","","","","","2 Sep 1974","","","","AID LOAN 525-L-036-PROJECT 525-21-680-145-EDUCATION SECTOR - ANNUAL EVALUATION","","PD-AAB-257-B1","https://dec.usaid.gov/dec/content/Detail.aspx?ctID=ODVhZjk4NWQtM2YyMi00YjRmLTkxNjktZTcxMjM2NDBmY2Uy&rID=MTc1MDQ5","Panama","5250145"
"Completion report evaluates the Farm-to-Market Access Road Program in Honduras, 11/25/65 - 9/13/74.  The original loan called for engineering and construction of 600 kms of access roads.  Scope of loan was reduced in 7/71 to cover construction of 4 access roads totaling 113.8 kms and preparation of final engineering plans for 9 subprojects totaling 286 kms.  Revision in scope was made in order to reflect increased construction costs and additional work within subprojects since the original loan authorization. Report is based on USAID staff engineering inspection made in 8/74 to evaluate road maintenance and usage. Construction of the 4 access roads was satisfactorily completed. Nevertheless, since construction, the Highway Maintenance Department has not given proper maintenance to most of the roads.  This is causing deterioration of road surfaces as a result of erosion and slope slides. For instance, an inspection of the Maraita-Yuayape subproject revealed that the sub-base course is washing out and many ruts are forming.  Side ditches are blocked as a result of slides and erosion.  Also, a main bridge structure has not yet been built.  This has limited road use to 4-wheel drive vehicles. On the other hand, the Government of Honduras is making good use of the engineering designs prepared under this loan.  Report estimates that 7 of the 9 proposed subproject designs will be used, and the roads constructed by the end of 1978. The Government is undertaking complementary investment programs for highway construction and improvement in most of the areas of influence of the farm-to-market roads built under the USAID loan. During the next 5 years, the Farm-to-Market Access Road Program will start producing the benefits contemplated when this loan was made.","Evaluation period: 25 Nov 1965-13 Sep 1974","Final Evaluation Report","Documents","","","9/1/1974 12:00:00 AM","","Road maintenance|Transportation system design|Road construction|Farm to market roads|Roads|Project change","Honduras","","","008563 - USAID. Mission to Jamaica","","","English","","Onsite evaluation","","FIGUEROA, FRANCISCO","","13 Sep 1974","","","","COMPLETION REPORT; LOAN 522-L-013; FARM - TO - MARKET ACCESS ROAD PROGRAM","","PD-AAB-569-A1","https://dec.usaid.gov/dec/content/Detail.aspx?ctID=ODVhZjk4NWQtM2YyMi00YjRmLTkxNjktZTcxMjM2NDBmY2Uy&rID=MTc1MDYx","Honduras","5220070"
