Abstract,Ancillary_Data,Bibliographic_Type,ContentType,Contract_Grant_Number,Credit,Date_Resource_Created,Description,Descriptors_Topical,Descriptors_Geographic,File,File_Size,Inst_Author,Inst_Publisher,Inst_Sponsor,Language,Mime_Type,New_Thesaurus_Terms,Notes,Personal_Author,Primary_Subject,Publication_Date_Freeform,Related_Doc_Links,Report_Number,Series_Title,Title,Title_Translated,Unique_ID,URI,USAID_Geography,USAID_Project_Number
"","","Final Evaluation Report","Documents","HDA-I-00-03-00124-00","","9/1/2006 12:00:00 AM","","Political systems in transition|Democratization|Grants|Popular participation|Human rights|Conflict resolution|Political development|Post conflict societies|Conflict prevention|Local capacity building|Stakeholder participation","Iraq","http://pdf.usaid.gov/pdf_docs/PDACI335.pdf","190 KB","011933 - Social Impact, Inc.","","010972 - USAID. Bur. for Democracy, Conflict and Humanitarian Assistance. Ofc. of Transition Initiatives (OTI)","English","application/pdf","Final evaluation|Peace building","","Boyle, Philip","Societies in transition","30 Sep 2006","","","","Strategy and impact of the Iraq transition initiative : OTI in Iraq (2003-2006) -- final evaluation","","PD-ACI-335","https://dec.usaid.gov/dec/content/Detail.aspx?ctID=ODVhZjk4NWQtM2YyMi00YjRmLTkxNjktZTcxMjM2NDBmY2Uy&rID=Mjk0MzMw","Iraq",""
"","Project title: Patrick J. Leahy War Victims Fund (LWVF)","Special Evaluation","Documents","DFD-M-00-04-00238-00","","9/1/2006 12:00:00 AM","","Prostheses|Rehabilitative medicine|Manufacturing|Physical handicaps|Pediatrics|Quality control|Quality of care","Vietnam","http://pdf.usaid.gov/pdf_docs/PDACJ690.pdf","871 KB","012158 - Manila Consulting Group, Inc.","","010864 - USAID. Bur. for Democracy, Conflict and Humanitarian Assistance. Ofc. of Democracy and Governance","English","application/pdf","Interim evaluation|Orthotic devices","","Stills, Melvin L.","Medical equipment","Sep 2006","","","","Assessment of completed and ongoing Vietnam Veterans of America Foundation P&O activities in Vietnam : September 11-15, 2006","","PD-ACJ-690","https://dec.usaid.gov/dec/content/Detail.aspx?ctID=ODVhZjk4NWQtM2YyMi00YjRmLTkxNjktZTcxMjM2NDBmY2Uy&rID=Mjk0MzQ1","Vietnam","9363102"
"","Project title: Economic modernization through efficient reforms and|governance enhancement (EMERGE)|Order no. 800|Contract listed in document as AFP-I-00-00-03-00020|Prepared for Dept. of Finance, National Credit Council Secretariat|At head of title: Technical report|Project title: SEGIR privatization II IQCs","Special Evaluation","Documents","AFP-I-00-03-00020-00","","5/1/2006 12:00:00 AM","","Credit|Fiscal policy|Policy reform|Private sector|Financing|Credit guarantees|Savings and loan associations|Economic administration|Microfinance|Poverty reduction","Philippines","http://pdf.usaid.gov/pdf_docs/PDACI349.pdf","942 KB","000354 - Carana Corp.|004304 - Nathan Associates, Inc.","","011274 - USAID. Bur. for Economic Growth, Agriculture and Trade. Ofc. of Economic Growth|008592 - USAID. Mission to Philippines","English","application/pdf","Ex post evaluation","","Lamberte, Mario B.","Credit","29 May 2006","","","","An evaluation of the credit policy improvement program (CPIP)","","PD-ACI-349","https://dec.usaid.gov/dec/content/Detail.aspx?ctID=ODVhZjk4NWQtM2YyMi00YjRmLTkxNjktZTcxMjM2NDBmY2Uy&rID=Mjk0MzYz","Philippines",""
"","Task order no. 14|Project title: Democracy and governance analytical service|indefinite quantity contract (IQC)","Special Evaluation","Documents","DFD-I-00-04-00229-00","","7/1/2006 12:00:00 AM","","Judicial reform|Judiciary|Courts|Laws and legislation|Policy making|Administration of law|Ethics|Public awareness|Access to justice|Case management (administration of law)","Kosovo","http://pdf.usaid.gov/pdf_docs/PDACI353.pdf","376 KB","001600 - Associates in Rural Development, Inc. (ARD)","","010393 - USAID. Mission to Kosovo","English","application/pdf","Interim evaluation","","Rosten, Keith|Djurickovic, Natalija|Williams, Louise D.","Rule of law","19 Jul 2006","","","","Evaluation of the justice system reform activity : Kosovo","","PD-ACI-353","https://dec.usaid.gov/dec/content/Detail.aspx?ctID=ODVhZjk4NWQtM2YyMi00YjRmLTkxNjktZTcxMjM2NDBmY2Uy&rID=Mjk0Mzg0","Kosovo (Serbia)",""
"","Former project title: PVO child survival grants program (CSGP)|Current project title: Child survival and health grants program|(CSHGP)","Final Evaluation Report","Documents","HFP-A-00-01-00038-00","","11/1/2006 12:00:00 AM","","Child survival activities|Maternal child health care|Nutrition improvement|Malaria|Immunizations|Access to services|Health education|Private voluntary organizations|Child feeding practices|Community mobilization|Exclusive breastfeeding|Health behavior|Integrated management of childhood illnesses (IMCI)|Local capacity building","Mozambique","http://pdf.usaid.gov/pdf_docs/PDACI359.pdf","481 KB","008344 - CARE International in Mozambique|007518 - CARE International","","011222 - USAID. Bur. for Global Health. Ofc. of Health, Infectious Diseases, and Nutrition","English","application/pdf","Final evaluation|Insecticide-treated nets (ITNs)","","Whitson, Donald T.","Child survival","Nov 2006","","","","Child survival project, Nampula, Mocambique : final evaluation","","PD-ACI-359","https://dec.usaid.gov/dec/content/Detail.aspx?ctID=ODVhZjk4NWQtM2YyMi00YjRmLTkxNjktZTcxMjM2NDBmY2Uy&rID=Mjk0Mzg5","Mozambique","9363114"
"","Project title: Bean and cowpea collaborative research support|program (Bean/Cowpea CRSP)","Special Evaluation","Documents","GDG-G-00-02-00012-00","","9/1/2006 12:00:00 AM","","Agricultural research|Research collaboration|Beans|Cowpeas|Research organizations|Institution building|Technical training|Research utilization|Stakeholder participation","Africa|Latin America|Caribbean","http://pdf.usaid.gov/pdf_docs/PDACI363.pdf","523 KB","000775 - Michigan State University","","010821 - USAID. Bur. for Economic Growth, Agriculture and Trade","English","application/pdf","Interim evaluation","","Herdt, Robert|Kornegay, Julia|et al.","Food crops","Sep 2006","","","","External evaluation panel five-year technical review (2002-07) of the bean/cowpea collaborative research support program (CRSP)","","PD-ACI-363","https://dec.usaid.gov/dec/content/Detail.aspx?ctID=ODVhZjk4NWQtM2YyMi00YjRmLTkxNjktZTcxMjM2NDBmY2Uy&rID=Mjk0Mzky","Ctr for Economic Growth & Ag Development","9311310"
"","Task order #13","Special Evaluation","Documents","PCE-I-00-99-00001-00","","6/1/2006 12:00:00 AM","","Land reform|Land titling|Privatization|Agricultural land|Land tenure|Land ownership|Property law|Credit|Land registration|Market development","Ukraine","http://pdf.usaid.gov/pdf_docs/PDACI434.pdf","837 KB","001600 - Associates in Rural Development, Inc. (ARD)","","011039 - USAID. Regional Mission to Ukraine, Belarus, Moldova|011006 - USAID. Bur. for Economic Growth, Agriculture and trade. Ofc. of Environment and Natural Resources","English|Ukrainian","application/pdf","Interim evaluation|Land markets|Land rights","","Roth, Michael|Valletta, William","Land reform","Jun 2006","","","","Land reform and land market development in Ukraine : findings of the Ukraine land titling initiative (ULTI) project assessment and strategies for future USAID intervention","","PD-ACI-434","https://dec.usaid.gov/dec/content/Detail.aspx?ctID=ODVhZjk4NWQtM2YyMi00YjRmLTkxNjktZTcxMjM2NDBmY2Uy&rID=Mjk0NTU3","Ukraine",""
"","Cover date: Sept. 2006|Order no. GHS-I-07-03-00025-00","Final Evaluation Report","Documents","GHS-I-00-03-00025-00","","10/1/2006 12:00:00 AM","","Health care administration|Supply management|Procurement|Logistics|Hospitals|Health facilities|Storage facilities","Malawi","http://pdf.usaid.gov/pdf_docs/PDACI458.pdf","165 KB","009456 - Chemonics International Inc.","","008573 - USAID. Mission to Malawi|011222 - USAID. Bur. for Global Health. Ofc. of Health, Infectious Diseases, and Nutrition","English","application/pdf","Final evaluation","","Berger, Rene|Teoh, Noreen|Mungai, Thuguri","Health care administration","Oct 2006","","","","Malawi DELIVER : end of project evaluation","","PD-ACI-458","https://dec.usaid.gov/dec/content/Detail.aspx?ctID=ODVhZjk4NWQtM2YyMi00YjRmLTkxNjktZTcxMjM2NDBmY2Uy&rID=Mjk0NjAx","Malawi",""
"","Project title: Decentralization support activity (DSA)","Final Evaluation Report","Documents","","","9/1/2006 12:00:00 AM","","Management training|Financial management|On the job training|Financial records systems|Public finance|Technical training|Management information systems|Information technology|Integrated management","Ethiopia","http://pdf.usaid.gov/pdf_docs/PDACI476.pdf","374 KB","001600 - Associates in Rural Development, Inc. (ARD)","","008543 - USAID. Mission to Ethiopia","English","application/pdf","Final evaluation","","","Financial management","Sep 2006","","","","Evaluation of the in-service training program in financial management","","PD-ACI-476","https://dec.usaid.gov/dec/content/Detail.aspx?ctID=ODVhZjk4NWQtM2YyMi00YjRmLTkxNjktZTcxMjM2NDBmY2Uy&rID=Mjk0NjU0","Ethiopia",""
"","Title in footer: Evaluation of SPSNP and OFDA 2005 interventions|At head of cover title: Raise PLUS|Title page states: Period of performance, September-November 2006|Related document: PD-ACJ-406|Project title: Rural and agricultural incomes with a sustainable|environment plus (RAISE plus)","Special Evaluation","Documents","AEG-I-00-04-00010-00","","10/1/2006 12:00:00 AM","","Income generation|Households|Food production|Agricultural extension|Agricultural inputs|Agricultural finance|Agricultural training|Agricultural enterprises|Market development","Ethiopia","http://pdf.usaid.gov/pdf_docs/PDACI640.pdf","655 KB","007239 - Weidemann Associates, Inc.","","011325 - USAID. Bur. for Economic Growth, Agriculture and trade. Ofc of Agriculture","English","application/pdf","Interim evaluation|Livelihood|Social safety net programs|Vouchers","","Gray, George|Dastgeer, Ali|Desalegn, Gebremeskel","Food security","Oct 2006","","","","Evaluation of livelihood interventions funded through USAID famine fund support to the productive safety net program","","PD-ACI-640","https://dec.usaid.gov/dec/content/Detail.aspx?ctID=ODVhZjk4NWQtM2YyMi00YjRmLTkxNjktZTcxMjM2NDBmY2Uy&rID=Mjk0OTk2","Ethiopia",""
"","Project title: Child survival and health grants program (CSHGP)","Final Evaluation Report","Documents","HFP-A-00-01-00046-00","","12/1/2006 12:00:00 AM","","Child survival activities|Child health care|Community health care|Health professional education|Immunizations|Malaria|Diarrhea|Private voluntary organizations|Health service utilization|Integrated management of childhood illnesses (IMCI)|Pneumonia|Quality of care","Mali","http://pdf.usaid.gov/pdf_docs/PDACI676.pdf","239 KB","011220 - PLAN International USA (Childreach)","","011222 - USAID. Bur. for Global Health. Ofc. of Health, Infectious Diseases, and Nutrition","English","application/pdf","Final evaluation","","Joseph, Marguerite|Metangmo, Pierre-Marie, ed.|Tsuma, Laban, ed.","Child survival","31 Dec 2006","","","","Plan Mali : child survival XVII project -- final evaluation report, year 5","","PD-ACI-676","https://dec.usaid.gov/dec/content/Detail.aspx?ctID=ODVhZjk4NWQtM2YyMi00YjRmLTkxNjktZTcxMjM2NDBmY2Uy&rID=Mjk1MDM4","Mali","9363114"
"","Project title: Child survival and health grants program (CSHGP)|At head of title: For our mothers and children : scaling success to|the district level","Final Evaluation Report","Documents","FAO-A-00-97-00042-00","","8/1/2006 12:00:00 AM","","Child survival activities|Maternal child health care|Health education|Access to services|Health professional education|Institution building|Districts|Private voluntary organizations|Health behavior|Integrated management of childhood illnesses (IMCI)|Local capacity building|Quality of care","Nepal","http://pdf.usaid.gov/pdf_docs/PDACI677.pdf","685 KB","011220 - PLAN International USA (Childreach)","","011222 - USAID. Bur. for Global Health. Ofc. of Health, Infectious Diseases, and Nutrition","English","application/pdf","Final evaluation","","Wilcox, Sandra|Metangmo, Pierre-Marie, ed.|Tsuma, Laban, ed.","Child survival","Aug 2006","","","","PLAN Nepal child survival XIII cost extension : final evaluation","","PD-ACI-677","https://dec.usaid.gov/dec/content/Detail.aspx?ctID=ODVhZjk4NWQtM2YyMi00YjRmLTkxNjktZTcxMjM2NDBmY2Uy&rID=Mjk1MDM5","Nepal","9363114"
"","Project title: Achievement of market-friendly initiatives and|results 2.0 (AMIR 2.0)|ICTI (information and communications technology initiative)|component|432.1.3 IQC monitoring and coordination","Special Evaluation","Documents","278-C-00-02-00210-00|278-C-00-02-00201-00","","3/1/2006 12:00:00 AM","","Information technology|Customs operations|Management information systems|Reporting systems|Business support services|Personnel development|International trade|Financial records systems|Information and communications technology (ICT)","Jordan","http://pdf.usaid.gov/pdf_docs/PDACI682.pdf","172 KB","009456 - Chemonics International Inc.","","008564 - USAID. Mission to Jordan","English","application/pdf","Interim evaluation|Licenses","","Tahami, Amir","Information management, systems and equipment","Mar 2006","","","","ICTI technical projects assessment : final report","","PD-ACI-682","https://dec.usaid.gov/dec/content/Detail.aspx?ctID=ODVhZjk4NWQtM2YyMi00YjRmLTkxNjktZTcxMjM2NDBmY2Uy&rID=Mjk1MDU0","Jordan","2780005"
"","CHANGES2 and Ministry of Education|Project title: Educational quality improvement program 1 (EQUIP1)|Project title: Community health and nutrition, gender and education|support 2 (CHANGES2)","Special Evaluation","Documents","690-A-00-05-00120-00|GDG-A-00-03-00006-00","","11/1/2006 12:00:00 AM","","HIV/AIDS|Child welfare services|Psychological needs|Social impact|School age population|Psychology education|Counseling services|Student guidance","Zambia","http://pdf.usaid.gov/pdf_docs/PDACI765.pdf","242 KB","000251 - American Institutes for Research (AIR)","","011326 - USAID. Bur. for Economic Growth, Agriculture and Trade. Ofc. of Education|001940 - USAID. Bur. for Africa. Regional Center for Southern Africa (RCSA)","English","application/pdf","Interim evaluation|Persons affected by AIDS","","Gibbons, Sue","HIV / AIDS","Nov 2006","","","","Evaluation of a pilot programme to provide psychosocial support to children affected by HIV/AIDS","","PD-ACI-765","https://dec.usaid.gov/dec/content/Detail.aspx?ctID=ODVhZjk4NWQtM2YyMi00YjRmLTkxNjktZTcxMjM2NDBmY2Uy&rID=Mjk1MjA4","Zambia",""
"","Evaluated project title: Support for replicable innovative|village/community-level efforts for children affected by HIV/AIDS|in Zimbabwe (STRIVE)|Project title: Global health technical assistance (GH tech)","Final Evaluation Report","Documents","GHS-I-00-05-00005-00","","11/1/2006 12:00:00 AM","","HIV/AIDS|Child welfare services|Orphans|Disadvantaged groups|Community participation|Social services|Child care|Project replication|Child development|Community mobilization|Integrated development programs","Zimbabwe","http://pdf.usaid.gov/pdf_docs/PDACI766.pdf","848 KB","011976 - QED Group, LLC","","010822 - USAID. Bur. for Global Health","English","application/pdf","Final evaluation|Persons affected by AIDS","","Depp, Rose Marie|Marunda, Sibusisiwe|Yates, Elizabeth","Displaced persons","Nov 2006","","06-000-03","","Final assessment : USAID/Zimbabwe assistance to orphans and vulnerable children through Catholic Relief STRIVE program","","PD-ACI-766","https://dec.usaid.gov/dec/content/Detail.aspx?ctID=ODVhZjk4NWQtM2YyMi00YjRmLTkxNjktZTcxMjM2NDBmY2Uy&rID=Mjk1MjA5","Zimbabwe","9363098Aa"
"","Project title: Child survival and health grants program (CSHGP)|Header title: Concern Worldwide Rwanda child survival project final|evaluation report|Annex E: PN-ADI-064|Annex F: PN-ADI-065","Final Evaluation Report","Documents","HFP-A-00-01-00044-00","","10/1/2006 12:00:00 AM","","Child survival activities|Maternal child health care|HIV/AIDS|Malaria|Community health care|Child nutrition|Health education|Private voluntary organizations|Care of the newborn|Community mobilization|Health behavior|Local capacity building|Stakeholder participation","Rwanda","http://pdf.usaid.gov/pdf_docs/PDACI775.pdf","1,862 KB","010283 - Concern Worldwide","","011222 - USAID. Bur. for Global Health. Ofc. of Health, Infectious Diseases, and Nutrition","English","application/pdf","Final evaluation","","Capps, Jean Meyer|Kabugare, Jean","Child survival","Oct 2006","","","","Concern Worldwide : Kibilizi (now Gisagara) district health partnership -- child survival program : final evaluation report","","PD-ACI-775","https://dec.usaid.gov/dec/content/Detail.aspx?ctID=ODVhZjk4NWQtM2YyMi00YjRmLTkxNjktZTcxMjM2NDBmY2Uy&rID=Mjk1MjI4","Rwanda","9363114"
"","MOBIS ( management, organizational and business improvement|services) contract no. GS (10F-0112)","Special Evaluation","Documents","690-M-00-04-00260-00","","3/1/2006 12:00:00 AM","","Teacher training|Primary education|Occupational skill levels|HIV/AIDS|Health education|Educational methods|Educational media|Quality of education|Professional standards","Malawi","http://pdf.usaid.gov/pdf_docs/PDACI806.pdf","382 KB","000251 - American Institutes for Research (AIR)","","001940 - USAID. Bur. for Africa. Regional Center for Southern Africa (RCSA)","English","application/pdf","Interim evaluation|Life skills|Pre-service training|In-service training","","Mawindo, Simeon B., comp.","Teacher education","30 Mar 2006","","","","Mid-term performance report : successes, challenges and the way foward -- Malawi teacher training activity (MTTA)","","PD-ACI-806","https://dec.usaid.gov/dec/content/Detail.aspx?ctID=ODVhZjk4NWQtM2YyMi00YjRmLTkxNjktZTcxMjM2NDBmY2Uy&rID=Mjk1Mjgx","Malawi",""
"","Vol. I: Main report -- Vol. II: Annexes 1-6 -- Vol. III: Annexes|7-11","Special Evaluation","Documents","RLA-C-00-06-00049-00","","11/1/2006 12:00:00 AM","","Agricultural development|Agricultural income|Agricultural investments|Small farms|Agricultural productivity|Agricultural product marketing|Agricultural technology|Sustainable agriculture|Environmental management|Disadvantaged groups|Human capacity development|Sector policy|Nutrition improvement|Farmer organizations|Local capacity building|Market development|Poverty reduction","Africa south of Sahara","http://pdf.usaid.gov/pdf_docs/PDACI810.pdf","1,935 KB","012551 - LTL Strategies","","008308 - USAID. Bur. for Africa. Ofc. of Sustainable Development","English","application/pdf","Interim evaluation|Relief to development continuum","","","Food security","Nov 2006","","","","Presidential initiative to end hunger in Africa (IEHA) evaluation report","","PD-ACI-810","https://dec.usaid.gov/dec/content/Detail.aspx?ctID=ODVhZjk4NWQtM2YyMi00YjRmLTkxNjktZTcxMjM2NDBmY2Uy&rID=Mjk1Mjgy","Africa Regional",""
"","Project title: Child survival and health grants program (CSHGP)","Final Evaluation Report","Documents","HFP-A-00-01-00014-00","","6/1/2006 12:00:00 AM","","Maternal child health care|Child survival activities|Child care|Health education|Community health care|Preventive health care|Health professional education|Private voluntary organizations|Health service utilization|Health behavior|Integrated management of childhood illnesses (IMCI)|Quality of care","Azerbaijan","http://pdf.usaid.gov/pdf_docs/PDACI889.pdf","5,047 KB","013649 - Mercy Corps","","011222 - USAID. Bur. for Global Health. Ofc. of Health, Infectious Diseases, and Nutrition","English","application/pdf","Final evaluation","","Wilcox, Sandra|Mosely, Kati","Child survival","Jun 2006","","","","Final evaluation : Azerbaijan child survival project -- building partnerships, saving lives : Yardimli, Lerik and Masalli Districts of Southern Azerbaijan","","PD-ACI-889","https://dec.usaid.gov/dec/content/Detail.aspx?ctID=ODVhZjk4NWQtM2YyMi00YjRmLTkxNjktZTcxMjM2NDBmY2Uy&rID=Mjk1NDMy","Azerbaijan","9363114"
"","Project title: Community health and nutrition, gender and education|support 2 (CHANGES2)|Project title: Educational quality improvement program 1 (EQUIP1)","Special Evaluation","Documents","690-A-00-05-00120-00|GDG-A-00-03-00006-00","","9/1/2006 12:00:00 AM","","Health education|HIV/AIDS|Girls|Peer teaching|Educational clubs|Gender analysis|Disease prevention and control|Student behavior|Health behavior|Health impact","Zambia","http://pdf.usaid.gov/pdf_docs/PDACI931.pdf","279 KB","000251 - American Institutes for Research (AIR)","","001940 - USAID. Bur. for Africa. Regional Center for Southern Africa (RCSA)|011326 - USAID. Bur. for Economic Growth, Agriculture and Trade. Ofc. of Education","English","application/pdf","Girls' education|Persons affected by AIDS|People living with AIDS (PLWA)|Adolescents|Impact evaluation","","Nampanya-Serpell, Namposya|Ventimiglia, Deborah","Girls' education","Sep 2006","","","","Impact evaluation of students' alliance for female education (SAFE) clubs and peer education programs","","PD-ACI-931","https://dec.usaid.gov/dec/content/Detail.aspx?ctID=ODVhZjk4NWQtM2YyMi00YjRmLTkxNjktZTcxMjM2NDBmY2Uy&rID=Mjk1NTQx","Zambia",""
"","Task order no. PCE-1[ie I]-18-98-00014-00|Contract listed on cover as PCE-1-00-98-00014-09","Special Evaluation","Documents","PCE-I-00-98-00014-00","","10/1/2006 12:00:00 AM","","Agricultural development|Agribusiness|Development assistance|Foreign assistance|USAID|Development program implementation|Economic impact|Agricultural economics|Project sustainability","Armenia","http://pdf.usaid.gov/pdf_docs/PDACI948.pdf","523 KB","000354 - Carana Corp.","","008509 - USAID. Mission to Armenia","English","application/pdf","Interim evaluation|Development goals","","Bledsoe, Gleyn|Asatryan, Armen|et al.","Agriculture (General)","Oct 2006","","","","Independent evaluation of US Government agriculture sector activities in Armenia : revised final report","","PD-ACI-948","https://dec.usaid.gov/dec/content/Detail.aspx?ctID=ODVhZjk4NWQtM2YyMi00YjRmLTkxNjktZTcxMjM2NDBmY2Uy&rID=Mjk1NjEy","Armenia",""
"","Project title: Vulnerable children and war victims results package:|Displaced Children and Orphans Fund (DCOF)","Special Evaluation","Documents","DFD-M-00-04-00238-00","","1/1/2006 12:00:00 AM","","Child welfare services|Orphans|Disadvantaged groups|Child care|Social reform|Community services|Sociology education|Government policy|Policy reform|At-risk groups|Parents","Belarus","http://pdf.usaid.gov/pdf_docs/PDACJ022.pdf","572 KB","012158 - Manila Consulting Group, Inc.","","010864 - USAID. Bur. for Democracy, Conflict and Humanitarian Assistance. Ofc. of Democracy and Governance","English","application/pdf","Interim evaluation|Abandoned children|Institutionalization|Foster care","","Correll, Lucia","Displaced persons","2006","","","","Mid-term assessment and recommendations : Christian Children's Fund in Belarus","","PD-ACJ-022","https://dec.usaid.gov/dec/content/Detail.aspx?ctID=ODVhZjk4NWQtM2YyMi00YjRmLTkxNjktZTcxMjM2NDBmY2Uy&rID=Mjk1Nzcz","Belarus","9363102"
"","Project title: Child survival and health grants program (CSHGP)","Special Evaluation","Documents","GHS-A-00-04-00019-00","","11/1/2006 12:00:00 AM","","Maternal child health care|Child survival activities|Child nutrition|Maternal nutrition|Prenatal care|Reproductive health|Health delivery|Private voluntary organizations|Care of the newborn|Child feeding practices|Health service utilization|Post partum care|Quality of care","Tajikistan","http://pdf.usaid.gov/pdf_docs/PDACJ078.pdf","986 KB","013649 - Mercy Corps","","011222 - USAID. Bur. for Global Health. Ofc. of Health, Infectious Diseases, and Nutrition","English","application/pdf","Interim evaluation","","","Child survival","5 Nov 2006","","","","Midterm evaluation : improving maternal and child health in Northern Tajikistan : Sughd child survival project, Sughd Oblast, Tajikistan","","PD-ACJ-078","https://dec.usaid.gov/dec/content/Detail.aspx?ctID=ODVhZjk4NWQtM2YyMi00YjRmLTkxNjktZTcxMjM2NDBmY2Uy&rID=Mjk1OTU4","Tajikistan","9363114"
"","","Special Evaluation","Documents","EDH-I-00-03-00002-00","","7/1/2006 12:00:00 AM","","Basic education|Lower secondary education|Access to education|Educational infrastructure|Educational materials|Teacher training|Educational administration|Educational finance|Community mobilization|Local capacity building","Senegal","http://pdf.usaid.gov/pdf_docs/PDACJ079.pdf","2,195 KB","009054 - DevTech Systems, Inc.","","008600 - USAID. Mission to Senegal","English","application/pdf","Interim evaluation|Girls' education","","Tietjen, Karen|Prouty-Harris, Diane|et al.","Basic education","Jul 2006","","","","Mid-term assessment of the USAID/Senegal middle basic education program","","PD-ACJ-079","https://dec.usaid.gov/dec/content/Detail.aspx?ctID=ODVhZjk4NWQtM2YyMi00YjRmLTkxNjktZTcxMjM2NDBmY2Uy&rID=Mjk1OTU5","Senegal",""
"","Project title: Rural expansion of Afghanistan's community-based|healthcare program (REACH)","Special Evaluation","Documents","EEE-C-00-03-00021-00","","3/1/2006 12:00:00 AM","","Community health care|Health professional education|Rural areas|Occupational skill levels|Quality control|Training centers|Curriculum design|Medical education|Community based delivery|Quality of care","Afghanistan","http://pdf.usaid.gov/pdf_docs/PDACJ086.pdf","252 KB","000750 - Management Sciences for Health (MSH)","","000035 - U.S. Agency for International Development (USAID)","English","application/pdf","Interim evaluation|In-service training","","Erasmus, Panna","Health care","Mar 2006","","","","Rural expansion of Afghanistan's community-based healthcare (REACH) program : evaluation of the refresher training program","","PD-ACJ-086","https://dec.usaid.gov/dec/content/Detail.aspx?ctID=ODVhZjk4NWQtM2YyMi00YjRmLTkxNjktZTcxMjM2NDBmY2Uy&rID=Mjk1OTcw","Afghanistan",""
