Abstract,Ancillary_Data,Bibliographic_Type,ContentType,Contract_Grant_Number,Credit,Date_Resource_Created,Description,Descriptors_Topical,Descriptors_Geographic,File,File_Size,Inst_Author,Inst_Publisher,Inst_Sponsor,Language,Mime_Type,New_Thesaurus_Terms,Notes,Personal_Author,Primary_Subject,Publication_Date_Freeform,Related_Doc_Links,Report_Number,Series_Title,Title,Title_Translated,Unique_ID,URI,USAID_Geography,USAID_Project_Number
"","Task order no. 2","Special Evaluation","Documents","EPP-I-00-03-00015-00","","10/1/2006 12:00:00 AM","","Natural resource management|Forest resources|Coasts|Environmental management|Biological diversity|Natural resource conservation|Sustainable development|Landscape conservation","Kenya","http://pdf.usaid.gov/pdf_docs/PDACJ160.pdf","697 KB","011192 - PA Government Services, Inc. (PAGS)","","011325 - USAID. Bur. for Economic Growth, Agriculture and trade. Ofc of Agriculture","English","application/pdf","Interim evaluation|Nature based enterprises|Landscapes","","Swanson, Richard|Menczer, Karen|Michaels, Greg","Natural resources management","30 Oct 2006","","","","Kenya forest and coastal management programs : mid-term evaluation","","PD-ACJ-160","https://dec.usaid.gov/dec/content/Detail.aspx?ctID=ODVhZjk4NWQtM2YyMi00YjRmLTkxNjktZTcxMjM2NDBmY2Uy&rID=Mjk2MTM2","Kenya",""
"","Subgrant number: 23101-06-G-01","Special Evaluation","Documents","669-A-00-04-00009-00","","8/1/2006 12:00:00 AM","","Community development|Conflict resolution|Community participation|Networks|Local groups|Economic and social reintegration|Alternative dispute resolution|Technical training|Access to justice|Conflict prevention|Political stability","Liberia","http://pdf.usaid.gov/pdf_docs/PDACJ305.pdf","325 KB","012602 - CDA Collaborative Learning Projects","","008570 - USAID. Mission to Liberia","English","application/pdf","Interim evaluation|Political impact|Peace building","","","Conflict resolution","Aug 2006","","","","Creating a river between two fires : impact assessment of the locally initiated networks for community strengthening program (LINCS), Lofa County, Liberia","","PD-ACJ-305","https://dec.usaid.gov/dec/content/Detail.aspx?ctID=ODVhZjk4NWQtM2YyMi00YjRmLTkxNjktZTcxMjM2NDBmY2Uy&rID=Mjk2Mzkz","Liberia",""
"","Project title: Global health technical assistance (GH tech)|Portuguese ed.: PD-ACJ-390","Special Evaluation","Documents","GHS-I-00-05-00005-00","","11/1/2006 12:00:00 AM","","Maternal child health care|Reproductive health|Community health care|Provinces|Districts|Health care administration|Health education|Donor coordination|Health service utilization|Health behavior|Quality of care","Mozambique","http://pdf.usaid.gov/pdf_docs/PDACJ389.pdf","347 KB","011976 - QED Group, LLC","","010822 - USAID. Bur. for Global Health","English","application/pdf","Interim evaluation","","Kaplan, Fernanda|Kropsch, Lia","Maternal child health care","Nov 2006","","","GH tech report, no. 06-000-01","USAID/Mozambique midterm evaluation of strategic objective 8 (SO8) provincial/district/community-level activities","","PD-ACJ-389","https://dec.usaid.gov/dec/content/Detail.aspx?ctID=ODVhZjk4NWQtM2YyMi00YjRmLTkxNjktZTcxMjM2NDBmY2Uy&rID=Mjk2NTcx","Mozambique","9363098Aa"
"","At head of cover title: RAISE PLUS-limited scope of work : final|report|Cover date is December 2006, but title page period of performance|is November-February 2007|Project title: Rural and agricultural incomes with a sustainable|environment plus (RAISE plus)","Special Evaluation","Documents","AEG-I-00-04-00010-00","","12/1/2006 12:00:00 AM","","Natural resource management|Forest resources|Social forestry|Sustainable agriculture|Biological diversity|Revenues|Decentralization|Local groups","Senegal","http://pdf.usaid.gov/pdf_docs/PDACJ381.pdf","843 KB","007239 - Weidemann Associates, Inc.","","008600 - USAID. Mission to Senegal|011325 - USAID. Bur. for Economic Growth, Agriculture and trade. Ofc of Agriculture","English","application/pdf","Interim evaluation","","Pielemeier, John|Dorsey, John|Diop, Ousseynou","Natural resources management","Dec 2006","","","","Evaluation of USAID/agriculture and natural resources management program 'Wula Nafaa' : final report","","PD-ACJ-381","https://dec.usaid.gov/dec/content/Detail.aspx?ctID=ODVhZjk4NWQtM2YyMi00YjRmLTkxNjktZTcxMjM2NDBmY2Uy&rID=Mjk2NTcy","Senegal",""
"","Project title: Global health technical assistance (GH tech)|English ed.: PD-ACJ-389","Special Evaluation","Documents","GHS-I-00-05-00005-00","","11/1/2006 12:00:00 AM","","Maternal child health care|Reproductive health|Community health care|Provinces|Districts|Health care administration|Health education|Donor coordination|Health service utilization|Health behavior|Quality of care","Mozambique","http://pdf.usaid.gov/pdf_docs/PDACJ390.pdf","498 KB","011976 - QED Group, LLC","","010822 - USAID. Bur. for Global Health","Portuguese","application/pdf","Interim evaluation","","Kaplan, Fernanda|Kropsch, Lia","Maternal child health care","Nov 2006","","","GH tech report, no. 06-000-01","Avaliacao de meio-termo da USAID/Mocambique das actividades a nivel provincial/distrital/comunitario do objectivo estrategico 8 (SO8)","USAID/Mozambique midterm evaluation of strategic objective 8 (SO8) provincial/district/community-level activities","PD-ACJ-390","https://dec.usaid.gov/dec/content/Detail.aspx?ctID=ODVhZjk4NWQtM2YyMi00YjRmLTkxNjktZTcxMjM2NDBmY2Uy&rID=Mjk2NTcz","Mozambique","9363098Aa"
"","MOBIS SIN 874-01|Requisition/reference number: NMS # 2200/12506","Final Evaluation Report","Documents","DOT-O-00-06-00040-00","","10/1/2006 12:00:00 AM","","Societies in transition|Economies in transition|Political systems in transition|Conflict resolution|Community participation|Popular participation|Development cooperation|Political reconciliation|Conflict prevention|Community mobilization|Public-private cooperation","Haiti","http://pdf.usaid.gov/pdf_docs/PDACJ408.pdf","355 KB","003970 - Management Systems International, Inc. (MSI)","","","English","application/pdf","Final evaluation","","Jutkowitz, Joel M.|King, Deborah R.|Pierre, Yves F.","Democratization","Oct 2006","","","","Final evaluation of the Haiti transition initiative","","PD-ACJ-408","https://dec.usaid.gov/dec/content/Detail.aspx?ctID=ODVhZjk4NWQtM2YyMi00YjRmLTkxNjktZTcxMjM2NDBmY2Uy&rID=Mjk2NjE5","Haiti",""
"","At head of cover title: Raise PLUS set aside IQC|Task order # 07|Title in footer: Final report : evaluation of SPSNP and OFDA 2005|interventions|Related document: PD-ACI-640|Title page states: Period of performance, September-January 2007|Project title: Rural and agricultural incomes with a sustainable|environment plus (RAISE plus)","Special Evaluation","Documents","AEG-I-00-04-00010-00","","10/1/2006 12:00:00 AM","","Income generation|Famine|Food security|Economic diversification|Financial resources|Local financing|Community participation|Agricultural diversification|Assets|Beneficiary participation|Community mobilization|Funding mechanisms|Local capacity building","Ethiopia","http://pdf.usaid.gov/pdf_docs/PDACJ406.pdf","371 KB","007239 - Weidemann Associates, Inc.","","008543 - USAID. Mission to Ethiopia|011325 - USAID. Bur. for Economic Growth, Agriculture and trade. Ofc of Agriculture","English","application/pdf","Interim evaluation|Livelihood|Social safety net programs|Resource transfers","","Gray, George|Dastgeer, Ali|Desalegn, Gebremeskel","Food security","Oct 2006","","","","Evaluation of livelihood interventions funded through USAID famine fund support to the productive safety net program and OFDA 2005 livelihood annual program statement","","PD-ACJ-406","https://dec.usaid.gov/dec/content/Detail.aspx?ctID=ODVhZjk4NWQtM2YyMi00YjRmLTkxNjktZTcxMjM2NDBmY2Uy&rID=Mjk2NjIw","Ethiopia",""
"","Evaluated project title: Community action for nutrition and health|II (CANAH II)|Former project title: Child survival grants program (CSGP)|Project title: Child survival and health grants program (CSHGP)","Final Evaluation Report","Documents","FAO-A-00-98-00067-00","","8/1/2006 12:00:00 AM","","Child health care|Child nutrition|Community participation|Maternal child health care|Health finance|Health education|Health professional education|Health care administration|Child survival activities|Beneficiary participation|Community mobilization|Health behavior|Local capacity building|Quality of care","Senegal","http://pdf.usaid.gov/pdf_docs/PDACJ409.pdf","378 KB","006672 - Christian Children's Fund (CCF)","","011222 - USAID. Bur. for Global Health. Ofc. of Health, Infectious Diseases, and Nutrition","English","application/pdf","Final evaluation","","Sall, Guelaye","Child survival","Jul/Aug 2006","","","","Final evaluation of CANAH project II, FAO-A-00-98-00067-00 : final report","","PD-ACJ-409","https://dec.usaid.gov/dec/content/Detail.aspx?ctID=ODVhZjk4NWQtM2YyMi00YjRmLTkxNjktZTcxMjM2NDBmY2Uy&rID=Mjk2NjIx","Senegal","9380500|9363114"
"","On cover: Forer Kibogora Health District -- Dates : 12-29 September|2006|Included as Annex B: Rapid knowledge, practice and coverage (KPC)|survey report for final evaluation|Project title: Child survival and health grants program (CSHGP)|Former project title: PVO child survival grants program (CSGP)","Final Evaluation Report","Documents","HFP-A-00-01-00029-00","","1/1/2006 12:00:00 AM","","Child survival activities|Behavior change|Health education|IEC|Maternal child health care|Human capacity development|Community participation|Health professional education|Private voluntary organizations|Project sustainability|HIV/AIDS|Disease prevention and control|Diarrhea|Malaria","Rwanda","http://pdf.usaid.gov/pdf_docs/PDACJ411.pdf","1,120 KB","012401 - World Relief","","011222 - USAID. Bur. for Global Health. Ofc. of Health, Infectious Diseases, and Nutrition|010926 - USAID. Bur. for Democracy, Conflict and Humanitarian Assistance. Ofc. of Private and Voluntary Cooperation (PVC)","English","application/pdf","Final evaluation|Insecticide-treated nets (ITNs)","","Capps, Jean Meyer","Child survival","[2006]","","","","Rwanda 'Umucyo' (illumination) child survival project : final evaluation report","","PD-ACJ-411","https://dec.usaid.gov/dec/content/Detail.aspx?ctID=ODVhZjk4NWQtM2YyMi00YjRmLTkxNjktZTcxMjM2NDBmY2Uy&rID=Mjk2NjI1","Rwanda","9380500|9363114"
"","On cover: Community health initiative for the Districts of|Kouroussa and Mandiana, Guinea -- 1 October 2002-30 September 2006|Former project title: PVO child survival grants program (CSGP)|Contract listed on cover as FAO-A-98-000024-00|Project title: Child survival and health grants program (CSHGP)","Final Evaluation Report","Documents","FAO-A-00-98-00024-00","","12/1/2006 12:00:00 AM","","Child survival activities|Private voluntary organizations|Maternal child health care|Nutrition improvement|Micronutrients|Immunizations|HIV/AIDS|Family planning|IEC|Behavior change|Community participation|Health facilities|Health workers|Human capacity development|Development project management|Care of the newborn","Guinea","http://pdf.usaid.gov/pdf_docs/PDACJ412.pdf","1,277 KB","001407 - Save the Children (U.S.)","","011222 - USAID. Bur. for Global Health. Ofc. of Health, Infectious Diseases, and Nutrition|010926 - USAID. Bur. for Democracy, Conflict and Humanitarian Assistance. Ofc. of Private and Voluntary Cooperation (PVC)","English","application/pdf","Final evaluation","","Sarriot, Eric","Child survival","Dec 2006","","","","Child survival 18-Guinea : final evaluation report","","PD-ACJ-412","https://dec.usaid.gov/dec/content/Detail.aspx?ctID=ODVhZjk4NWQtM2YyMi00YjRmLTkxNjktZTcxMjM2NDBmY2Uy&rID=Mjk2NjI2","Guinea","9380500|9363114"
"","On cover: Location: Battambang Province, Cambodia --|USAID/BHR/PVC/CSH Cooperative Agreement No. HFP-A-00-01-00042-00 --|Beginning date: September 30, 2001 -- Ending date: September 29,|2006|Included as Attachment B: Final KPC survey|Included as Attached F2: CRS Cambodia health facility assessment|Former project title: PVO child survival grants program (CSGP)|Project title: Child survival and health grants program (CSHGP)","Final Evaluation Report","Documents","HFP-A-00-01-00042-00","","12/1/2006 12:00:00 AM","","Child survival activities|Private voluntary organizations|Primary health care|Community based delivery|IEC|Behavior change|Human capacity development|Project sustainability|Disease prevention and control|Immunizations|Respiratory diseases|Case management|Diarrhea|Malaria","Cambodia","http://pdf.usaid.gov/pdf_docs/PDACJ414.pdf","1,123 KB","007337 - Catholic Relief Services (CRS)","","011222 - USAID. Bur. for Global Health. Ofc. of Health, Infectious Diseases, and Nutrition|010926 - USAID. Bur. for Democracy, Conflict and Humanitarian Assistance. Ofc. of Private and Voluntary Cooperation (PVC)","English","application/pdf","Final evaluation","","","Child survival","27 Dec 2006","","","","Catholic Relief Services community based primary health care (child survival project) final evaluation report : October 2006","","PD-ACJ-414","https://dec.usaid.gov/dec/content/Detail.aspx?ctID=ODVhZjk4NWQtM2YyMi00YjRmLTkxNjktZTcxMjM2NDBmY2Uy&rID=Mjk2NjI4","Cambodia","9380500|9363114"
"","On cover: Implementing a XVIII child survival project -- October|2002-September 2006|Former project title: PVO child survival grants program (CSGP)|Project title: Child survival and health grants program (CSHGP)","Final Evaluation Report","Documents","HFP-A-00-02-00027-00","","12/1/2006 12:00:00 AM","","Child survival activities|Health delivery|Community health care|Behavior change|Respiratory diseases|Malaria|Child nutrition|HIV/AIDS|Diarrhea|Immunizations|Health professional education|Integrated management of childhood illnesses (IMCI)|Prevention of mother-to-child transmission of HIV (PMTCT)","Malawi","http://pdf.usaid.gov/pdf_docs/PDACJ415.pdf","397 KB","000627 - International Eye Foundation (IEF)","","011222 - USAID. Bur. for Global Health. Ofc. of Health, Infectious Diseases, and Nutrition|010926 - USAID. Bur. for Democracy, Conflict and Humanitarian Assistance. Ofc. of Private and Voluntary Cooperation (PVC)","English","application/pdf","Final evaluation","","Osborn, Garth","Child survival","31 Dec 2006","","","","Improved child survival in Nsanje District, Malawi through community based interventions and strengthening of the health delivery infrastructure : final evaluation report","","PD-ACJ-415","https://dec.usaid.gov/dec/content/Detail.aspx?ctID=ODVhZjk4NWQtM2YyMi00YjRmLTkxNjktZTcxMjM2NDBmY2Uy&rID=Mjk2NjI5","Malawi","9380500|9363114"
"","On cover: FY-2004 child survival and health grants program (CSHGP)|Project title: Child survival and health grants program (CSHGP)","Special Evaluation","Documents","GHS-A-00-04-00007-00","","10/1/2006 12:00:00 AM","","Child health care|Integrated health care|Child nutrition|Immunizations|Community health care|Health care administration|Health education|Prenatal care|Community mobilization|Health behavior|Integrated management of childhood illnesses (IMCI)","Cambodia","http://pdf.usaid.gov/pdf_docs/PDACJ416.pdf","6,121 KB","003689 - American Red Cross (AmRC). Ofc. of International Services","","011222 - USAID. Bur. for Global Health. Ofc. of Health, Infectious Diseases, and Nutrition","English","application/pdf","Interim evaluation|Insecticide-treated nets (ITNs)","","","Child survival","31 Oct 2006","","","","Mid-term evaluation report : integrated child health project, Siem Reap Province, Cambodia, October 1, 2004-September 30, 2008","","PD-ACJ-416","https://dec.usaid.gov/dec/content/Detail.aspx?ctID=ODVhZjk4NWQtM2YyMi00YjRmLTkxNjktZTcxMjM2NDBmY2Uy&rID=Mjk2NjMy","Cambodia","9363114"
"","Project title: Child survival and health grants program (CSHGP)","Special Evaluation","Documents","GHS-A-00-03-00011-00","","10/1/2006 12:00:00 AM","","Child survival activities|Maternal child health care|Private voluntary organizations|Provinces|Human capacity development|Access to services|Immunizations|Nutrition improvement|Disease prevention and control|Diarrhea|Respiratory diseases|Case management|Care of the newborn|Pneumonia","Afghanistan","http://pdf.usaid.gov/pdf_docs/PDACJ451.pdf","765 KB","001407 - Save the Children (U.S.)","","011222 - USAID. Bur. for Global Health. Ofc. of Health, Infectious Diseases, and Nutrition|010926 - USAID. Bur. for Democracy, Conflict and Humanitarian Assistance. Ofc. of Private and Voluntary Cooperation (PVC)","English","application/pdf","Interim evaluation","","Parker, Barbara|Ihsan, Tariq|et al.","Child survival","31 Oct 2006","","","","CS-19 Afghanistan : midterm evaluation r report","","PD-ACJ-451","https://dec.usaid.gov/dec/content/Detail.aspx?ctID=ODVhZjk4NWQtM2YyMi00YjRmLTkxNjktZTcxMjM2NDBmY2Uy&rID=Mjk2NjU5","Afghanistan","9363114"
"","External evaluation conducted: August-October 2006","Special Evaluation","Documents","GHS-A-00-04-00013-00","","11/1/2006 12:00:00 AM","","Tuberculosis|Disease prevention and control|Health outreach services|Community based delivery|Drug therapy|Networks|Integrated health care|Disease treatment|Health professional education|Paramedical education|Community health workers|Information management|Directly observed treatment, short course (DOTS)","Mexico","http://pdf.usaid.gov/pdf_docs/PDACJ452.pdf","543 KB","000989 - Project Concern International","","011222 - USAID. Bur. for Global Health. Ofc. of Health, Infectious Diseases, and Nutrition","English","application/pdf","Interim evaluation|High-risk groups","","","Disease prevention and control","30 Nov 2006","","","","SOLUCION TB, Strengthening observed therapy linking up community-based integrated outreach networks for TB control : Tijuana and Mexicali, Baja California, Mexico -- midterm evaluation","","PD-ACJ-452","https://dec.usaid.gov/dec/content/Detail.aspx?ctID=ODVhZjk4NWQtM2YyMi00YjRmLTkxNjktZTcxMjM2NDBmY2Uy&rID=Mjk2NjYw","Mexico",""
"","On cover: No. 2 -- October 2003-September 2008|Two attachments available separately (PN-ADI-862, PN-ADI-863)|Former project title: PVO child survival grants program (CSGP)|Project title: Child survival and health grants program (CSHGP)","Special Evaluation","Documents","FAO-A-00-99-00025-00","","10/1/2006 12:00:00 AM","","Child health care|Community health care|Households|Health education|Health outreach services|Health care coverage|Health care administration|Project sustainability|Community based delivery|Integrated management of childhood illnesses (IMCI)","Uganda","http://pdf.usaid.gov/pdf_docs/PDACJ459.pdf","728 KB","000235 - Africare, Inc.","","011222 - USAID. Bur. for Global Health. Ofc. of Health, Infectious Diseases, and Nutrition","English","application/pdf","Interim evaluation","","","Child survival","31 Oct 2006","","","","Africare community based integrated management of childhood illnesses (CIMCI-plus), Ntungamo District, Uganda : mid term evaluation report","","PD-ACJ-459","https://dec.usaid.gov/dec/content/Detail.aspx?ctID=ODVhZjk4NWQtM2YyMi00YjRmLTkxNjktZTcxMjM2NDBmY2Uy&rID=Mjk2NzE2","Uganda","9380500|9363114"
"","Task order 12|Global evaluation and monitoring indefinite quantity contract (GEM|IQC)","Special Evaluation","Documents","FAO-I-00-99-00010-00","","7/1/2006 12:00:00 AM","","Child welfare services|USAID|Sector restructuring|History|Development strategies|Sector policy|Delivery systems|Coordinating|Financing|Community participation|Child welfare","Romania","http://pdf.usaid.gov/pdf_docs/PDACH405.pdf","1,408 KB","012322 - Aguirre International","","011586 - USAID. Bur. for Europe and Eurasia. Ofc. of Democracy, Governance and Social Transition","English","application/pdf","","","Correll, Lucia|Correll, Tim|Predescu, Marius","Social problems","Jul 2006","","","","USAID and child welfare reform in Romania : challenges, successes, and legacy","","PD-ACH-405","https://dec.usaid.gov/dec/content/Detail.aspx?ctID=ODVhZjk4NWQtM2YyMi00YjRmLTkxNjktZTcxMjM2NDBmY2Uy&rID=Mjk2Nzk1","Romania",""
"","On cover: CSHGP cycle XIX 2003-2008|IRC's response has been appended|Project title: Child survival and health grants program (CSHGP)|Former project title: PVO child survival grants program (CSGP)","Special Evaluation","Documents","GHS-A-00-03-00012-00","","9/1/2006 12:00:00 AM","","Child survival activities|Post conflict societies|Maternal child health care|Child health care|Immunizations|Disease prevention and control|Malaria|Diarrhea|Respiratory diseases|Case management|Care of the newborn|Integrated management of childhood illnesses (IMCI)|Pneumonia","Sierra Leone","http://pdf.usaid.gov/pdf_docs/PDACJ536.pdf","686 KB","002440 - International Rescue Committee (IRC)","","011222 - USAID. Bur. for Global Health. Ofc. of Health, Infectious Diseases, and Nutrition","English","application/pdf","Interim evaluation","","Sarriot, Eric","Child survival","8 Sep 2006","","","","IRC Sierra Leone child survival grant in Kono District : mid-term evaluation report","","PD-ACJ-536","https://dec.usaid.gov/dec/content/Detail.aspx?ctID=ODVhZjk4NWQtM2YyMi00YjRmLTkxNjktZTcxMjM2NDBmY2Uy&rID=Mjk2OTIx","Sierra Leone","9363114|9380500"
"","Contract no. listed in document as: NE-I-000-00-0076-00","Special Evaluation","Documents","HNE-I-00-00-00076-00","","1/1/2006 12:00:00 AM","","Primary education|Primary schools|Literacy instruction|Arithmetic instruction|Student performance|Student testing|Impact assessment","Jamaica","http://pdf.usaid.gov/pdf_docs/PDACJ848.pdf","2,552 KB","000223 - Academy for Educational Development, Inc. (AED)","","008563 - USAID. Mission to Jamaica","English","application/pdf","Interim evaluation","","Lockheed, Marlaine|Harris, Abigail|et al.","Basic education","31 Jan 2006","","","","New Horizons for primary schools in Jamaica : inputs, outcomes and impact","","PD-ACJ-848","https://dec.usaid.gov/dec/content/Detail.aspx?ctID=ODVhZjk4NWQtM2YyMi00YjRmLTkxNjktZTcxMjM2NDBmY2Uy&rID=Mjk3Njkz","Jamaica",""
"","","Special Evaluation","Documents","","","4/1/2006 12:00:00 AM","","Development finance|Credit guarantees|USAID|Economic infrastructure|Financial institutions|Financing|Financial needs|Funding mechanisms","","http://pdf.usaid.gov/pdf_docs/PDACJ925.pdf","511 KB","009513 - Core International, Inc.","","012100 - USAID. Bur. for Economic Growth, Agriculture and Trade. Ofc. of Infrastructure and Engineering","English","application/pdf","Development Credit Authority (DCA)","","","Development finance","24 Apr 2006","","","","Lessons learned and emerging good practices in infrastructure guarantee programs under USAID's development credit authority","","PD-ACJ-925","https://dec.usaid.gov/dec/content/Detail.aspx?ctID=ODVhZjk4NWQtM2YyMi00YjRmLTkxNjktZTcxMjM2NDBmY2Uy&rID=Mjk3OTEy","Economic Growth Office",""
"","Contract listed in document as DOT-1-00-04-0002-00|Task order no. 2, sub-activity 9","Special Evaluation","Documents","DOT-I-00-04-00002-00","","5/1/2006 12:00:00 AM","","Energy supply|Civil society|Sector restructuring|Popular participation|Public awareness|Consumer education|Electric power distribution|Electric power generation|Energy research|Indigenous private voluntary organizations|Accountability|Community mobilization","Georgia","http://pdf.usaid.gov/pdf_docs/PDACL675.pdf","863 KB","000223 - Academy for Educational Development, Inc. (AED)","","012100 - USAID. Bur. for Economic Growth, Agriculture and Trade. Ofc. of Infrastructure and Engineering","English","application/pdf","Transparency|Media coverage|Ex post evaluation","","","Energy (General and research)","15 May 2006","","","","Evaluation final report : energy sector civil society initiatives in Georgia","","PD-ACL-675","https://dec.usaid.gov/dec/content/Detail.aspx?ctID=ODVhZjk4NWQtM2YyMi00YjRmLTkxNjktZTcxMjM2NDBmY2Uy&rID=Mjk3OTEz","Georgia",""
"","Project title: Educational quality improvement program 1 (EQUIP1)","Special Evaluation","Documents","GDG-A-00-03-00006-00","","7/1/2006 12:00:00 AM","","Primary education|Educational cooperation|Educational administration|Impact assessment|Community participation|Primary schools|Educational networking|Educational associations|School feeding programs|Quality of education|Community mobilization|Interactive radio instruction|Parents","Haiti","http://pdf.usaid.gov/pdf_docs/PDACK185.pdf","1,428 KB","000251 - American Institutes for Research (AIR)|012737 - Centre de Formation et d'Encadrement Technique (CFET)","","008554 - USAID. Mission to Haiti|011326 - USAID. Bur. for Economic Growth, Agriculture and Trade. Ofc. of Education","English","application/pdf","Parent-teacher associations (PTAs)|Impact evaluation","","","Educational delivery","27 Jul 2006","","","","Haiti : education 2004 project -- impact evaluation study","","PD-ACK-185","https://dec.usaid.gov/dec/content/Detail.aspx?ctID=ODVhZjk4NWQtM2YyMi00YjRmLTkxNjktZTcxMjM2NDBmY2Uy&rID=Mjk4NzE2","Haiti",""
"","Project title: Management of aquatic ecosystems through community|husbandry II (MACH II)","Special Evaluation","Documents","388-A-00-04-00001-00","","10/1/2006 12:00:00 AM","","Natural resource management|Income generation|Credit|Agricultural training|Management training|Educational surveys|Gender analysis|Impact assessment|Occupational opportunities|Wetlands|Natural resource utilization|Local groups|Stakeholder participation","Bangladesh","http://pdf.usaid.gov/pdf_docs/PDACK428.pdf","477 KB","012774 - Capacity Building Service Group (CBSG)|001798 - Winrock International","","008511 - USAID. Mission to Bangladesh","English","application/pdf","Stakeholder participation","","","Management training","Oct 2006","","","","Report on evaluation of credit and income generating training programs, MACH project : final draft","","PD-ACK-428","https://dec.usaid.gov/dec/content/Detail.aspx?ctID=ODVhZjk4NWQtM2YyMi00YjRmLTkxNjktZTcxMjM2NDBmY2Uy&rID=Mjk5MTYx","Bangladesh",""
