Abstract,Ancillary_Data,Bibliographic_Type,ContentType,Contract_Grant_Number,Credit,Date_Resource_Created,Description,Descriptors_Topical,Descriptors_Geographic,File,File_Size,Inst_Author,Inst_Publisher,Inst_Sponsor,Language,Mime_Type,New_Thesaurus_Terms,Notes,Personal_Author,Primary_Subject,Publication_Date_Freeform,Related_Doc_Links,Report_Number,Series_Title,Title,Title_Translated,Unique_ID,URI,USAID_Geography,USAID_Project_Number
"","","Final Evaluation Report","Documents","","","6/1/2006 12:00:00 AM","","Reproductive health|Maternal child health care|Child nutrition|Maternal nutrition|HIV/AIDS|Family planning services|Health outreach services|Health education|Child development|Community mobilization|Health indicators|Health impact","India","http://pdf.usaid.gov/pdf_docs/PDACI026.pdf","618 KB","010264 - CARE India","","008557 - USAID. Mission to India","English","application/pdf","Final evaluation","","Anderson, Mary Ann|Arora, Narendra|et al.","Health care","Jun 2006","","","","Reproductive and child health nutrition and HIV/AIDS program (RACHNA) : final evaluation","","PD-ACI-026","https://dec.usaid.gov/dec/content/Detail.aspx?ctID=ODVhZjk4NWQtM2YyMi00YjRmLTkxNjktZTcxMjM2NDBmY2Uy&rID=MjkzNjA3","India",""
"","Project title: Rural expansion of Afghanistan's community-based|healthcare program (REACH)|Related documents: PN-ADE-669 and PN-ADF-961","Special Evaluation","Documents","EEE-C-00-03-00015-00","","4/1/2006 12:00:00 AM","","Health delivery|Community based delivery|Rural populations|Health professional education|Community health workers|Health facilities|Health care administration|Preventive health care|Health care reform|Quality of care","Afghanistan","http://pdf.usaid.gov/pdf_docs/PDACI033.pdf","150 KB","000750 - Management Sciences for Health (MSH)","","008504 - USAID. Mission to Afghanistan","English","application/pdf","Interim evaluation","","Laumonier-Ickx, Laurence","Health facilities","Apr 2006","","","","Fully functional service delivery point in Afghanistan : results of two improvement cycles during one year -- (third external evaluation)","","PD-ACI-033","https://dec.usaid.gov/dec/content/Detail.aspx?ctID=ODVhZjk4NWQtM2YyMi00YjRmLTkxNjktZTcxMjM2NDBmY2Uy&rID=MjkzNjE5","Afghanistan",""
"","","Special Evaluation","Documents","","","9/1/2006 12:00:00 AM","","Development strategies|USAID|Political systems in transition|Popular participation|Community services|Development cooperation|Conflict resolution|Development program implementation|Conflict prevention|Political stability|Public-private cooperation","Haiti","http://pdf.usaid.gov/pdf_docs/PDACI044.pdf","181 KB","010972 - USAID. Bur. for Democracy, Conflict and Humanitarian Assistance. Ofc. of Transition Initiatives (OTI)","","","English","application/pdf","Political stability|Public-private cooperation","","Branchat, Philippe|Broughton, Stephanie","Democratization","Sep 2006","","","","Haiti transition initiative : reflections on program strategy and strengths 2004-2006","","PD-ACI-044","https://dec.usaid.gov/dec/content/Detail.aspx?ctID=ODVhZjk4NWQtM2YyMi00YjRmLTkxNjktZTcxMjM2NDBmY2Uy&rID=MjkzNjc0","Haiti",""
"","Project title: Displaced Children and Orphans Fund (DCOF)","Special Evaluation","Documents","DFD-M-00-04-00238-00","","1/1/2006 12:00:00 AM","","Street children|Child survival activities|Quality of life|Private voluntary organizations|Child labor|Orphans|Rights of the child|Child welfare services|At-risk groups","Dominican Republic","http://pdf.usaid.gov/pdf_docs/PDACI049.pdf","1,096 KB","012158 - Manila Consulting Group, Inc.","","010864 - USAID. Bur. for Democracy, Conflict and Humanitarian Assistance. Ofc. of Democracy and Governance","English","application/pdf","Displaced persons|Sexual exploitation|Child abuse|Commercial sex workers|Interim evaluation","","Williamson, John|James-Wilson, David","Displaced persons","2006","","","","Review of Catholic Relief Services' 'improving the quality of life for vulnerable children living in the streets of Santo Domingo (project Nina)'","","PD-ACI-049","https://dec.usaid.gov/dec/content/Detail.aspx?ctID=ODVhZjk4NWQtM2YyMi00YjRmLTkxNjktZTcxMjM2NDBmY2Uy&rID=MjkzNjg5","Dominican Republic","9363102"
"","Project title: Monitoring and evaluation performance program, phase|II (MEPP II)","Final Evaluation Report","Documents","267-C-00-05-00508-00","","5/1/2006 12:00:00 AM","","Public administration|Management development|Financial management|Public finance|Human capacity development|Governance|Local level|Decentralization|Economic administration|Local capacity building|Organizational capacity","Iraq","http://pdf.usaid.gov/pdf_docs/PDACI055.pdf","981 KB","001891 - International Business and Technical Consultants, Inc. (IBTCI)|000673 - International Science and Technology Institute, Inc. (ISTI)","","011765 - USAID. Mission to Iraq","English","application/pdf","Final evaluation","","","Public administration","1 May 2006","","","","Final integrated report : public sector capacity building evaluation","","PD-ACI-055","https://dec.usaid.gov/dec/content/Detail.aspx?ctID=ODVhZjk4NWQtM2YyMi00YjRmLTkxNjktZTcxMjM2NDBmY2Uy&rID=MjkzNzUw","Iraq",""
"","","Final Evaluation Report","Documents","","","6/1/2006 12:00:00 AM","","Conflict resolution|Peace|Regional level|War recovery|Economic infrastructure|Income generation|Health care|Safety education|Conflict prevention","Senegal|Gambia|Guinea-Bissau","http://pdf.usaid.gov/pdf_docs/PDACI085.pdf","554 KB","012457 - Channel Research","","008600 - USAID. Mission to Senegal","English","application/pdf","Final evaluation|Livelihood|Mines (explosives)","","Brusset, Emery|Kristensen, Marina Buch|Cissokho, Ndeye Bate","Conflict resolution","1 Jun 2006","","","","Evaluation of the USAID peace-building program in Casamance and sub-region","","PD-ACI-085","https://dec.usaid.gov/dec/content/Detail.aspx?ctID=ODVhZjk4NWQtM2YyMi00YjRmLTkxNjktZTcxMjM2NDBmY2Uy&rID=MjkzNzg3","Senegal",""
"","Project title: Africa's health in 2010","Special Evaluation","Documents","","","7/1/2006 12:00:00 AM","","Health care|Regional level|Health policy|Policy reform|Institution building|Local groups|HIV/AIDS|Obstetrics|Best practices|Cross-border linkages|Health care reform|Health care protocols|Local capacity building|Organizational capacity|Stakeholder participation","West Africa","http://pdf.usaid.gov/pdf_docs/PDACI087.pdf","579 KB","000223 - Academy for Educational Development, Inc. (AED)","","012312 - USAID. Bur. for Africa. Ofc. of West African Affairs. West Africa Regional Program (WARP)","English","application/pdf","Interim assessment|Interim evaluation","","Holfeld, Joyce|Ifenne, Enyantu|et al.","Health care","Jul 2006","","","","The USAID/West Africa regional health program : a mid-term assessment","","PD-ACI-087","https://dec.usaid.gov/dec/content/Detail.aspx?ctID=ODVhZjk4NWQtM2YyMi00YjRmLTkxNjktZTcxMjM2NDBmY2Uy&rID=MjkzNzg5","WEST AFRICA REGIONAL",""
"","'... commissioned by a consortium of donor agencies and 7 partner|governments under the auspices of the DAC Network on Development|Evaluation' -- preface|Related documents: PD-ACI-095, PD-ACI-097 through PD-ACI-102,|PN-ADH-336","Special Evaluation","Documents","","","5/1/2006 12:00:00 AM","","Nonproject assistance|Cash transfers|Development organizations|Partnerships|Economic impact|National budgets|Policy reform|Economic growth|Poverty|Expenditures|Public services|Public finance|Human capacity development|Market economy|Poverty reduction","Burkina Faso","http://pdf.usaid.gov/pdf_docs/PDACI096.pdf","2,473 KB","012459 - University of Birmingham. School of Public Policy. International Development Dept.","","","English","application/pdf","Interim evaluation","","Lanser, Piet|Dom, Catherine|et al.","Capital assistance (money transfers)","May 2006","","","A joint evaluation of general budget support 1994-2004 : Burkina|Faso, Malawi, Mozambique, Nicaragua, Rwanda, Uganda, Vietnam","Evaluation of general budget support -- Burkina Faso country report","","PD-ACI-096","https://dec.usaid.gov/dec/content/Detail.aspx?ctID=ODVhZjk4NWQtM2YyMi00YjRmLTkxNjktZTcxMjM2NDBmY2Uy&rID=MjkzODEy","Burkina Faso",""
"","'... commissioned by a consortium of donor agencies and 7 partner|governments under the auspices of the DAC Network on Development|Evaluation' -- preface|Related documents: PD-ACI-095, PD-ACI-096, PD-ACI-098 through|PD-ACI-102, PN-ADH-336","Special Evaluation","Documents","","","5/1/2006 12:00:00 AM","","Nonproject assistance|Cash transfers|Development organizations|Partnerships|Economic impact|National budgets|Policy reform|Economic growth|Poverty|Expenditures|Public services|Public finance|Human capacity development|Market economy|Poverty reduction","Malawi","http://pdf.usaid.gov/pdf_docs/PDACI097.pdf","1,272 KB","012459 - University of Birmingham. School of Public Policy. International Development Dept.","","","English","application/pdf","Interim evaluation","","Claussen, Jens|Amis, Philip|et al.","Capital assistance (money transfers)","May 2006","","","A joint evaluation of general budget support 1994-2004 : Burkina|Faso, Malawi, Mozambique, Nicaragua, Rwanda, Uganda, Vietnam","Evaluation of general budget support -- Malawi country report","","PD-ACI-097","https://dec.usaid.gov/dec/content/Detail.aspx?ctID=ODVhZjk4NWQtM2YyMi00YjRmLTkxNjktZTcxMjM2NDBmY2Uy&rID=MjkzODEz","Malawi",""
"","'... commissioned by a consortium of donor agencies and 7 partner|governments under the auspices of the DAC Network on Development|Evaluation' -- preface|Related documents: PD-ACI-095 through PD-ACI-097, PD-ACI-099|through PD-ACI-102, PN-ADH-336","Special Evaluation","Documents","","","5/1/2006 12:00:00 AM","","Nonproject assistance|Cash transfers|Development organizations|Partnerships|Economic impact|National budgets|Policy reform|Economic growth|Poverty|Expenditures|Public services|Public finance|Human capacity development|Market economy|Poverty reduction","Mozambique","http://pdf.usaid.gov/pdf_docs/PDACI098.pdf","1,806 KB","012459 - University of Birmingham. School of Public Policy. International Development Dept.","","","English","application/pdf","Interim evaluation","","Batley, Richard|Bjornestad, Liv|et al.","Capital assistance (money transfers)","May 2006","","","A joint evaluation of general budget support 1994-2004 : Burkina|Faso, Malawi, Mozambique, Nicaragua, Rwanda, Uganda, Vietnam","Evaluation of general budget support -- Mozambique country report","","PD-ACI-098","https://dec.usaid.gov/dec/content/Detail.aspx?ctID=ODVhZjk4NWQtM2YyMi00YjRmLTkxNjktZTcxMjM2NDBmY2Uy&rID=MjkzODE0","Mozambique",""
"","'... commissioned by a consortium of donor agencies and 7 partner|governments under the auspices of the DAC Network on Development|Evaluation' -- preface|Related documents: PD-ACI-095 through PD-ACI-098, PD-ACI-100|through PD-ACI-102, PN-ADH-336","Special Evaluation","Documents","","","5/1/2006 12:00:00 AM","","Nonproject assistance|Cash transfers|Development organizations|Partnerships|Economic impact|National budgets|Policy reform|Economic growth|Poverty|Expenditures|Public services|Public finance|Human capacity development|Market economy|Poverty reduction","Nicaragua","http://pdf.usaid.gov/pdf_docs/PDACI099.pdf","2,286 KB","012459 - University of Birmingham. School of Public Policy. International Development Dept.","","","English","application/pdf","Interim evaluation","","Gosparini, Paola|Carter, Rebecca|et al.","Capital assistance (money transfers)","May 2006","","","A joint evaluation of general budget support 1994-2004 : Burkina|Faso, Malawi, Mozambique, Nicaragua, Rwanda, Uganda, Vietnam","Evaluation of general budget support -- Nicaragua country report","","PD-ACI-099","https://dec.usaid.gov/dec/content/Detail.aspx?ctID=ODVhZjk4NWQtM2YyMi00YjRmLTkxNjktZTcxMjM2NDBmY2Uy&rID=MjkzODE1","Nicaragua",""
"","'... commissioned by a consortium of donor agencies and 7 partner|governments under the auspices of the DAC Network on Development|Evaluation' -- preface|Related documents: PD-ACI-095 through PD-ACI-099, PD-ACI-101,|PD-ACI-102, PN-ADH-336","Special Evaluation","Documents","","","5/1/2006 12:00:00 AM","","Nonproject assistance|Cash transfers|Development organizations|Partnerships|Economic impact|National budgets|Policy reform|Economic growth|Poverty|Expenditures|Public services|Public finance|Human capacity development|Market economy|Poverty reduction","Rwanda","http://pdf.usaid.gov/pdf_docs/PDACI100.pdf","1,519 KB","012459 - University of Birmingham. School of Public Policy. International Development Dept.","","","English","application/pdf","Interim evaluation","","Purcell, Ray|Dom, Catherine|Ahobamuteze, Gaspard","Capital assistance (money transfers)","May 2006","","","A joint evaluation of general budget support 1994-2004 : Burkina|Faso, Malawi, Mozambique, Nicaragua, Rwanda, Uganda, Vietnam","Evaluation of general budget support -- Rwanda country report","","PD-ACI-100","https://dec.usaid.gov/dec/content/Detail.aspx?ctID=ODVhZjk4NWQtM2YyMi00YjRmLTkxNjktZTcxMjM2NDBmY2Uy&rID=MjkzODE2","Rwanda",""
"","'... commissioned by a consortium of donor agencies and 7 partner|governments under the auspices of the DAC Network on Development|Evaluation' -- preface|Related documents: PD-ACI-095 through PD-ACI-100, PD-ACI-102,|PN-ADH-336","Special Evaluation","Documents","","","5/1/2006 12:00:00 AM","","Nonproject assistance|Cash transfers|Development organizations|Partnerships|Economic impact|National budgets|Policy reform|Economic growth|Poverty|Expenditures|Public services|Public finance|Human capacity development|Market economy|Poverty reduction","Uganda","http://pdf.usaid.gov/pdf_docs/PDACI101.pdf","2,519 KB","012459 - University of Birmingham. School of Public Policy. International Development Dept.","","","English","application/pdf","Interim evaluation","","Lister, Stephen|Baryabanoha, Wilson|et al.","Capital assistance (money transfers)","May 2006","","","A joint evaluation of general budget support 1994-2004 : Burkina|Faso, Malawi, Mozambique, Nicaragua, Rwanda, Uganda, Vietnam","Evaluation of general budget support -- Uganda country report","","PD-ACI-101","https://dec.usaid.gov/dec/content/Detail.aspx?ctID=ODVhZjk4NWQtM2YyMi00YjRmLTkxNjktZTcxMjM2NDBmY2Uy&rID=MjkzODE4","Uganda",""
"","Related documents: PD-ACI-095 through PD-ACI-101, PN-ADH-336","Special Evaluation","Documents","","","1/1/2006 12:00:00 AM","","Nonproject assistance|Cash transfers|Development organizations|Partnerships|Economic impact|National budgets|Policy reform|Economic growth|Poverty|Expenditures|Public services|Public finance|Human capacity development|Market economy|Poverty reduction","Vietnam","http://pdf.usaid.gov/pdf_docs/PDACI102.pdf","600 KB","012459 - University of Birmingham. School of Public Policy. International Development Dept.","","","English","application/pdf","Interim evaluation","","Bartholomew, Ann|Leurs, Robert|McCarty, Adam","Capital assistance (money transfers)","18 Jan 2006","","","A joint evaluation of general budget support 1994-2004 : Burkina|Faso, Malawi, Mozambique, Nicaragua, Rwanda, Uganda, Vietnam","Evaluation of general budget support -- Vietnam country report","","PD-ACI-102","https://dec.usaid.gov/dec/content/Detail.aspx?ctID=ODVhZjk4NWQtM2YyMi00YjRmLTkxNjktZTcxMjM2NDBmY2Uy&rID=MjkzODIw","Vietnam",""
"","","Final Evaluation Report","Documents","","","4/1/2006 12:00:00 AM","","Food for Peace Title II|Food security|Agricultural productivity|Agricultural product marketing|Agricultural finance|Nutrition education|Food aid programs|HIV/AIDS|Food aid monetization","Uganda","http://pdf.usaid.gov/pdf_docs/PDACI106.pdf","263 KB","","","010990 - USAID. Bur. for Democracy, Conflict and Humanitarian Assistance. Ofc. of Food for Peace (FFP)","English","application/pdf","Final evaluation|People living with AIDS (PLWA)","","Pierce, Robert, Jr.|Gardner, Alison","Food aid programs","Apr 2006","","","","ACDI/VOCA : Uganda -- FY 2002-2006 Title II DAP : final evaluation report","","PD-ACI-106","https://dec.usaid.gov/dec/content/Detail.aspx?ctID=ODVhZjk4NWQtM2YyMi00YjRmLTkxNjktZTcxMjM2NDBmY2Uy&rID=MjkzODM1","Uganda",""
"","","Final Evaluation Report","Documents","","","1/1/2006 12:00:00 AM","","Potable water|Rural areas|Household based delivery|Water quality|Water supply engineering|Civic action|Aquatic resource management|Municipal level","El Salvador","http://pdf.usaid.gov/pdf_docs/PDACI143.pdf","655 KB","008540 - USAID. Mission to El Salvador","","","English","application/pdf","Final evaluation","","","Potable water","[2006]","","","","Strategic objective no. 519-004 : 'increased access by rural households to clean water', 1998-2005 -- close-out report","","PD-ACI-143","https://dec.usaid.gov/dec/content/Detail.aspx?ctID=ODVhZjk4NWQtM2YyMi00YjRmLTkxNjktZTcxMjM2NDBmY2Uy&rID=MjkzODkz","El Salvador",""
"","","Final Evaluation Report","Documents","","","1/1/2006 12:00:00 AM","","Democratization|Governance|Rule of law|Popular participation|Public administration|Municipal level|Electoral systems|Democracy","El Salvador","http://pdf.usaid.gov/pdf_docs/PDACI144.pdf","784 KB","008540 - USAID. Mission to El Salvador","","","English","application/pdf","Final evaluation","","","Democratization","[2006]","","","","Strategic objective no. 519-002 : 'more inclusive and effective democratic processes' -- close-out report","","PD-ACI-144","https://dec.usaid.gov/dec/content/Detail.aspx?ctID=ODVhZjk4NWQtM2YyMi00YjRmLTkxNjktZTcxMjM2NDBmY2Uy&rID=MjkzODk0","El Salvador",""
"","Cover title also includes: RAISE PLUS-limited scope of work : final|report|Task order no. 03|Project title: Rural and agricultural incomes with a sustainable|environment plus (RAISE plus)","Special Evaluation","Documents","AEG-I-00-04-00010-00","","6/1/2006 12:00:00 AM","","Environmental management|Aquatic resource management|Forestry|Tropical rain forests|Protected environmental areas|Natural resource conservation|Ecosystems|Community participation","Bangladesh","http://pdf.usaid.gov/pdf_docs/PDACI145.pdf","361 KB","007239 - Weidemann Associates, Inc.","","011325 - USAID. Bur. for Economic Growth, Agriculture and trade. Ofc of Agriculture","English","application/pdf","Interim evaluation","","Whitford, Peter W.|Tegler, Brent|et al.","Environmental management","Jun 2006","","","","Evaluation of USAID/Bangladesh environment program","","PD-ACI-145","https://dec.usaid.gov/dec/content/Detail.aspx?ctID=ODVhZjk4NWQtM2YyMi00YjRmLTkxNjktZTcxMjM2NDBmY2Uy&rID=MjkzODk1","Bangladesh",""
"","Cover title also includes: RAISE PLUS-limited scope of work : final|report|Task order no. 06|ANRS=Amhara National Regional State|Project title: Rural and agricultural incomes with a sustainable|environment plus (RAISE plus)","Final Evaluation Report","Documents","AEG-I-00-04-00010-00","","6/1/2006 12:00:00 AM","","Food aid programs|Sustainable development|Community self help|Agricultural development|Natural resource management|Human nutrition|Health care|Microenterprises|Integrated development programs|Local capacity building","Ethiopia","http://pdf.usaid.gov/pdf_docs/PDACI146.pdf","1,013 KB","007239 - Weidemann Associates, Inc.","","008543 - USAID. Mission to Ethiopia|011325 - USAID. Bur. for Economic Growth, Agriculture and trade. Ofc of Agriculture","English","application/pdf","Final evaluation|Aid dependency","","Moussie, Menwuyellet|Berhanu, Tesfa|Bekele, Etenesh","Disaster relief and response","Jun 2006","","","","Final evaluation report of the relief to development (R2D) pilot project in Sekota and Gubalafto Woredas, ANRS","","PD-ACI-146","https://dec.usaid.gov/dec/content/Detail.aspx?ctID=ODVhZjk4NWQtM2YyMi00YjRmLTkxNjktZTcxMjM2NDBmY2Uy&rID=MjkzODk2","Ethiopia",""
"","Cover title also includes: RAISE PLUS-limited scope of work : final|report|Task 553|Project title: Rural and agricultural incomes with a sustainable|environment plus (RAISE plus)","Special Evaluation","Documents","AEG-I-00-04-00010-00","","6/1/2006 12:00:00 AM","","Rural development|Crop substitution|Income generation|Farm income|Employment|Crop production|Agricultural product marketing|Post harvest operations|Border areas|Farmer organizations","Ecuador","http://pdf.usaid.gov/pdf_docs/PDACI147.pdf","1,162 KB","007239 - Weidemann Associates, Inc.","","008538 - USAID. Mission to Ecuador|011325 - USAID. Bur. for Economic Growth, Agriculture and trade. Ofc of Agriculture","English","application/pdf","Interim evaluation|Alternative development","","Bunker, Arvin|Letelier, Veronica|Cardoso, Victor Hugo","Economic growth and development","Jun 2006","","","","Technical evaluation of the Ecuador northern border income and employment project implemented by Associates in Rural Development, Inc. [ARD] : final report","","PD-ACI-147","https://dec.usaid.gov/dec/content/Detail.aspx?ctID=ODVhZjk4NWQtM2YyMi00YjRmLTkxNjktZTcxMjM2NDBmY2Uy&rID=MjkzODk3","Ecuador",""
"","General management assistance contract (GMAC)|MTI subcontract no. 0172-0406-PO-ME16","Final Evaluation Report","Documents","674-C-00-01-00051-00","","7/1/2006 12:00:00 AM","","Pollution control|Air pollution|Urban areas|Public administration|Municipal level|Human capacity development","South Africa","http://pdf.usaid.gov/pdf_docs/PDACI181.pdf","445 KB","010840 - Palmer Development Group|011502 - Mega-Tech Inc.","","008605 - USAID. Mission to South Africa","English","application/pdf","Final evaluation|Greenhouse gases (GHG)","","","Pollution","Jul 2006","","","","Final evaluation report : deliverable 3","","PD-ACI-181","https://dec.usaid.gov/dec/content/Detail.aspx?ctID=ODVhZjk4NWQtM2YyMi00YjRmLTkxNjktZTcxMjM2NDBmY2Uy&rID=MjkzOTYw","South Africa",""
"","General management assistance contract (GMAC)|Subcontract no. 0170-0206-PO-ME15","Final Evaluation Report","Documents","674-C-00-01-00051-00","","5/1/2006 12:00:00 AM","","Government departments|Municipal level|Privatization of services|Partnerships|Technical assistance|Human capacity development|Case studies|Public services|Public-private partnerships","South Africa","http://pdf.usaid.gov/pdf_docs/PDACI182.pdf","405 KB","011502 - Mega-Tech Inc.","","008605 - USAID. Mission to South Africa","English","application/pdf","Final evaluation","","Martin, Richard|Somers, Oscar","Communities","3 May 2006","","","","Municipal Infrastructure Investment Unit [MIIU] technical assistance project final evaluation: final report","","PD-ACI-182","https://dec.usaid.gov/dec/content/Detail.aspx?ctID=ODVhZjk4NWQtM2YyMi00YjRmLTkxNjktZTcxMjM2NDBmY2Uy&rID=MjkzOTYx","South Africa",""
"","General management assistance contract (GMAC)|MTI subcontract no. 0171-0406-PO-ME17","Special Evaluation","Documents","674-C-00-01-00051-00","","8/1/2006 12:00:00 AM","","Employment|Strategic objectives|Grants|Impact assessment|Small scale enterprises|Microenterprises|Economic sectors","South Africa","http://pdf.usaid.gov/pdf_docs/PDACI183.pdf","1,042 KB","012486 - Siana Strategic Advisors (PTY) Ltd|011502 - Mega-Tech Inc.","","008605 - USAID. Mission to South Africa","English","application/pdf","","","Pearson, Roland|Naidoo, Sharda","Employment","16 Aug 2006","","","","Assessment of the impact of program activities directed toward achieving the USAID-South Africa strategic objective (SO9) of 'increased market-driven employment' : FY 2000 to FY 2007 -- final report","","PD-ACI-183","https://dec.usaid.gov/dec/content/Detail.aspx?ctID=ODVhZjk4NWQtM2YyMi00YjRmLTkxNjktZTcxMjM2NDBmY2Uy&rID=MjkzOTYy","South Africa",""
"","","Final Evaluation Report","Documents","HDA-I-23-03-00124-00|HDA-I-00-03-00124-00","","10/1/2006 12:00:00 AM","","Post conflict societies|Societies in transition|War recovery|Economic and social reintegration|Human capacity development|Youth|Governance|Civil society|Public awareness|Conflict resolution","Liberia","http://pdf.usaid.gov/pdf_docs/PDACI199.pdf","415 KB","011933 - Social Impact, Inc.","","010972 - USAID. Bur. for Democracy, Conflict and Humanitarian Assistance. Ofc. of Transition Initiatives (OTI)","English","application/pdf","Final evaluation","","Blue, Richard|Bruce, Beverlee","Post conflict societies","19 Oct 2006","","","","Final evaluation : the Liberia transition initiative (2004-2006)","","PD-ACI-199","https://dec.usaid.gov/dec/content/Detail.aspx?ctID=ODVhZjk4NWQtM2YyMi00YjRmLTkxNjktZTcxMjM2NDBmY2Uy&rID=MjkzOTgw","Liberia",""
"","Project title: Child survival and health grants program (CSHGP)","Special Evaluation","Documents","GHS-A-00-03-00002-00","","10/1/2006 12:00:00 AM","","Child survival activities|Maternal child health care|Access to services|Emergency medical care|Child delivery|Health professional education|Traditional birth attendants|Community based delivery|Reproductive health|Behavior change|IEC|Infant nutrition|Disease prevention and control|Malaria|Diarrhea|Breastfeeding","Senegal","http://pdf.usaid.gov/pdf_docs/PDACI256.pdf","220 KB","000235 - Africare, Inc.","","011222 - USAID. Bur. for Global Health. Ofc. of Health, Infectious Diseases, and Nutrition","English","application/pdf","Interim evaluation|Health referrals","","Sanwogou, Kim|Dean, Jim, ed.|et al.","Child survival","Oct 2006","","","","Tambacounda healthy start program : health districts of Tambacounda and Koumpentoum in Senegal (2003-2008) -- mid-term evaluation report","","PD-ACI-256","https://dec.usaid.gov/dec/content/Detail.aspx?ctID=ODVhZjk4NWQtM2YyMi00YjRmLTkxNjktZTcxMjM2NDBmY2Uy&rID=Mjk0MTMy","Senegal","9363114"
